작성자,내용,추천수
user-lt3tu1no2w,"항소 했다는데, 가석방없는 무기징역 2심에도 판결나길 간절히 바랍니다. 이 인간들은 반성도 없는 인귄도 없는 악질입니다.",64
minsookpark1676,판사님. 감사드립니다. 이런범죄는 정말사형에처해야된다고 생각했는데. 그래도. 돌아신분에. 한을. 판사님이. 풀어주신것같네요. 돌아가신분이. 감사드릴거라생각되네요 앞으로 또 이런범죄는. 다시는. 일나지않았으면. 좋겠네요. 법을 좀 강하게 만들주었음하네요.,52
user-hj3sv1rz3p,"저 사악한 여자한테 걸려서 아까운 인생을 송두리째 잃어버린 남자 …고인의 명복을 빕니다,이은해 !! 너는 감옥에서 철저히 반성하지 않으면 안될것이야",70
user-fe3sc9zq3w,검사님 판사님 존경합니다 저 악마들은 선처가 1도 필요없고 남편이 지를만나 지옥을경험하고 죽음까지 가게한것에 비해 .본인이 지옥을 경험한다는 말자체가 이기적인것입니다. 항소하고 2심도 원심과 똑같길 바랍니다 대한민국 법이 무서워야 같은 범죄가 안일어납니다,59
user-sr9ls9eo3i,끝까지 아니라고하네.이들을 꼭 그에 맞는 벌을 받게 해주세요,45
user-pd3dg3wj6u,와. 법이살아있다는 걸 보여주는것같아서 속이훈련합니다 판사님검사님 감사합니다 정인이 건도 기대합니다.,53
lucylee3755,아직도 반성하지 않은 저것들은 진짜 사람이 아니다!!! 피해자 가족들한테 반드시 사죄해라!!!,9
danielt8443,사랑하지 않은데 결혼한것부터가 이상하네요 고인의 명복을 빕니다.,49
user-dc7ui9wz4l,삼척동자도 다 아는사실인데 끝까지아니라니 어떤 구형이나오나했는데 정말 감사합니다. 악랄한인간들 그렇고도 살아남길바라나! 이런쓰레기같은인간들은지구상에서없어져야합니다.,9
user-fx1pg8xq4o,최대한의 고문끝에 사형시키세요 고인의 상처를 생각하면 이것들은 당장이라도 죽이고싶지만 서서히 스스로 자살할때까지 고문좀 해주세요,19
Mia-re3oe,대한민국 사법은 피의자에 인권을 보호 하는 나라라고 하지않게 죽은 피해자를 보호 하는 사법부가 되게해야 합니다 돈때문에 생명을 뺏은 인간들을 보호 하지말고 불쌍하게 이용만당하다 죽임을당한 피해자 를 위한 사법부가 되어야한다,10
user-ov8fe9mn4e,와 진짜 갑만에 사이다 형량 나왔네,71
user-xg1rx2tf4j,끔찍한 거머리들. 한 사람의 인생을 ㅜㅜ,31
jzl7613,이 판사님은 좀 괜찮은 분이시네요,9
user-li3if7dt4k,무기징역 아라도 죽은사람의 억울함이 풀랄까 악마,35
user-ku5yd5oi6x,지혜로운 판사님에 형에 박수보냅니다,2
wonsk6560,판사님 사실의 요체를 정확하게 파악하시고 정의가 승리 한다는거 진실은 감추려 해도 감춰지지 않는 다는거 보여주셔서 국민으로서 감사드립니다,0
chunjoo02,"그래, 사형보다 디지는 그날까정, 구속된 인생이 더 어울리겠다.",48
user-ze1fm5nn4u,검사님 판사님 ..정의로운 판결 부탁드립니다 죄질 안좋은 반성없는 뻔뻔한 악마악녀 강력처벌 해주세요.. 본보기로 더더욱 강력처벌 보여 주셔야합니다 절대 선처 해주시면 안됩니다 부디 다시는 이런 사건들이 일어나지 않도록 부탁 드리겠습니다,6
user-sr4ye8sy3q,구형도 꼭 그대로 때려주세요. 구형이 중요합니다. 전국민이 이해 하질 못할 형을 내리지 않을것을 전 기대해 봅니다.,13
Lauraaa6666,악마들을 끝까지 발뺌 유족들은 힘내세요,3
user-hd8ku5ik3z,끝까지재대로된판결보여주시길바랍니다 지금봐도화나네요,1
challo9427,판사가 구형 낮추면.. 평생먹을 욕 한꺼번에 먹을거다.,22
user-fx1og1oj8j,와 속이 다후련하내요,4
susankim7419,너무너무 착한남편을... 악마에게 사용당하고 살았네 감옥에서 새 삶을 만나고 봉사하는 사람들 되길를...,10
user-jw7ls3nb6r,이런 ㄴㄴ을 살려두다니️️,7
user-dq8sx8fe5c,두분~~~축하드립니다!,15
gjo1542,"무기징역 구형이 아니라, 사형을 구형해서 사형 성고되면, 사형을 실행해야...",15
user-fd8vg8km4e,지옥에나 갈것임 .. 삼가고인에 명복을 빕니다 ㅜ,19
user-qm4mv9nz1s,일단 할머니급 나이까지 확정 좀더 더 기간이 연장되면 좋겠네요,1
ellenchoi5815,그냥 잠들게하는게 어떠한지 악마가 그영혼을잠식했다,5
psasa1004,제발 이은혜 몇년후 무기징역에서 나중에 형량 줄어주지 말길...,11
user-dd6pn9yp2u,국민의 혈세로 악귀들을 먹여주고 재워주고 입혀주는 유토피아,2
SGolds-qh1ch,이은해님이 무척이나 억울하리라 생각을 해야 자유민주주의 국가에서 살고 계신 분들이라고 생각합니다. 저 판사는 중공에서 모셔오신 분입니까?,6
user-fw4dw1ge6h,언어폭력도 이젠 살인급이 인정되어지네 너무 좋다. 범죄자들 피해자괴롭힌죄 법원에 반성문 제출한 죄 달게 받아져라 차곡차곡 쌓여서 무너질수없이 본인들 반성문수준처럼,6
yhji1756,저런 쓰레기들이 훌륭한 인재를 사망케 하는것은 우리 사회적으로도 엄청난 손해이기도 하다.,7
user-in7dk4ih6k,정말 나쁜인간들 죽을때까지 감방에 있거라,2
ApexGolem,이게 바로 정의지.,12
bongseoklee4006,왜 사형 사키지 않는지? 참 세태가 무섭다.,15
jung-yj1co,당연한 판결입니다 악마는 악마법으로 ~,4
user-zh2vy5ee7b,"아직 확판된거 아닙니다.1심이니까 2심에서는 형량이 줄겠군요. 직접살인이 아니다, 살인 방조다, 심신미약 등등으로 감형될듯 ㅡㅡ 나라밥 오래오래 먹게 해주세요. 제발....",6
pcahxj,저렇게 젊은 분이 평생을 감옥에서 썩어야한다니. 기쁘네요.,3
sandylee4528,참 ! 양심이 마비된 인간 정말 무섭다. 이런 인간들은 사형처리 해도 무리가 없다. 왜냐하면 양심이 죽은 인간은 이미 죽은 자나 다름없다. 시체 들이다.,2
user-lm3im8xe9z,진짜 정인이 사건도 두사람다 다시 재판 제대로해주세요 두죄인다 무기받아야하는거아닌가요 상상만해도 그어린것이 얼마나 아프고 배가고팟을까요 부디 그두것들 무기내려주세요,2
onfamily86,제발 항소심때 그대로가라 줄이지말고ㅜㅜ,13
user-mh3vl3tf7f,사회정의실천을 위해 무기. 사형 . 선고해 주세요 가석방도 없는,4
user-eg2yi3td9v,참 세상...너희같은것들과 같이숨쉬고살았다는게 참담하다...금수만도못한 공공의곰팡이들,16
user-rd2rv4bl6o,이들은 사회에 나오면 안됩니다. 사형제도가 없어진게 안타깝네요.,1
user-zk7dr3wm2c,인간탈을 쓰고난 악마들아 세상에 나오지마라,3
user-is4ow7fp7s,우리나라는 살인하고 사람이라 부르기 어려운 저것들을 인권이라는 프레임을 씌워주고 내 세금 깍아 먹으며 보호하는 나라~ 이게 맞나요? 앉아서 컴퓨터 타자나 두드리지 어디 한번 착하게 살아가는 사람들의인권은 재대로 살피는지~~~기가 차서 말이 안나오네요. 대한민국은 그러믄 안돼~~좀더 가면 이젠 진짜사람이 없는 그런 세상이 된다니까?,4
Vince-ob8vz,정말... 사형제도는 없는건가요?,7
user-jq8mf3jp5n,아니 이건 억울한것도없는건데 진짜 사형좀시켜라!!! 악마를 왜 살려놓냐? 살인자는 편하게 살게하고 죽은사람은 억울하게 죽어야하냐? 진짜 사형좀시켜라!! 진짜!!!,0
user-rw4kd1zf2r,저 얼굴두꺼운 살인자들 진짜 극혐이다 근데 1심이네 2심도 꼭 무기징역 되길바람,10
user-kj3om2jo9w,일단 항소했다는건 반성할 생각이 조금도 없고 그냥 억울하다는 뜻임,3
user-mw7xb2wt5u,악마 커풀 천벌 받았다 고인의 명복을 빕니다,1
user-px6iy7pi9j,못된걸들. 착한사람을이용해쳐먹고. 저런인간들은 사형시켜야한다,1
user-yt5rc9fo8q,사형제도 부활 시켜라 제발 저것들이 사람이가?,0
user-py6bp7og4g,이은해 남자 친구들은 모두죽고 이세상에 없는데 참 슬픈세상..,2
user-eg3pd6vo3t,전자발찌도 풀지 못하게 몸에다가 심어야된다 ㅡㅡ이번제판은 그나마 맘에드네요 판사님 화이팅 입니다^^,3
seungkookang9896,평생 죄책감 느끼면서 살아라…,1
user-sn5vy1gz2i,상대를죽이면 마땅히똑같은 벌을받아야한다ㅜ이것이야말로 공정이다,4
user-uc2dm1uy8p,사형제도 부활하여 사형으로 판결이 되었으면 좋겠어요. 감면없는 무기형으로.,2
user-sh5nx5oq1h,그알에서 언급 안하고 유명해진 사건이 아니었다면 선고는 13년이 적절했었다 재판부는 언론의 집중도를 벗어난 판결을 해야되는데 그게 아닌거지... 이 사건보다 더 악마스러운 사건번호도 엄청 많다는게 개탄스럽다.,0
mark-xm7qs,왜 무기징역이죠? 사형때려야죠 공범 모두다,3
navi-uk7fj,2심에서 감형될까 걱정입니다 2심에서도 감형없는 무기징역 바래봅니다 피해자분이 너무 불쌍합니다 ㅠ,3
tomghim3331,잘 했다. 이런 살인자들은 살 자격이 없다. 남을 죽이고 죄를 뉘우치지 않는죄는 더욱 크다. 사실 남을 의도적으로 죽인자들은 사형에 처해야 정상이다. 실수로 죽인것이 아니고 의도적으로 사람을 죽인자들은 살려주고 감방에서 국민들의 혈세로 밥 먹여주고 잠 재워줄 이유가 없다. 왜 살려 주어야 하는가. 남을 죽인자들은 본인들도 당연히 죽어야 한다는것을 모든 국민들에게 보여 주어야 앞으로 이런 일 들이 없어진다.,1
user-oh3zx2wm3p,말로만 결혼했다고 하고 따로 살면서 조현수랑 부부처럼 살고 돈은 죽은 고인한테 다 뜯어내고 결국 목숨값까지 받으려고 했단 희대의 악마들 영원히 나오지 마라,1
jamespark3510,"이게 진정한 지옥이다 ㅋㅋㅋㅋ 저런 여자한데는 자신에 젊음을 다 강탈당하고, 나이만 먹고 감옥에서 나와야한다고 하면 솔직히 죽음을 택햇을꺼다",2
user-og3zy6wl8z,이 형량에서 절대 더 내리지 마라! 이 ㄴㄴ은 무기징역도 아깝다!,1
user-cq5je8wz7j,저런 인간들을 변호해주는 변호사도 정상적인 인간은 아닐듯,2
user-bi3ix8ph1k,지가 지옥이 뭔지는 아나? 어텋게 저런게 인간일수있을까 무기징역이 아니라 감옥에서 고통이 어떤가를 뼈저리게 당해봐라 죽은사람이 너무불쌍해,1
Lee-ii4qy,전낭친 사망사건이나 전남편한테 했던 악마같은 짓거리들은 사형이 당연한데 무기징역은 ᆢ 가석방없는 ᆢ사회에 나오면 절때 안되는 인간이며 재산도 모두 압수해야 함ᆢ,1
user-vs2ee8ub9k,항소에서 20년+30년=50년 해주이소!!! 죄값을 철저히받자,2
user-rg4mx4ij7s,검사님 감사합니다,1
yukwae,법원에선 아무리 범죄자라도 사회를 돌아가게 하는 일원으로 보고 갱생 후 돌려보낼 의도까지 고려해 형량을 주는데 쟤들은 진짜 재활용이 안 될 인간쓰레기로 판단했나보다..;,0
user-ux2lk2cr7r,남들다 아는거 지혼자 아니라네 저런 꽃뱀들이 경각심갖게 사회와 평생 격리,5
user-mj5qy1kf2o,이은해 쌤통이다 너는 진짜 무기징역 처음부터 받았어야 했을 인간인데 말이다 그리고 이은해 가 시킨다고 가담한 조현수랑 공범도 진짜 형벌 을 쎄게 갔어야 했는데 조현수를 30년 주는거 는 좀 아니였다 ㅡㅡ,2
user-zd6sk2uk8i,너무큰 잘못을했기에 무기징역 사형이답,2
shdstwins,저것들은 사형도 아깝지 죽은 사람만 불쌍하지ㅠ,0
user-mr9os5te3c,모두사형시켜라,2
user-md4gn8wf9o,나이스 ~ 제발 범죄자들 얼굴공개해라.... 범죄자가 인권이 어딧냐~,2
user-su5gl8pw4p,감형은 제발 해주지 마세요,1
mellanysorrow,사형 다시 집행해서 사형 시켜버려야 하는데......,1
user-cf3ov9vt3b,아니 ㅁㅊ 왜 사형을 판결하고 집행을 안하는거야????? 진짜,0
user-pf5wx1lh1h,어떻게 젊은나이에 저렇게살수있을까?,0
43studio13,저것들 먹고 싸고 자고 옷 입고 씻고 하는데 내 세금 들어가네. 왜 살려야 하나요?,1
mbongho90,나쁜짓 한거 평생 후회해라!,1
ryfld014,사람죽일 생각했으면 죽을 생각도 해야지 감방 잘가고~,4
openmind3208,30년? 감형이나 모범수 특사 그런거 절대 만들지마,4
comngood,"흉악한 인간들.. ~ 현실적 최고형 선고는 당연, 역시 사형을 부활해야한다. 하지만 살인 커플의 변호인이 '잘못된 판결'이라고 말하는 것은 정당해. 판, 검사가 이런 놈들에게는 정황증거만으로 정의를 행하는 척 하지만 . .ㅋ 권력 앞에서도 정의로웠다면 인정됐겠지. 실은 공정한 제판이었다면 가벼운 형량에 우리는 분노하고 있었어야 맞지.",2
cyclebu82,판사를 존경할게 아니라 무조건 사형감이지 이건 내가 유가족이면 더 억울할거 같은데? 사형이 아니라서,3
plus109380,조현수는 늙어서 나오네 같이 무기징역 이 정답인데요. 판사님 멋지십니다 절대로 그 여자분은 못나오게 면회도 없게 해주시길,1
jeanaj4763,우리나라도 가석방없는 무기징역 가능했으면….,1
user-kr7xn6qv6b,사형 안 한게 다행인줄알어 두 쓰레기 인간들 30 년 무기징역 속이 시원하다. 죽을때 까지 거기서 사죄하고 속죄하고 살아라.,0
user-bd2cc1dy8n,제일 괴랄한 교도소로 보내버리길,3
dyd8957,수많은 잔악한 범죄자 살인마를 봣지만 처음으로 악마같다고 느낀사람이다 유영철이든 뭐든간에 태어날때부터 결함이 잇는 그냥 그렇게 살게 프로그래밍된놈들이라 악마라고는 표현안햇지만 이은해같은경우는 온전히 자기의 이성으로 사람목숨을 정말 파리보다도못하게 이용하는 정말 잔악무도한 악마다 전세계사람들의 영혼중에서 손가락에꼽을정도로 영혼이 시꺼먼색 일거같다 정말 악마다,0
user-yf7bz2xh8i,둘다 무기징역 줘야 합니다 똑 같은놈들입니다,0
jesusline2012,항소했다고요? 한국 재판부는 끝까지 가봐야 압니다. 범죄자들 한테는 너그럽고 피해자에겐 가혹하니까요.,0
ICEMAN-vk1eb,사형을 시켜야지요.~~~,0
user-lf2mg7qf6y,오랜만에 법이 있다는 느낌,2
user-qf7gd5ct5n,무기징역감인데 30년은 무슨 평생 못나고게 해야됨,1
user-sj6po2ux7m,시원하네요 오랜만에 다시 이런일 생기지 안케 중간 나오지안케 ~,1
bandj8485,검판라도 당할수있기에 처벌이 강력하네여 ㅋㅋㅋㅋ 지네 안당할 죄는 집행유해,1
user-uh3ls5qz4d,법원에서 항소기각 교도소로 빨리 보내야함,0
user-bo5zd8vy1g,판사 이제 제데로 한번 일 한것 같다~,2
qawsedrftg4402,참 끝까지 반성하지않는 살인마들,0
user-zq8qw3pt4o,무기징역수는 20년 모범수면 세상에 나올수있습니다. 차리 30년이 나을지도 몰라요~ 2심 대법원가면 보통 형이 깎여서 최종 10년 20년형 정도 되겠네요~ 법은 죽었어요~ 사형수 아니면 세상에 나올수있어요,1
user-py3989,조현수도 무기징역때려야 정의구현법인데 아쉽다,1
user-rp3ec2zk5c,왜.살려놓습니까.? 죽여야지요 감옥에 보내놓고 밥을먹일 생각을 하십니까.? 저들은 가옥에 가둬두고 주는밥도 아깝습니다 죽여서 독수리 밥으로줘야 합니다 저들은 숨을쉬게 두고 밥을 먹여 살린다고요 저들은 감옥밥도 아깝습니다,0
sty6198,둘다 공범 인데 같은 사형이나 감형 없는 무기 징역 해라.,0
user-lw3dd9kn3s,변호사의 무죄라고 한다면 왜 도주를 했는지 그것부터 생각 하라,0
donggeumlee8648,아쉽다. 무죄 떳어야 레전드인데;;ㅠㅠ,1
user-ut7gn9zu7t,사람을 죽였는데.. 무기징역이라고? 10년정도 살다가 모범수로 나오면? 이런 세상에 .. 만약에 살다가 위험하면 먼저 죽이는게 유리하겠단 얘기인가..,1
user-gy6mk3vj1f,30년형이면 다 살고 나와도 안죽고 멀쩡히 살아 나오는 거잖여..,1
user-hw9ol2iy6y,사형인데 씁쓸하네ㅡ,0
zxcv1042,이은해가 2심가서 감형 되는거 아니냐 걱정하는 애들이 있던데 아마 힘들거임. 이은해 조현수가 유죄인정 된 상황에서 그 동안 재판부 조롱 엄청 해대서 (특히 담당검사에게 찐따같다고 조롱함) 대법최종 판결까지 무기징역 원심 그대로 유지할 확률이 높음ㅋㅋ,2
user-ew2yo2lh9z,사실 촉법소년법 논란 빼면 중형 범죄자들한테 무기징역 꾸준히 때리고 있음 아주 잘하고 계시네요.,1
user-od9pc8bd9g,인권을 신성시하니 30년밖에 안살고 나오네,1
user-ix3bd5eh8f,사회적으로 이슈 크게되서 그거땜에 저렇게 때리는거아니냐 다른 범죄들도좀 씨게 때리자,0
gloriachun810,사람이 아닙니다 . 인간의 탈을 쓴 악마 입니다 .,1
kyeongjoonhan2677,"사형하고 무기징역이 맞지않니, 검찰아....",0
choeyoung1782,무기징역 보다 사형선고 정당하다 대한 민국 쓰레기 법부터 뜯어 고처야한다,0
user-nj2sx4py1q,잘됐네 무기징역좋아 진행해!,5
baek6468,조현수가 뒤에서 다 시켰을텐데 ᆢ 둘다 다 무기징역을 시켰어야지 ~ 죽은사람도 멍청해서 죽은거지 돈을 자꾸 요구하는데 자꾸줘서 자기가 죽임당한거다 첨부터 안줬음 죽임당할 일도 없는건데 ~,0
user-oe5gz4cg1n,손도 안대고 스스로 뛰다 죽었는데 무기징역은 너무 과하지않나? 7년 5년정도가 적당한듯,1
user-po4fn8yo2x,검찰이 이은해를 단체로 가스라이딩 해버렸다? 검찰이 사람들을 속여서 가스라이딩 했다고 자랑이네? 어.. 이걸 판사가 그냥 넘어가네?,2
teasang3784,끝까지 혐의 부인 에효 쓰레기라고 부르기두 아깝다 걍 깨끗하게 인정하징 인간두 아닌것들 에휴,1
user-vb5jw3ue2g,돈 때문에 사람을 죽이냐!,1
user-mg4uh3dr2v,잘된다 요것들아~근데 무기징역이면 나오는거 아니냐~저것들 나오면 안되는데~,0
sepherdoh,뒷배가 없으니 저런 형량이 나오네요.,0
user-hm7sq5cg2r,검사는 무기 30년 했는데 법원이 국민들이 원하는만큼 안줄것같다.. 대충 10-15년나올것같은느낌임...,0
asdfqwer7877,특혜로.모범수로.무슨무슨이유로 감형되는일은없어야한다.,0
kyeongjoonhan2677,대한민국법은 개허접해...한국 판사처럼...,0
user-eo7eh6yu4u,사형인데 미친법이다,0
greenbeam9080,징역30 이나 무기나 똑같은 결과네요. 무기도 모범수형 하면 30년 후 가석방 되잖아요? 저자들 손으로 밀지 않아서 부작위에 의한 살인? 차라리 유기50년이 더 엄벌이죠.,0
user-ri9ub7wp8o,뻔뻔하기가 인간두 아냐 반성은 없고,0
user-ri9ub7wp8o,사형이 답이다,0
TV-tl3hm,난 왜 변호사가 궁금하지? 아무리 돈이 좋아도 이건 아니지!!!!!!,0
monajung8265,수영도 못하는 사람이 왜 그 깊은 게곡엘 뛰어 내렸을까~~?? 그는 바보였나~~?? 미끄러져 빠졌는데 여자가 죽도록 내버렸을까~~??보험금 타먹으려고...그 주위엔 아무도 없었나~~!! 증거를 뒷바침 해줄만한 witness도 없는 상황에서 검사의 추리만으로 독단적으로 사건을 결정짓는 것은 다소 무리가 있어보인다. 검사의 추론이 사실이라면 마땅히 그 죄값을 치러야 겠지만 범죄엔 항상 빼도박도못할 명백한 증거수집이 있어야 한다고 본다.,2
user-yt7uh4li3b,타인의 목숨은 돈으로 보이고 니들 목숨은 아깝더냐?,0
k-hoon9789,혐의를 부인했다 = 할 말이 없다,3
user-ul2pt3il2n,무징역도 약하구만 저런것들은 사형 시켜야하는데,1
pamina1208,가석방 없는 무기징역!!!!!!!!,0
user-bj9rc8ox3x,나샷~~~~무기징역 항소하든 뭐든 절대 무기징역가즈아!!!!,0
user-qc9qh1zv5l,인간들이 추하다~~추해~,0
onlyone4866,와 정의구현 ㅅㅅㅅㅅ,1
sbmllove2949,이은해 조현수 저 악한 영혼이 영원히 고통받기를,2
user-dc7ui9wz4l,이게바로법이지.,0
user-ol4gx6md2u,참 못됬어...적당한 말이 떠오르지가 않아.,0
user-bm1ms2od2e,증거 가있는데 아니라고 하면,1
minkookdaehan1385,비리 검사들의 무리한 선고군.,0
user-uz5gi2dk4b,그러다면 서해공무원 소각사건하고 북송사건결과는 ? 법은 만인에 평등함을 보여주시길!!,0
user-vy1gd5oj9d,끝까지 징글징글하네 안녕히 가십셔,0
user-jr5uq5ql4o,돈이 뭐길래 악녀를 설치게 만드나?,1
user-gi2ps3fl4v,남편을 사랑했다 말할수는 없다고? 1:52,0
user-nf2om8zg4y,굿,5
user-tc8tg1wy5z,항소하겠다고?? 돈 많은가보네...내 생각에는 돈없어서 못할거 같은데?? 검사가 항소 안한것을 다행이라고 생각해라..,0
yesican0907,저 두암수를 끓는 기름에 산채로 바삭하게 튀겨버려라!,1
user-fv4zk1jk9g,"저게 30년,무기징역 받을 죄냐??? 우리나라 법치국가 맞은겨??? 판례가 있으면 그것에 맞추어 혁량을 주어야 됩니다. TV에 얼굴이 공개 되는것 부터 문제 입니다.대한민국은 법치국가입니다. 모두에게 똑 같아야 합니다. 이건 아닙니다. 가족은 뭔 죄입니까. 고조선시대 8조법으로 다 같이 가든가...",0
user-yc2wg2eo1j,일반인들은 형량을 팍팍주면서 장재원 아들은 왜 1년이야,0
joylee8753,휴 무사히 잘끝났네 무기징역 축하드립니다,0
user-gh5vt6yj9p,부인이니깐 부인했겠지,0
Nn-ox7qq,30년도 짧다고 본다,1
user-xf5kb5tc9d,저 동물 2마리는 무기징역도 과분하다. 이세상에서 없어져야 된다.,0
freedom_is_notfree,잘햇다!!,2
user-hg4lq2sf5b,구형일뿐…..,0
user-fw6cb2mr7u,죽을때까지 은혜로운 콩밥을 먹어라 은해야,0
love-sj1bp,범인들이 다 부인하지 않나? 범죄들의.... 사형시켜라,2
user-rm4xz7rj5e,아 여자라서 당했따 ㅋㅋㅋ,0
user-bg4ik1el4q,가석방없는 무기징역이랑 30년 징역형은 안되나? 미국이었으면 징역1000년짜리 였을텐데,0
LEE-ec2ly,"여론이 있으니 일단 1심을 저렇게하고, 항소하고 어쩌고 대법원까지가서 조용히 10년이하으로 끝날듯한 분위기는... 나뿐인가.",0
user-tv4li3pg4h,악마들,1
user-tc7uy8yu7q,전혀 뉘우치질 않네 악마를 보네,0
wow-jp,범죄자들 항상하는말 강압수사ㅋㅋㅋ,1
lt2107,사람 잡아먹게 생겼다고 생각한대로------,0
wheewhoo2,감옥 들어가면 돈 걱정은 없겠네ㅋㅋㅋㅋ,0
user-ji8fb6ii6y,당연히무기징역,0
user-qb2zd9no6f,가석방이 없는 무기징역인가? 저 이은해 신동엽이 진행한 러브하우스 나온거 봤는데 소오름 ...,0
user-oo9mj2xu4t,직접살인도 아닌데 무기징역 존나 이해안가네 납득좀,0
9196__,30년ㄷㄷ 개조졋네,0
for8548,항소하겠군,0
jeongsuh166,생명보험이 문제예요 .... 없어졌으면 좋겠어요..,0
user-vu5jj5id6r,30년을. 어케산데 ㅋㅋㅋㅋㅋ,0
LucasBacas911,대통령 바꼈다고 처벌이 이렇게 달라지나?,0
kiikiy,담생엔 무조건 여성기달고 태어나야지 보호받는여자포지션이 갓성비효율갑 개꿀인생 손해보는일 회피가능 이기적으로 살아도 노터치 무자본으로 인생플레이 쌉가능,0
user-my9zn6rp4s,30년은약해 300년,0
user-cp6gv6cd9m,공개처형 ㄱㄱ,0
user-ev7ds9vx6h,ㅋㅋㅋ~~~ 은해 인자 옥살이 실컷하것누 ㅋㅋㅋㅋ~~~~~~~~,0
user-dv9gc6nf1y,이번기회에 사형제도부활시켜라 중국법을 조금활용해서 사형도 돈없으면 끔살로가자,3
user-oq3cf7fc5l,사형시키라 사형이정답이다,5
user-jk5es1pd5p,므기징역약해사형으로바꾸어라,1
ok3884,피해자가가진 돈7억이상 빼먹고 거지만든것도 모잘라 보험살인해서 한번사는인생 목숨빼앗고 절대용서하면 안될 이은해는 무기징역형으로 다스려야한다,0
kathykim4645,"무기나 ,사형시켜야죠,만난남자가 3명씩이나 사고로 죽었는데,,,",1
user-hu3ty3ee8q,사형을시켜야지무슨국민이봉인가.세금으로밥주게,0
leejoes5914,평생 집걱정 밥걱정 안해도 되겟다 은해야 ㅋㅋㅋㅋㅋ,2
user-of4ns9bp7y,뻔뻔한 악마들~~,0
dongkim2844,얘들아 생각보다 시간 빨리간단다 무기라도 15년살고나와 다음번엔 성공해 보험받아,0
love-sj1bp,난 살인마를 변호하는 변호사들... 과연 자식들은 잘될까? 살인마들한테 돈받고 변호하고... 그돈으로 자식들 키운다면 자식들이 ..... 난 살인마들을 변호하지 마라...이야기하고 싶다.,0
user-du7gl7iw3d,조현수는 왜30년? 서로 깜빵에서 썩지,1
zoonystyle,수의 잘어울러,0
user-yb5kq5rn5n,저거풀어주면. 살인자방치하는거랑같은거다,0
user-rb5es9vi6c,주짓수 배우길 잘햇지 ㅋ,0
speedshangus,보여주고가!!,0
jeongsuh166,"무슨 16차례의 심의가 필요해, 그냥 단 번에 처형... 판결은 정은이 처럼 하세요....ㅎㅎㅎ",0
sanglee4827,Good,0
chongsukshin638,젒은게집애가 잔인해,0
pk473,거짓눈물 ㅡㅡ,0
user-uf6zg8it1c,즉시사형 깜 아닌가,0
zldwm,염산 세안 시켜주고 싶네.,1
wjl4108,사이다 달다 달아,0
