작성자,내용,추천수
Arthas.,저런애는 못나오게 해라 좀.. 아후 답답하다..,1
bgs8892,있을수가 없는 일입니다 대한 민국에서 어찌 저리 일면식도 없는 사람을 저렇게 할수 있단 말입니까 형량20년 더 때리십시요,401
user-ky9tp3cg6y,그냥 하는 소리가 아니라 진짜 이런 새기는 감형없는 종신형같은거 때려야하지 않는가? 가해자 인권 그딴 소리 하지말고 시ba...누가 봐도 아주 많이 잘못한건데 죄질도 인성도 악하고...남자도 저렇게 맞으면 거의 다 재껴진다.,0
justicehojun,이런놈들은 거세와함께 강력한 처벌 해야합니다. 이러니 여자들이 불안에 떨며 살아야한다는 소릴하지. 우린 덩달아 잠재적 가해자 취급받는거고. 아우,0
user-dr9bd6ub4d,사회에 못나오게 무기징역 시켜라!,150
owl._.,짐승은 인권이 없다.. 일면식 없는 사람을 폭행하고 강간을 하는게 사람일수 없다. 차라리 길나온 멧돼지가 더 안전하겠다. 멧돼지는 신고넣음 바로 끌려가지만 저런 놈들은 형량 ㅇㅈㄹ..,2
user-ox5cv4qf6c,대체 주소는 어떻게 알았데..무서워서 살겠냐..,1
tv-ng5lm,우리나라는 왜 교도소가면서 벌벌떨고 후회하고 반성하고 그런 게없고 복수심과 증오로 가득차있을까요?,1
user-kg8we9ru2f,항소를 해???..... 진짜 세상이 어떻게 돌아가고 있는 거지......,0
pwomkwom3319,진짜 저런 애들 때문에 남녀갈등이 생기고 사회가 퇴화하는거다 제발 사형시켜라,28
kokomi_donut,이런 놈들을 살려서 교화시킬 필요가 있나...,0
MC-zr8bu,제발 처음 수사할때 꼼꼼히 해주세요,0
user-ze3uk9vf5p,진짜 제정신이냐..? 12년 말도 안된다 정신차려라,192
termi0726,다시는 빛을 못보는 곳으로 보내야됨,0
younginkim1204,사람도 아니다 진짜...,0
user-qd8cf1vo1x,개과천선이 불가한 인간인듯.. 이런 놈은 절대 내보내면 안 된다,46
user-ie1no3oz3o,징역50년 때리고 감방에서 노동해서 버는 돈은 피해자에게 지급해라,0
user-bx4bk5ic1u,무고죄도 폭행죄도 소년법도 음주운전도 싹 강화해야지,0
user-qo7qh6vz1e,이 사건은 초등생이 들어도 성범죄인데 초등수사도 안타깝고 피해자가 증거를 찾아야되는 이런 시스템이 정말열불터진다 저인면수심은 저짓을 하고도 잠을자고 밥을먹었으며 형량이 많다고항소를하고있고피해자저아리따운사람은 저 괴로운일을평생혼자끌어안고살아한다 언제이런일들이생기면 피해자가 숨어살야하나.. 정말 억울하다..!!!,22
user-xs3qr8uz6r,항소를 받아주는 것 존나 웃기다.. 성범죄자 세끼들은 거세를 해야한다 병원에 처박혀서 인생을 끝내던지 세상밖에 보내지말고 깜방에서 인권보장 받으면서 평생 쎡어주길,0
doomo3904,무조건 사형 때려라 진짜 좋은말로 할때 듣자 안들으면 이 나라 뜬다,0
user-tk9fv6uz2j,저런 것들 좀 못나오게 해봐....,0
starseeker.__.,헐 졸라 무섭네.. 영원히 나오지 말지...,1
user-oy6sl2pf2r,이런 쓰레기들은 그냥 사형시켜줄 수 없나요?제발좀,211
user-mn6nt3wl5t,사형제가 있으면 뭐하나 집행을 해야지 본보기로 저넘 사형집행갑시다,0
user-sz9kr9qq5v,부디 사형시켜주세요.,0
1004JinHo,제발 더 많은 피해자가 생기지 않도록 사회에서 영원히 격리 해주시길 바랍니다.,11
seon3728,현실판 모범택시가 있었으면 좋겠네요 범죄자 출소되자마자 납치해서 때려잡는 정의구현자,0
muse1971,말로 다할수 없는 ....,0
seokl,"저렇게 하고도 항소에, 복수할거라는 그 마음가짐이 진짜 불량하다...어떻게 인간이라는게 저럴 수 있나. 저건 애초에 태어나지말았어야 할 짐승만도 못한 것이다. 제발 꼭 저런 짓, 저런 맘을 가지면 안된다는걸 보여주는 판례가 나오길 바랍니다. 꼭이요.",52
user-mj8xf2up8z,사람 고쳐서 못쓴다 죽여라~~ 능지처참 시키면 더 좋고..........,0
user-dp6od5vc9y,하 제발 사형좀 ㅠㅠ,0
MCminjoo,끔찍하네요. 강력하게 처벌 해주세요.,31
ekekek377,아니 어케 그럼..?딱봐도 성범죄구만....??진짜 어이없다,1
boza5382,가만히 걸어가는 여자를 뒤에서 머리를 차서 기절시켰는데 이런놈이 변호가 필요함? 걍 영원히 사회격리가 답이다,0
user-vz7qt5zb3f,보복할거라는데 무기징역 제발~~ 기질자체가 안좋네... 피해자들 보호해주세요,62
jskim6569,경찰과 판사만 모르는 ... 누구나 다 아는 사실..,0
Moneta-wk1pk,제발 사회와 철저히 격리됐으면 좋겠다.. 강간시도가 분명해 보인다 아마 시도하려다 실패했을거 같은데..,0
mungigim,저런 쓰레기는 소각시켜라...,76
user-io8lp6kr6w,정의구현 개뿔 일심에서 12년이라네 저련건 계혁적인 범행을했읍니다 징역30년 정도 선고해야 다시는 저련 모밤범죄가 안생깁니다 형량은 꼭 죄에대한 벌이지만 예방차원에서 강렧하게 처벌해야 합니다,0
juhyung11,사형시켜야 한다.,0
user-rm4js5op2q,"피해여성분은 저 동영상만 봐도 얼마나 공포스러울까, ㅠ.ㅠ 치료 받고 재활하고 또 정신적으로도 여겨내야하고 휴유증도 예측불가이고 하루 하루가 절망과 고통의 연속. . . 흐린 동영상으로 봐도 저렇게 젊고 고운 아가씨의 삶을 무너트리다니 살인이나 다름 없네요",14
hangang9,12년 + 12년 해줘라 범죄가가 항소심을 아주 장난감처럼 쓰려고하네,0
user-nx3sy9gs2q,사이코패스혹은 소시오패스로보이는데 사회에서 영구 격리되길 무인도에 감옥 짖고 그냥거시서 평생살게했으면,1
clock7008,와 정말 어처구니 없다. 저런 인간은 세상과 격리가 답이다. 참 그리고 그냥 감옥살이만 시키면 피해자가 너무 억울하다 똑같이 돌려차기 형벌로 매일 1대식 구속기간동안 시행했으면 좋겠다.,21
UltraMania_KR,혹시라도 이거 증거확보 못해서 판결 지면 초동수사에서 경찰이 개삽질한거네? 책임은 누가 질꺼야?,1
seotajibethecool1797,경추 3번 부러져서 평생 모가지 아래로 암것도 못쓰게 되길 염원 기원 기도 합니다,1
rainbow9641,진짜 사람도 아니다 피해자는 평생 두려움에 떨며 살것 같다 피해자가 이 범죄자 한사람 때문에 매일을 고통스럽게 살아야될 것을 생각하면 판사는 절대로 형량을 가볍게 내려서는 안될것이다.,17
user-xz1td1qp8x,일단 이름 바꾸고 이사 가셔야겠네요.. ㅠㅠㅠ 얼굴도 못 알아보게 살짝 고쳐야 될듯한데…. 복수를 계획하고 있다고 하니까요 ㅠㅠ 저놈이 무기징역이 돼서 아예 안 나오면 참 완벽할 거 같은데요… 마음 같아서는 진짜 광장 돌팔매질로 공개처형해도 시원치 않네요… 무서워서 여자아이들 키우겠나요?,1
user-ip9nr3jo8l,경찰수준이 바닥이네. 저런것도 생각못하나.,1
user-ce2zo8qy8n,영원히 격리 시켜야 됨,0
user-we7vj1lv9o,최소50년 해줘라 제발,0
user-tk3xu9et5w,징역 12년으로 되나요?피해자 신상 외우고 다니는게 끔찍하네요 운동선수들 돌려차기 맞을 샌드백이나 해부용으로 쓰이면 좋겠네요,1
Sky-ey9kj,저 사건은 일면식도 없는 사람을 뒤에서 돌려차 기절 시키는것만 보고도 무서워서 더 이상 보고 싶지도 않았는데 누가 봐도 다른데로 끌고 가는것만 봐도 강간이 의심 되는데 그때 옷차림도 정상이 아니라는데 경찰이 아무런 조치도 검사도 안했다는게 어처구니가 없네요. 앞으로 2차 3차 피해가 피해자에게 없었으면 하는 바램입니다.,46
eunokjun1087,"성범죄자들은 물리적 거세를 합시다, 쫌!!!",0
user-fk7fk6zd4l,저 피해 여성분은 안타깝지만 만약 저런 상황을 목격한다면 여자는 도와주지 마세요 친구가 대학가 술집에서 억지로 끌고가려는 남자한테서 여자 구해줬는데 여자는 그뒤로 나는 모르겠다 이러고 친구는 맨정신이고 남자는 술쳐마셨다고 심신미약 ㅋㅋㅋㅋ 경찰측에 얘기해서 여자한테 진술을 부탁했는데 기억하고싶지 않다 기억안난다 연락하지마라 ㅋㅋㅋㅋ합의금엔딩으로 참 해피하게 끝났네요,0
user-re5uh1fo9m,정말 끔찍하다. 명명백백히 밝혀져서 그 중 최고형량 받길..,12
user-cy9ij4ru9c,"웬만하면 사형집행 좀 부활시키자 ㅎㅎ; 저런 쓰레기가 판사, 국회의원 자식들, 특히 딸들한테 돌려차기로 10명 정도만 기절시키고 강간하면 법이 바뀌고 영웅될텐데 ㅋㅋㅋㅋㅋㅋㅋ",0
skkes3321,저놈은 사형 아니면 무기징역 해야,1
kakikak_____i,죄수자들은 출소하면 의료보험 혜택을 없애 버리고 세금 관련으로 재용이형 만큼 부담 시키자 평생 나라를 위해 헌신하게 뭐 못 하겠다하면 의료보험 혜택없어서 살이 썩어가며 아픈데 치료 못 받다가 ㄷ져야지,1
monaq9411,그냥 사형선고가 정상이다 저정도면,0
user-ku6ut6ot9s,12년이라니~ 판사가 얼마나 철딱서니없고 국민법감정하고 동떨어져있는지~ 저런새끼는 사형을 시켜 사회에 경종을 울려도 모자랄판에~ 헬조선 피해자만 고통받고 성실하게 법을 준수하며 살아가는 사람들만 피해보는 더러운나라 부끄럽다 정말 ㅠㅠ,84
user-nd2hc2mh9x,세금 아깝지만 무기징역 시키든가 사형시키든가 둘중하나하자,1
user-fw6ci4gu9b,와...보는내가다화가난다..,0
user-hy1ku8ki1l,저런 것들은 사형시켜 죽여버려야 다른 피해자가 생기지 않지.,17
user-gp1uv1nn1o,ㅇㅕ우ㅓㄴ히 사회에서 격리를 해야한다....,0
user-qj2nj5sd9m,사형제도 부활시켜 쓰레기는 태워버리자,0
user-tu1fz8pc9i,그냥 사형시켜라 저건;;,0
hkm2933,살인미수든 강간살인미수든 고작 13년? 장난치냐? 33년도 모자라다 진짜 대한민국 누구를위한국가냐,1
formelee8886,멍청한 경찰도 같이 처벌해라. 사형시켜라.,31
user-zs3sf7tu4b,2023년 대한민국에서 가장 쇼킹한 사건임. 이 사람은 사회에 나오면 안됩니다. 영원히 격리해서 형장의 이슬로 사라지게 만들어야 합니다.,0
happyyujin,저런 폐기물은 영구폐기 되어야 살만한 세상이 되지 않을까요?,0
qsomzf,"피해자는 얼마나 더 피해를 보고 살아야 하는지.. 후유증도 심할 텐데 앞으로 밤길이나 남자 또 주거, 이름 얼마나 포기하고 살아야 하나요 진짜 너무 안타까워요 범죄자 새끼는 반성이나 죄책감 없이 그저 피해자 주소, 이름 등을 외우며 보복할 생각이나 하고 진짜 찾아가서 똑같이 해주고 싶네요 그런 사람이 과연 강자 앞에서도 똑같은 행동을 할 수 있을까요? 진짜 감옥에서 평생 섞게해주세요",40
Adamantl00,대한민국 경찰들 일 대충하네 피해자가 사각지대로 심지어 강간범한테 끌려갔는데 피해자 팬티가 벗겨져 있는 걸 보고도 성범죄 수사는 안 하냐,1
hnmmm1,진짜 너무 끔찍한 사건이다. 저놈은 절대 풀어주면 안된다.,22
user-lr6pg9oz2e,저 정도면 죽을수도 있음 징역 40년이 필요함,0
user-gg8qx8zh6y,"살임 미수 12년, 살인 4년인 우리 나라 참 신기하네요...",0
JK-es4kg,저런일이 일어났다는 게 너무 치가 떨리네요. 그리고 범죄 현장에서는 모든 범행가능성을 열어두고 증거를 확보했어야 하는거 아닌가. 피해자의 상태를 확인했다면 성범죄 가능성을 의심하지 못했을리가 없지 않냐고ㅠ,27
user-ln3dj8wj6n,공기 아까우니까 사형 좀 시켜라,0
user-uj2zq2xg1f,솔직히 피해자 입장에서는 그냥 가해자 죽여버라고 감옥가는게 더 안전하겟다 ㅋㅋㅋ 피해자 주소 외우는데 무기징역 때려야지 ㅋㅋㅋㅋㅋ,1
user-vo4rq2pe3c,너무 소름입니다ㅠ 피해자분 회복이부디 빨리 잘되길 빕니다 가해자놈은 무기징역받길 ㅠ,19
user-qt6zl2dv2k,자칫하면 당장이라도 죽을 수 있는 상태를 만들었는데 12년.. 성범죄가 없었다고해도 사건 경위 보자마자 사형감 아닌가요? 그것도 많다고 항소한 범죄자 .. ㅋㅋ 대한민국 진심으로 범죄 저지르기 쉽네요,1
user-eu7ig1fn6i,피해자가 숨어 지내야하는 현실... 제발 세상에 나오지 않기를...,12
user-zh3kp9uo2v,일면식도없고 이유도 없는데 저렇게 뒤에서 뒤지라고 후두부를 있는힘껏 후려쳤음에도 12년밖에 안나오다니.. 근데 이x끼는 그걸 또 항소해?? 아 어지러워 ㅡㅡ 날씨도 나라도 다 미쳐돌아가는것같다,0
user-ol8nj2ci1h,저런 새끼들한테 인권이란게 필요합니까 진짜 ? 죄의식을 느끼지 못하는데 무슨 하긴 범죄자들이 존나 살기좋은 나라가어디가겠냐,0
user-xq4nd9bb9h,저런 인간들 그냥 사형 시켜주세요,15
mm-uz4hx,사형이나 무기징역이 아니면 피해자는 보복의 두려움때문에 평생을 마음놓고 살 수 없다 지금도 사고 후유증으로 일상생활 어렵던데 그게 말이된다고 생각하나?,0
Hanwool1394,이런건 최소20년 때려라..,0
minkyungkim2435,가해자가 얼굴도 않 알려지고 떳떳하게 살고 피해자는 숨 죽이고 사는 한국. 어떤 생각으로 저런 짓을 할수있는 지 치가 떨리네요.,11
rapier8128,저런놈은 나와서 재범 확률 99.99999%다 무기징역 때려라,0
Lee_Joonsik,이건 성범죄 맞을것이며 이것은 항소나 상고심에서 올려치기 제대로 당할수도 있돨,1
user-qx3ez9sb1v,저분 출소하면 판사님이 책임지고 데리고 사세요 아니면 사람 많는 곳 한복판에 두고 돌맞아 뒤지게 하든가,0
sternenlicht5956,저 피투성이 바지를 보고도 성폭행이냐 아니냐를 다퉈야 한다고? 진짜 덱스터가 필요하다...,0
ScaryCamp,디씨 인사이드 등지에서 피해자에게 악플 다는 2차 가해자들도 엄하게 처벌해야 합니다~,27
suasuasuasuasuaus,아니..폭행 후에 들쳐엎고 사라졌다는 얘기를 최초 보도당시에 들었을때만해도 당연히 성폭행 혐의도 조사 같이 이뤄지는 줄 알았는데.. 이제와서 뭐야 ? 안하고있었다고..??,0
user-oe8ie7mb6n,이런일들이 공론화가 되지 않고 묻히는 현실이 너무 답답합니다,111
user-pq2mr1df9v,팬티벗겨져있었다고했는데 이게 그냥상해겠냐 개판이네진짜..,0
KHLEE600,짐승 같은 놈을 엄벌해라,0
shin2333,이번에도 반성 어쩌고 하면서 피의자 인권을 들먹이면 판사는 3대가 빌어먹을거다,0
ill5104,뭐 잘했다고 항소심을 신청하냐 전과 18범이면 껌 하나 훔치고 무기징역 받아도 받아들여야지,1
mllove012,제발 울나라도 사형제 부활해라! 저런놈들한테 국민세금으로 나라에서 무기징역으로 먹이고 재우는 게 말이 되는가? 짐승한테 사형이 정답!,36
nicekun21,징역 12년이 말이 됩니까? 살인미수인데 무기징역 줘야지,0
subinpaps8575,사형이 답이다,1
sonatya5978,평생 사회격리 부탁합니다 죄를 뉘우치지않으면 사회격리해야죠 재범우려가 너무큽니다,30
sweee4586,"이사람 전과18범... 무기징역으로 사회와 영원히 격리 당해야 합니다 이 사람 출소하고 3개월만에 다시 재범행하고, 그냥 지 인생 꼬인것을 사회탓하며 자기보다 신체적 약자에게 푸는 놈입니다. 어차피 또 출소하며 재범할텐데 교화의 가능성도 없으니 사회와 영원히 격리만이 선량한 시민들을 구할 방법입니다.",2
user-zk9vn1km4c,이게 현실인가요? 세상에,0
user-pp7xk8gk7s,사형 시켜야 합니다,585
user-eo1ob9kr8d,이건 발찌채우는 문제가 아니라 화학적 거세를 해야 되것네 충격이네....,0
user-bi3hc2ue2v,12년 살다 나올때 저 여성은 두려움에 떨고 살아야하는데 무기징역해라,0
user-sj7wg7bc1m,제발 형량 늘리고 못나오게해라 저런 애들은 사회적격리가 필요하다 잘못한거 뉘우치지는 못할망정 피해자주소랑 이름을 외우는게 제정신이냐!!!,10
messij7017,징역 120년 해야지 죄목중 최고형량으로 가는게 아니라 죄목당 합산형량으로 바꿔라좀,0
user-nc1vy3fh9o,견찰아 제대로 일쫌하자,1
user-gz7zu7ux2b,그냥 저런애들은 가차없이 사형시켜버려라 제발,15
user-vs3jj8vi7c,뭐 일단 12년 이상은 확정이란건데. 인생을 별 이유없이 지 스스로 끝장내버리네.,1
user-wi1ch3og9s,공개 능지처참 온 국민들 보는 앞에서 서서히,0
user-ou1ii1jf4r,"자기몸은 자기가 지켜야한다는데, 저런 예고없는 무자비한 폭력 앞에 대체 무슨수로 지킵니까...진짜 저 씨씨티비 아니엿으면 주목도 못 받을 사건이였다는게 참",13
user-mo7hq5py9k,와.. 생각했던 것보다 더 최악이네,0
user-ez6ov4hw7p,사형시켜야한다,0
user-ft3xr6zp9l,제발 좀 강한 처벌해주세요 십년? 이십년? 살고 나와도 피해자는 고통속에 삽니다 차라리 저런 놈들은 손발 하나씩 잘라주세요,14
user-oc6hf4by1f,"대한민국이 망해가는 과정이네요 성범죄자는 거세해야합니다, 법이 조밥이라서 범죄자들이 날뛰네요,",0
Izhr_0906,항소? 반성도 못하네 ㅋㅋ 사형때려라 저건 살인미수+강간의도가 있음,1
cokepepsi3492,판사들 빼고는 전국민이 다 아는 성범죄 ㅡㅡ,0
dd-go6gy,사형시켜야한다,0
u_just360,"저딴 살인미수 성범죄자들과 이 세상을 같이 살아간다는 거 자체로도 소름 돋고 너무 역겹다. 모방 범죄도 충분히 일어 날 수 있을듯.. 이번 사건을 통해서 배우고 더 치밀하게 준비하겠지. 왜 이런 범죄자들의 형량이 저것밖에 안되는건지 도무지 이해가 안되고, 아니 걍 사형이 답임.",22
user-gz9nm4tk9h,국회의원분들 사는 동네에 집어넣으셈,3
ohioohio8193,바지가 풀리던 안풀리던 사형해야지,1
ol8653,판사들 재판 똑바로 해라. 국민들이 지켜보고 있다. 사회에서 영원히 격리하자.,252
user-vs8ml9cm6j,"이런 애들 전재산 몰수하고 매달 1억씩 상납하게 해야지 나라에 돈이 없으면, 애먼사람 벌금 쎄게 때릴게 아니라 저런놈은 세금 들여가며 키우고 애먼 사람은 벌금내게 하고",0
user-wb8gl2iy6k,무기징역 때리지 12년이 말이되나;;;,0
user-zu4yf1vq5z,징역을 줄게 아니라..사형을 해줬어야 하는것 아닌가..?,17
user-cv2pz1ko9m,우리나라 경찰은 기관으로써 존재가치가 있는지 부터가 의문이다. 정황만 봐도 성범죄 의심부터 하는게 99%아닌가? 무슨 빡대가리만 쳐 모아뒀냐? 월급 받는거 솔직히 안 부끄럽냐?,0
mspark795,빨리 처형해라...공기오염되잖아.,0
dongramii_,아니 재판부가 늘 감형 사유로 내놓는 초범도 아니라며……. 감방 한번 갔다와서 교화 되기는 커녕 더 쓰레기가 되어왔는데 사회에 풀어놓을 이유가 있나…? 판사님들 잘 생각하세요 저런새끼 풀어놨다 너네도 당할 수 있어요,16
user-bd4yo4wy9r,사람 아닌데 사람한테 하는 재판을 쟤한테 해야되네,0
Pi-Eup,제발 무기징역,1
user-hd1eq8qu4w,언제까지 여자들이 이유없이 모르는 사람에게 다치고 죽어야 되나요? 확실한건 다시는 저런 인간들을 사회에서 격리시키는게 또 다른 피해자를 만들지 않을 유일한 기회입니다.,593
h.y980,제발 죽여라 살려둔다고 도움 될일이 있겠냐..,0
SP-bz6ky,사형집행 제발,0
db1ar2bt9b,사람도 아니다. 강력처벌을 바랍니다,27
sohakim7857,왜 일면식없는 사람을 죽을만큼 때려요? 저런 사람은 광장에 묶어놓고 일면식 없는 사람들이 때려도 괜찮게 법안 마련해주세요,0
user-fx2nt6nh6h,세금 아까우니까 그냥 바닷가에 던져 제발..,0
user-hu3ql9fp2g,항소한 게 진짜 코미디다 하긴 그럴 양심이 있음 애초에 저런 쓰레기같은 짓은 안했겠지,0
user-js8qb5le5o,"12년은 너무 작습니다 50년 형또는 무기징역으로 해주세요 당연히 성폭행 할려고 한거지, 구치소에서 여자에게 보복하겠다고 말하는걸 보니 이넘은 무기징역이 답이다 ( 이넘이 나가서 또 살인을 저지르면 담단 판사가 첵임을 져야 됩니다 )",1
kyoungsuheo4152,세상에~~끔찍하네요. 저런상황을 어떻게 막을수있을까요. 인간이 아니네요.,13
jaeholee8959,판결이 병ㅅ 같으므로 재판관을 포함한 그 자식들을 모조리 발로 후려차버리자ㅋㅋ,0
JW_Lee00,아효.. 죽여라그냥.. 뭘 몇년가둬놓을까 고민하냐..,0
user-lx4vz6gf8h,사회에서 분리좀 시켜놔라 이미 사람임을 포기한 놈들,31
user-yh7pd2ki4r,와 정말 사형을 시행해야지 원,0
wjcho9108,저절로 풀리는바지를 애초에 어케입노;;; 저걸 증빙해야된다는게 개얼탱 없네요 사회에 나오지않게 해주세요,1
user-mw4fr6lk1w,성범죄 필요 없고 그냥 최소 종신형이 답이다,1
user-od2rm4oq5k,출산율을 올리고 싶다구요? 저런 범죄자들을 영구 사회 격리 하면 됩니다^^!,1
user-dc7ot9nz4p,사형시켜라 인간이 아니다,30
neruneru6700,처음부터 성범죄 관련으로 안봤다는게 진짜 어처구니없음. 그때 다 증거확보했어야지 이제야??,0
paulkim6692,참 악질이다. 일면식도 없는 사람을 왜 돌려차기 할까를 들여다 보면 성범죄가 성립되지 않나? 그냥 누굴 죽이고 싶었으면 남자나 아이나 노인일수도 있는거잖아,11
aaa4ok,이 나라에서 살기가 싫다,2
user-jp8ro3gb4z,항소한다는 자체가 반성 안한다는 의미임,0
davehwang1854,사형시켜야 합니다. 그간 누적된 범죄 이력도 많은데 어찌 저렇게 방치하는지요..,140
Rainwalker11,아 진짜 교화보다 마땅히 치뤄야할 죗값이 먼저여야 하지 않냐. 법 개정 좀 해라. 그리고 신상 공개 해라 염병 모자이크 집어 치우고.,0
user-nt5xr4rx7y,12년ㅋㅋㅋ 판사야 ㅋㅋ 니 자식들도 이렇게 당하기바란다^^,1
meyhyena1657,피해자의 정신적 고통이 얼마나 클지 가슴이 아프네요 맘 같아선 저런 자들만 모아 무인도에 가뒀으면,10
dddddd2860,피해자가 전치 8주 진단 받았는데 판례 검색해보니 미투 터지기전 쯤만해도 전치 8주 상해죄 면 징역 2년 정도 받았는데 전치8주를 살인미수로 보다니.. 엄청 쎄네,0
user-kq6mr6yj3d,제발 사형시켜라 ...맘 ㅈㄴ아프네...,13
user-qo6kf1uv8l,아니 최소 20년은 줘야지…,0
--1__1--,그냥 저런건 죽이면 안되나?,1
user-oo2fs2dk3v,제발 이런 사람은 사형시켜라 사람같지도 않은거랑 같은 하늘 아래서 숨쉰다는게 토나온다,109
user-oe9bj6hn9o,저 남자는 뭐가 문제여서 저렇게 된거지...,0
dongkyukim9133,"30년 가즈아 ~~~ 술취해 기억이 없다는건 거짓말이다.......... 단번에 둘러 업는것과 나갈때 술취한 모습은 없다,,,,,,",0
user-oi7sj9qu4f,저런 쓰레기는 세금으로 밥 주는 것도 아까우니 저 하늘로 보내 버려야 합니다,16
user-pn5ro1lc7q,제발 무기징역.,0
user-ni3ub2bu7b,법이란게 대체왜존재하는가..시내한복판에매달아놔라 절대저런범죄없다.,23
KeepThe_Faith,경찰 들은 정신좀 차려라.. 초등수사.. 증거보존이 얼마나 중요한지.. 그렇게 수십년 동안 얘기해도.. 그저 지 꼴리는 대로 수사하는 방식 ..쯧쯧.. CCTV 없으면 니들이 할 수 있는게 뭣이더냐.. 제발 정신좀 차려라.. 검찰이 개판인데.. 니들까지 개판이면 결국 대한민국은 개판되는거잖니...,0
golmokgil85,이 나쁜 인간 신상공개좀 해주세요!,1
pio.r4184,그것이 알고싶다를 보니깐 성범죄가 알려지지 않았던게 먼저 피해자가 폭행 당한후에 의식과 기억을 잃어버려서 아무것도 기억하지 못했던게 하나 있고 그리고 성행위가 좀 비정상적인 형태로 이루어진 정황이 있습니다. 이번에 DNA 조사결과가 잘 나왔으면 좋겠네요.,12
user-qx4uo2il9s,이놈은 머때문에 지인생을 저렇게 고난속으로 밀어 넣었을까?,0
user-ix7kp9gf8i,이런새끼 살려 두면 또일어난다 시람은 안변한다 영원히 사회와 분리해줘 재핀장님 제발 암벌,0
drekai2811,그냥 저런건 고문좀 하면안되나,0
user-wv9sn5xx4x,형량이 늘면 뭐하냐 어차피 언젠가는 나올테고 피해자는 그 날이 죽는 날이지 뭐,1
user-cu5pi6xl3x,2심에서 36년 가자.. 인생 버려지도록..,2
TV-iw1fc,답답해서 스스로 풀었을 수도 있자나요~,0
geumdongkwag9982,여러분 그리구 옷이 벗겨진거 넘두 이상하단 생각 안드나? 처음발견시 그런 생각자체를 못하는건지 아님 복잡한거 싫어 단순폭행사건으로 가려는건지? 우리나라 경찰은 모하는 사람들인지? 지새끼 저렇게 되두 그럴란지?,3
user-ug2mt6lx8y,대놓고 복수하겟다는데 형량이 늘어날수도있다? ㅋㅋㅋ 이 원참 피해자만 끝까지 벌벌 떨어야하네,0
