작성자,내용,추천수
YouthSystem,딸 키우는 아빠 입장으로써.. 제발 우리 딸이 정상적인 사회에서 살아갈 수 있기를.. 저 짐승만도 못한 놈은 사회와 영원히 격리되어 버리길..,1.5만
kimcream0927,제발... 피해자분을 보호해주세요...,7.7천
user-gl7dg5eg3p,누구든 피해자가 될 수 있었습니다. 국민들이 지켜보고 있어요. 제대로 판결 내려주세요.,1.6만
matrix_potato,옷이 어느정도 벗겨져있었는데도 성범죄 가능성이 배제된채 수사가 진행됐다니 정말 실망이고 안타깝네요 꼭 벌 달게 받길 바랍니다,1.6천
bichbyeol,결코 남의 일이 아니다 누구나 저 끔찍한 악마한테 당할 수 있다 가차없이 선처없는 강력처벌 부탁합니다 제발,1.1만
Owow11100,피해자 보호부터 확실히 보장해주세요 제발.. 아직 18살밖에 안된 사람인데 섬뜩하고 무서워서 학원 끝나고 10시 조금 넘는 시간에도 집에 혼자 못가요… 안전하지를 못해 진짜ㅠ,121
user-ru7xv7wn7u,일면식도 없는 사람을 뒤쫒아와서 사정없이 발로 머리를 가격하고 들쳐업고 사각지대로 데려간단게 도대체가 정상입니까…? 제발 강력하게 처벌하고 사회로부터 영원히 격리시켜주세요,3.2천
dghfbmin3838,다시는 사회에 발 못딛게 해주세요 피해자분을 비롯한 선량한 시민들 두려움에 살게하는게 나라입니까? 국민의 혈세로 나라의 책임을 다해주세요,1.3만
user-gt9mr3yg6o,와 주소랑 외우고 있다는거에 소름 진짜 무섭다 당한 피해자는 얼마나 두려움에 떨고 있을까ㅠㅠ 이겨내시고 행복한 삶을 살수 있게 합당한 처벌을 내려주세요,3.1천
ccigu8770,저런걸 인권이랍시고 감싸지 마세요 한 가족을 파탄시키고 지 잘못도 늬우치지 못하는데 저런게 어떻게 사람입니까 피해자분은 얼마나 고통속에 살아야하는지 아신다면 이번에 무기징역 또는 사형으로 판결이 나야합니다,484
bichbyeol,결코 남의 일이 아니다 판사들 딸도 일반인도 누구나 피해자가 될 수 있다 판사는 제발 피해자 입장에서 극형처단 해주세요 국민들이 끝까지 지켜봅니다,6.2천
user-xw4vq2un3m,항소심에선 얼굴 공개가 꼭 이뤄졌으면 합니다. 국민들이 이 악마의 얼굴을 똑똑히 기억해야 재범을 막을 수 있습니다.,494
user-tg5ll1sx8m,저런놈들 아까운 세금 들여 징역살이 시키지 말고 강제 노역 시켜주세요. 120년..,1.2만
user-er1up7qj7p,제발 피해자를 보호해주세요 법을 강화시켜주세요 제발 국민의 혈세로 일하면서 국민의 피눈물을 외면하지 마세요 지켜주세요 제발 국민들을 좀 지켜주세요,1.6천
bichbyeol,누구나 피해자가 될 수 있단 게 끔찍한 일 제발 판사들이 정신차려서 피해자입장에서 사형때려서 제대로 강력처벌 해주세요,5.1천
user-hc1pi2sd2c,같은 남자지만 정말 강력히 성범죄자들은 그냥 고환제거 못하나? 남성호르몬이 못 나와서 평생 이제는 닿을 수 없는 호르몬에 찌들려 살아갔으면 하는데. 왜 도대체 기본권이란 것이 저런 새끼들한테 해당이 되는건데?,378
O3O_S2S2,저런 애들이 20년뒤 사회에 나와서 내 주변인들 곁에 있다구 생각하면 너무 소름돋음..... 평범한 일반인들 좀 안전하게 살게 해주세요,1.3천
user-fg9zu9pq5n,법이 얼마나 솜방망이 같으면 이런일을 아무렇지도 않게 계속 일어나냐,163
bichbyeol,두려움에 떨며 살아갈 피해자분의 신변보호를 부탁합니다 저딴 악마는 제발 사형으로 처단시켜주세요,3.4천
SimpleAnalyst,악질범죄에 대한 처벌이 강화되어야 합니다,2.9천
ooom5409,아니 어떻게 1심에서 12년이 나오냐고요 ;;; ㅠ 제발 무기징역 사형 처벌해주세요 너무 끔찍하고 잔혹하네요 ㅠㅠ,61
user-dr3ic2cm8s,저런 악질은 사회로부터 영구히 격리 시켜야 한다. 더욱이 반성은 커녕 출소 후 피해자를 상대로 추가 범죄를 모의하고 있기까지 하니 더욱더 영구히 격리 조치 해야만 한다.,1.2천
user-ci4rt5bm9w,하 진짜 열받는다... 피해자 분은 얼마나 놀라고 황당할까... 지보다 강한 사람 앞에서는 찍소리도 못할 인간이 죄없는 사람을 왜 위협해,51
user-no3pe5sf2o,"저딴 짓까지 해놓고 항소라니, 범죄사실에 더해 악질적인 거짓말과 뻔뻔함에 대해 가중처벌하라",2.2천
user-nj9fq1td9t,피해자분 얼마나 억울하고 무서우실까 ㅠㅠ사회가 꼭 저피해자분을 지켜주면 좋겠네요.,807
user-gg9nl4op7o,젊은 여자를 폭행해서 정신을 잃게 하고 cctv가 안 보이는 곳으로 끌고 가는 목적은 성폭행밖에 없다. 교도소 같이 수감된 사람도 이런 목적으로 여자를 쫒아갔다고 말한 걸 들었다고 한다. 증언해주셔서 정말 감사합니다. 무기징역이나 사형해야 합니다. 청소년기부터 범죄자였고 나오면 또 살인 강간할 겁니다.,1.4천
user-vl5um9fh7e,피해자분 꼭 잘 살아서 복수하길! 힘드시겠지만 극복하시길!!,30
user-be6rb4ph2r,12년 뒤라고 해도 가해자는 혈기왕성할 시기다. 어떤 범죄를 또 저지를지 모른다 부디 힘빠져서 사건 사고 일으키지 못할 때 사회에 나올 수 있도록 형량이 주어졌으면 한다,1천
tamdao2286,너무 끔찍함…..피해자분 신변보호 제발제발 제대로 해주길,2
user-mr8jg7xm1r,경찰을 이해할수가 없다 저상황에서 어떻게 성범죄를 의심안할수가 있지? 바지도 내려와있다는데.. 경찰도 무능하다,3.6천
user-ym3jm5ls1f,소름돋네요. 복수를 결심하다니.,2.1천
user-el8rg5ob5k,피해자 분 너무 힘들겠다 그래도 당신 잘못이 아니라는 건 꼭 잊지말고 힘내세요,874
user-yu2ox1lv3d,"제발 우리나라 법 좀,, 진짜,, 음주운전이던 성범죄던 더 강력하게 처벌해야 하는데,,",12
_____tigre7485,구치소에 함께 수감되었던 분께서 본인 얼굴 드러내고 증언해주신 모습 넘 멋집니다. 가해자에게 무기징역 선고를 바랍니다.,996
user-fi5xm2jx5m,피해자의 쾌유를 빕니다...,6
fffffffffffffffqzjfk,"아니 누가봐도 동기가 뻔히 보이는데, 이걸 이제야 확인한다는게 어처구니가 없다.. 제발 피해자가 편안히 살아갈 수 있도록 저 정신병자(피고인)을 사회에서 영구적으로 없애주세요.",922
user-zb7ub5wj7h,변호사님 검사님 판사님 부디 강력하게 처벌해서 저런일이 다시 안일어나게 해주세요..ㅠㅠ,949
user-cj5yl9gd1e,"딸을 둔 아비로써 이런 사건들에 분노하지 않을 수 없다. 이런 범죄를 저지른 자가 인간일 수 없고, 가해자의 반성이란 큰 벌을 피하기 위한 용도일 뿐이다. 여러 이유로 감형이 되어서도 안될 것이고, 우리 사회가 받아들이기 어려운 형량으로 선처를 해서도 안될 것이다. 피해자에 망가진 삶은 그 무엇으로도 보상할 수 없기 때문이다.",406
milkybeauty4841,"제정신가진 사람이 할수있는 행동이 아닙니다. 확실히 밝혀서 피해자와 가족들, 국민들이범죄자가 죄값을 치루는것을 보게 해주셔야 국민들도 대한민국에 원망이 없겠지요. 피해자분 얼른 회복하세요.",660
user-om7xx9bx1z,사형시켜라 세금아깝다,8.8천
user-fr7rr2kk8c,제발 무거운 형량으로라도 피해자분을 보호해주세요,5
leehoon753,12년이면 너무 적은거 같은데요. 저런 쓰레기는 영구히 격리 시켜야 합니다.,412
SJ-xw2gm,해결될때까지 지속적으로 후속 보도부탁드립니다,4.5천
user-zu5dh4ub8x,우리들의 딸들이 안전하게 생활 할 수 있도록 사회에서 영원히 격리시켜주시길 재판부에게 부탁드립니다. 정말 소름끼칩니다. 저런게 돌아다니는 것 만으로도 죄악입니다.,275
handleititit,피해자분이 뭔잘못을했습니까 제발 엄중한 처벌 부탁드립니다 피해자분을 제발 보호하는 나라가 되어야 합니다,1
bichbyeol,두려움에 떨며 살아갈 피해자분의 신변보호를 부탁합니다 사형시켜라에 분노의 한표,856
Jewelkang,왜 저런 인간을 죽이지 못하게 법으로 막아놔서리. 중범죄자를 죽여도 무죄인 법이 꼭 있었으면 좋겠네요.,45
Nru-zr7qd,와 ;;; 구치소 생활했던 수감자가 말하는 내용이 진짜 소름이다...제발 사회밖으로 나오게 하지 말아주세요 제발 부탁드립니다.. 또 다른 피해자가 안나오게 처벌해주세요 제발요,305
user-sw7xc7gs7i,가벼운 처벌은 무거운 범죄를 낳고 무거운 범죄는 사회악으로 번지는것을 우리는 명확히 알고있습니다 사람은 고칠수없고 고쳐지지도 않습니다 가석방없는 종신형 노역장에서 일하게하여 피해자분께 보상하도록 해야합니다 법무부장관 보고 있습니까,994
user-gp3xp6gz2t,판사님들! 제발 이런 쓰레기들을 이 땅에서 더 이상 살 수 없게 해 주세요. 법정 최고형을 선고해 주세요. 평범한 시민들 발 좀 뻗고 살 수 있게 해 주세요. 도대체 이 나라는 범죄자 인권만 있고 선량한 시민들 인권은 없는 것입니까?,862
ding-dong-daeng,"미쳤어 진짜ㅠㅠ 피해자분 정신적,신체적으로 피해가 얼마나 클지 상상이안됩니다ㅠㅠ.. 악질 범죄자 공개해주시고 선량한 사람들을 위해서 노역& 사회격리해주세요.",2
jiwon9175,요새 이런 뉴스만 계속 보게 되어서 정말 화가 나다가도 지친다… 끝까지 싸우는 피해자분 대단하시고 저 가해자는 제발 사회에 나오지 말았으면..,568
user-su8um5yx9l,법이 강화하여 강력한 처벌을 받아야합니다.부탁드립니다!! 또 다시 피해자가 생기지 않도록 강력한 처벌 해주세요. 제발 피해자를 위해 신상 보호해주세요.,4
user-jc4vs3mq5g,누군지 1도 모르는 사람 상대로 다짜고짜 하이킥을 꽂는게 진짜 상식적인 인간이냐? 저건 사회적으로 단절 시켜야 한다. 진짜 미친놈일세,506
mh-cn5gr,자주 지나다니는 곳인데 저런 범죄자가 있었다니 소름끼치네요 피해자분 안전하게 지켜주세요,283
donggas-A,피해자분 조금이라도 괜찮아지기를 바랍니다. 가해자 진짜 넌 오래오래 살면서 인생에 온갖 ㅈ같은 일들이 끊임 없이 일어나기를 간절히 바란다.,184
user-fj9xd1lh5z,진짜 무섭다…제발 처벌 제대로 해주세요,2
malsun33,살기가 무섭다 제발.. 제발 처벌 좀 제대로 해줬으면,3
user-no4mj8hw5c,여자를 폭행하고서 기절시키고 끝난게 아니고 그걸 cctv없는데로 들쳐업고 갓다가 몇분후 나오는데 폭행에만 포커스를 맞췃다는게.. 이게 머리가 모자른게 아니면 뭐냐 대체? 경찰수준진짜 토나온다...,1.4천
bunny-lk3xr,형량 당연히 늘어야 한다. 우리나라 형량 좀 제발 늘려야 한다. 다시는 저런 인간이 사회에 돌아다니지 않게..,685
user-ii1tf9kz6d,많은분들의 증언이 있었기에 가능했던 일입니다 제발 다음 공판에서 성범죄가 입증되 처벌이 가중되기를 진심으로 바래봅니다 증언 해주신분들 멋지십니다 보기엔 쉬워도 쉽지않은 일입니다,187
user-yw6cu1mu5b,10년전 그알에 나왔었던 범죄자인데 미흡한 판결을 내려서 범죄자가 재범죄를 했을 시엔 판사에게 책임을 전가 하도록 해야하는 법이 시급합니다.,1
user-wg1bj1fy4o,제발 법이 무서워서라도 범죄를 안 저지르는 세상이 되길 바랍니다. 그리고 인권같은 소리말고 저런 범죄자들은 죽을때까지 일을 시켜서 다시는 사회에 못나오게 해야 합니다.!,154
user-sq2lb4bo5g,이건 저 미친놈이 막말로 진짜 피해자가 폭행으로 돌아가셨다면 시체에다가 지 성욕 풀었을 놈이다.. 완전 제대로 미친 싸이코가 맞다.. 지 성욕을 위해서 사람죽이는 짓도 아무 거리낌없이 저지른다는 건데 너무 소름 돋는다 .. 제발 무기징혁도 아깝다 사형으로 처벌해라 제발,1
jn2621,성범죄에 촛점을 맞추지않아서 증거확보가 안되었다는게 ㅈㄴ 개어이없네.. 저 남자가 뭐때문에 돌려차기로 여자를 때려눕혔겠냐? cctv안보이는데로 뭐때문에 끌고갔겠냐고..뻔한거 아닌가?? 답답하다 정말~~,350
user-vz2kk8do5p,"그것이 알고싶다를 보면 과학수사한다는 사람들도 피해자의 팬티 고무줄 부분만 면봉으로 닦아서 dna를 채취하고, 경찰들은 피해자의 바지가 내려갔었다는 사실을 알고도 성범죄라는 의심을 하지 않았음. 이번 사건은 여성피해자에 대한 철저한 무관심 속에서 수사가 진행된 사건임. 이번 사건에 제대로 된 판결이 내려지지 않으면 많은 여성들이 제2, 제3의 돌려차기 사건의 피해자가 되는 걸 더욱 두려워하며 살아가야한다.",610
user-nf8qm5vo4r,피해자분 이 영상을 보면 치가 떨릴 듯해요. 몸도 마음도 하루빨리 치유되시길 빕니다.,149
user-wi1lj4dv1r,지금 물건 하나훔쳐도 잡히는 세상인데 어떻데 대놓고 범죄를 져지르는건지..일반인과 사고방식이 다름.그냥 전형적인 범죄자이고ㅠ사회에 풀어놓으면 100프로 또 누군가 당함. 영원히 격리해야해요,14
jso5673,꼭 진실이 밝혀지길 기도합니다,528
user-gi6xr5ni7u,저런 쓰레기에게는 평생 격리만이 답 우리 주위에 있어서는 안될 공공의 적 12년도 적다 그냥 사형만이 답이다. 죄를 지어도 솜방망이 처벌을 하니 자꾸만 저런 파렴치한 들이 나타나는 것이다.,7
hellokorea2649,100% 성폭행이지.. 50년 구형때려라..,6.6천
eunmilee1417,남의 일이 아닌 것 같습니다. 너무 무섭네요. 머리 맞고 쓰러진 피해자 몸이 경직 되어있는걸 보면 심장이 벌렁거립니다. 저 트라우마를 어떻게 견딜지 너무 걱정됩니다. 재판부의 강력한 판결을 요구합니다.,55
user-oe2ij1xf6s,다시는 이런 범죄가 재발되지 않도록 강력처벌과 신상공개를 해야합니다.,151
mandeuk2222,끔찍하다 진짜. 살인미수에 성폭행에 이정도면 제발 사형시켜,3
user-co7mc4yd6h,"항소를 하던 ,반성문을 내던, 반성을 하던 그런것에 대해 판결에 영향을 미치면 않된다고 생각합니다.",483
user-fz2tv7bk3w,쓰러진 여자를 화장실 끌고가는게 심심해서 끌고갈까? 어떻게 생각을 못할수가있지??,4
user-qc6te3zn2s,일면식도 없는 여자를 쫓아가 여자는 쫓아온 줄도 몰라보이는데 뒷통수를 돌려차기로 한 남자가 제정신입니까... 이 여자가 앞으로 길다닐때 사람이 무서워 밖에 돌아다닐 수 있을까요...제발 인권은 짐승한테 배풀지 말고 제대로 처벌을 내려서 또 다른 피해자가 나타나지 않기를 . . 자식을 키우는 부모이자 국민으로써 선량한 시민이 또 다른 피해를 입지 않기를 간절히 바래봅니다,551
oh71517,피해자가 이런것까지 자료를 준비하고 증거를 찾아야한다는 현실이 너무 안타깝습니다,44
user-wt9jp5sg7l,모든 바지가 저절로 풀릴 수 없는 구조여야 사람이 입고 다니지...저절로 풀리는 바지를 누가 입고다니니....앞단 풀리고 상의가 그러면 의심해야지...수사를 왜....안했...,176
user-shyeong,갱생이 될 기미가 없는 다수 전과자에 대한 조치가 필요합니다. 소년법으로 여러번 처벌 받았을 때 사회와 격리 시켰다면 피해자분이 건강한 시민의 한 사람으로써 잘 지냈을텐데 너무 안타깝습니다.,1
user-zs1nl8ci7l,"사실 이렇게 바지와 범죄모습이 담긴 영상이 매번 나오는 것도 피해자분한테는 2차가해가 될 수 있지 않을까 걱정이 됩니다,,ㅜㅜ 이렇게 영상과 모든 것이 자주 노출되는 만큼 형량을 높게 해주셔서 피해자분이 다시금 생활할 수 있는 용기와 힘을 얻게 도와주시면 좋겠네요 제발ㅜㅜ",99
user-pg6vh6rz6o,제발 제발 제대로 법적 처벌 좀 받게 합시다.,0
McLee,"살인미수든 강간살인미수든 악랄한 범죄다, 그냥 사형시켜라, 국민세금 아깝다. 12년 많다고 억울하다고 항소하는 악마 끼가 교도소에서 교화될 일은 일도 없다.",1.7천
orola4602,"cctv만 봐도 살이 떨리고, 아무일 없었다는듯 걸어가는 둿모습에 치가 떨립니다. 피해자분 쾌유를 빕니다.",84
Michael_Hyun,강력전과 다수 포함 18범 + 반성X + 보복예고 + 누범기간 중 범행 이정도면 재사회화의 가능성이 없으니 가석방 없는 무기징역 말고는 답이 없는듯. 저런건 사회에서 영구적으로 격리시켜놔야 한다.,154
siuyoon2502,저런 범죄자들이 출소 후에는 꼭 판사가 사는 동네 이웃으로 살아야 된다고 본다. 그래야 판사가 제대로 일을 할듯.,5
user-cg2jg2hr7c,미친 진짜 소름돋고 무섭네 누구든 겪을 수 있었던 일인 거잖아ㅡㅡ,4
chlee9398,진짜 사법 자체에 문제가 많다는 생각이 든다 초동수사에 성폭행 가능성을 배제해 물증을 날려버린 경찰 나쁜 죄질과 보복 가능성이 있는데도 이를 반영하지 않는 검찰 피해자의 피해 보다는 가해자의 인권에 집중해 상대적으로 관대한 처벌을 내리는 판사 한국의 법은 정의 구현에 중점을 두지 않고 법 조문과 인권에 묶여 유죄 무죄를 판단 하려고 만 한다 정의는 범죄에 맞는 강한 처벌이 뒤따라야 이뤄진다고 본다,150
charmingwon1,너무 끔찍하다 법 강화 필요합니다!!!!,1
diary2855,사회와 영원히 격리되어야 합니다.,1.3천
bichbyeol,악마는 사형처단시키고 두려움에 떨며 고통과 트라우마로 살아갈 피해자 분의 신변보호를 부탁합니다,128
user-of8kv5pb2v,딸을 믿고 키울 수 있는 나라가 되었으면 합니다ㅜ 사형제도나 제대로된 벌을 세워주세요!,83
moneyking_knowledge,"가해자는 피해자보다 더 큰 고통이 , 더 긴기간 가해져야 한다. 어떻게 죄지은 놈이 더 나은 세상을 사는 사회를 만드냐. 이런 놈들은 평생을 감옥에 살거나 일찍 하직시켜라. 이런 놈들에게 무슨 인권을 요구하냐. 제발 판사들 정신차리고 판결하고, 형량이 가벼우면 국회의원님들 형벌을 강화하세요. 형벌이 무겁다고 죄안짓는 거 아니지만 이런놈들이 피해자보다 더 나은 삶을 산다는 것은 말이 안된다",0
0mastermind,증언해주신 경찰관님과 주민분 정말 감사합니다,39
user-rd8yc6eo4u,저런놈은 제발 법정최고형으로 처벌해야 합니다 인간갔지 않은놈은 감방밖에 없습니다,0
user-vh8wn1pw1q,왜 이제야 이런 증거를 찾고 있는지... 처음부터 했어야지... 피해자도 덜 힘들 터인데.. 이런 바지를 안 입었으면 어쩔려고 .... 답답합니다. 면밀히 조사해서 엄벌을 처해주세요.,640
sunlim6186,진짜 영상볼때마다 치가 떨리네요 피해자나 가족분들 마음이 어떨지 ㅠㅠ 제발 강력처벌 바랍니다 슬프네요 이유도 없이 저런 고통을 ㆍㆍ,30
user-xz8ed9gc8u,이를 갈며 확실하게 재범에 대한 의지를 보이는데 이걸 다시 사회에 풀어놓으신다면… 진짜 할말 없습니다,22
user-zd4om6bi9m,어우 진짜 이런거 보면 화딱지 나네요 무슨 부귀영화를 누린다고 남한테 저런 못된짓 하면서 인생을 포기할까 싶고 진심 피해자 무기 소지 합법화 시켜주세요 인권은 피해자를 위해 존재해야지 범죄자를 위한게 아닙니다,1
user-he9wr7jy3w,"제가 우연히 들은 이야긴데 구치소에 수감자들 한명한테 들어가는 세금이 연간 일인당 약 400만원정도가 쓰인다고 하더라구요. 왜 우리들이 내는 세금으로 범죄자들을 먹이고 씻기고 재워주는지 저는 모르겠어요… 감옥이란곳이 자신의 죄를 반성하기 위해 들어가는곳인데, 너무 인권보호라는 명목으로 잘 보살펴주는게 아닌가 싶어요…사람을 죽일뻔했거나 죽인사람들에게 그럴 필요가 있을까요…? 사형이 아니더라도 최소한 식사도 유통기한지나서 폐기처리되는 아무음식이나 던져주고 이불과 베개 옷 이런거 주지말아야 된다고 생각해요…불편함을 전혀 못느끼고 잘 사는것같아 괴롭네요…",98
_duck5579,진짜 이거 안됀다. 풀려나면 피해자 죽이겠어; 사형시켜 다시 풀려나면 피해자 얼마나 두렵겠냐ㅠ,2
user-sj5gt3np1z,"CCTV에 다 드러났는데 무슨 재판이고 인권이고 나발인지.. 제발 그냥 좀 죽여 !!! 행정력 낭비 ,사회적비용 낭비, 세금 낭비 사형제도 부활시켜라 제발",197
user-mx3dd5ip3q,피해자 여성이 지옥의 고통을 받지않게 많이 도와주시고 부산 돌려차기 사건 절대 잊으시면 안됩니다!!!,69
user-vd2cl1dr8x,동급남성도아닌 여성을 무자비하게 돌려차기로 그것도 성욕때문에 미친놈한태 아주엄벌을 내려주서소 판~사님...빨리 쾌유해서 안정찿으세요..,122
user-up6jx5vi4l,제발 강력히 처벌해주셔서 본보기를 보여주시고 다시는 저런 쓰레기가 활보 못하게 해주세요,27
heatherl8224,"사건 보고 피해자가 살아있다는 것에 감사했습니다. 가해자 행동과 태도에 사형이 답이라는 생각이 듭니다. 예전에 술취한 피해자 모텔에서 팔꿈치까지 손집어넣어 장기 뜯어 사망하게한사건, 폐지줍는 할머니 때려 사망하게한 사건 이후 가장 끔찍하네요. 상대가 원해서 그랬다 취해서 그랬다 죽일 의도는 없었다 같은 말도 어이없는데 저건 나와서 피해자 때리고 죽이겠다? 인권박탈 사형해도 모자랍니다.",5
user-pi3be4bd3x,초동수사때 바지가 풀려있고 상의가 올라가 있었다면 당연히 성범죄관련조사가 이뤄졌어야 하는거 아닌가... 진짜 저런 놈들은 사형 씨게 때려서 사회가 정화되었으면 싶습니다.,201
Leopard_Mint,피해를 입으신 여성분 꼭 완쾌되셔서 여전처럼 일상을 누리시길 기원합니다.,18
user-jj7ng5kx6k,"제발.. 저렇게 명백한 가해자는 억울할 정황이 없으므로 부디 법정 최고형량을 ""선고""해주세요 그리고 집행해주세요",16
user-uq2uu3ox7d,판사 딸이 저런일이 생겨야 형량이 늘어나는 계기가 될텐데,3
hipalette,꼭 처벌해주세요 세상에나..거세를 하든지 해야지..무서운세상이네요ㅠㅠ피해자분이 멘탈이 대단하네요 힘내세요,13
user-xp6yh1ew7k,와 세상에 무서운 사람 많구만.. 여자분 힘내세요…,0
user-ck9uu6le2w,아니 저런 새끼가 여자를 공격했다면 당연히 성폭행 하려고 공격했겠지.. 진짜 답답하네...,278
jinhee-yk8jd,이번뿐만아니라 청소년때부터 전과가 계속 쌓이고 있었는데 솜방망이 처벌로 인해 계속 풀려난걸 보고 기함 했습니다. 바늘도둑이 소도둑된다고 이번에도 제대로 된 처벌이 이루어지지않으면 다음엔 살인이 될것 같아요.. 제발 이번에라도 확실한 처벌이 내려지길,20
user-xt3hx6dk9w,선처없는 처벌 부탁합니다.. 그알에 피해자님 나오셨는데.. 마음 아팠어요..,28
user-dn8cq7lj8y,"볼수록 드는 생각,,,,,,, 남을 해하는것들은 제발 좀 밖으로 나오지말고 영원히 사회와 격리 시켰으면,, 저런것들에겐 인권이란 이미 없음,,,,,",0
user-nl5ct1jr5o,피해자를 보호해주세요ㅠㅠ,12
user-cg8uw6km6e,저런 쓰레기들이 있는 이유는 법이 약하기 때문이다 제발 법 좀 강화해라,1
user-rl8lr9fu3k,지가 잘못해놓고 분노와 복수에 가득차있는게 정말 소름돋고 어이가 없네요.. 피해자도 아니고 가해자가요. 훗날 피해자보호도 꼭 필요해보입니다,170
YeongWoo,가해자짐승들의 인권도 챙기기 위해 힘써주시는 모든 분들께 이 영상을 바칩니다.,44
cnrwpcnrwp,앞에가는여자에게 뒤에서 이유없이 돌려차기하는거 진짜 충격 ㅜㅜ,22
mimi-qj1lc,저런놈은 무기징역해야지 사회에 풀어놓는다고 생각하니 끔찍하다,1
user-cx8rv8bu7u,판사님 강력한 처벌로 법 질서를 확립해야 합니다,138
hyejjinnnnn,가족 친구 지인이라고 생각하면 치가 떨려서 몸이 떨린다. 법이 이 모양이니 수많은 피해자들 억울해서 어떻게 살까,0
onmyown6174,진짜 피해자분 평생 저 트라우마 견디면서 사셔야하는데 보호 제대로 받으셨으면.. 제발 저 쓰레기를 사회에 풀어주지 맙시다 누구나 당할 수 있는 일입니다..,247
user-sq3zf4mh3g,도대체 누구한테 기회를 주는건가요 잊고 다시 힘내서 살아갈 수 있도록 피해자편이 돼주세요,4
user-on8fw8ul1z,피해자분 일상적인 생활하실수 있도록 사회에서 지속적인 보호 잘해주시길 바랄께요~,2
