작성자,내용,추천수
skflskfltkfkd,친정집에 오는 마음이 안좋다라... 고작 그정도 마음가짐으로 무슨수사를 하겠다고... 진짜 다 때려부수고싶네,0
user-cw7yr5jj1k,평소 저는 유럽인 친구들에게 한국에서 일어나는 뉴스에대해 짧막하게 전해주는데요.... 이번 사건은 진짜.... 쪽팔려서 말 못하겠습니다.....,45
user-ev7fx8sl9j,강력하게 처벌해야될듯~ 군선변호인도 혼줄나야할듯....함!!!!!!!!!!!!!,0
wise_writing,사형이나 무기징역 그 미만은 다 유착관계로 같이 집어넣어서 똑같이 때려야된다,0
user-lx8gd8nd6m,그저 안타깝습니다...,0
user-dp6is3zh7l,"남편이 ... "" 야! 아무래도 안되겠다 국선버리고 사선으로 가는게 낫겠다 돈이 문제냐! 니가 문제지"" 이랬으면 자살까지 안 갔을텐데... 안타깝네요 고인의 명복을 빕니다",0
saida1004,국선변호인이 문제구만 인간답게 살아라,268
ou8401,군대는 아직도 시간이 멈춰있구나.. 참담하다 시대가 이렇게 변하는데 왜 이 곳은 계속 멈춰있을까...,1
hyeonlee6846,진짜 대대로 천벌 받아라 간절히 빌어주마,0
daeseobchoi9370,진짜.... 이 쓰레기들을 어찌 치워야 할꼬...,6
a32509179,국선변호사 공개하고 변호사로 자격없으니 세상에발 못붙이게하고 감옥에서 썩게만들던가 관련된인사들 다 처벌해야한다 살인지들이니까,0
user-ox4ke8pb7i,국선변호사가 자살까지 방조한샘이네 현실적으로 어떨지 모르지만 살인에 가까운 질나쁜 처사이니 반드시 엄벌하고 변호사의 의무를 의도적으로 다하지 않은것에 변호사 자격 박탈과 다시는 사법시험도 못보게 하고 법관련 직업을 갖지 못하게 했으면 좋겠네요 내가 저분 남편이었다면 법이고 나발이고 전부 첮아서 눈깔을파버리고 젓몽데이 잘라버린다 시뻘 열받네,0
user-fr2mw4yu5n,나같음 어짜피 죽을라고 결심했음 그냥 안죽어요 그놈도 죽이고 죽지 사회의 악은 용서는 없다 난 반드시 보복이다,28
user-bx9hx2bn7n,"개선은 이루어지지 않을 듯, 변이는 유전자,바이러스만 있는게 아니네요. 고인의 명복을 빌어줄 뿐...",0
user-vm7kf6ql9h,국선변호사들은 원해서 사건을 처리하는것이아닌 배정이고 부당거래영화대사에 보면 건당 30받는다면서 대충하는장면이 나오는데 현실도 비슷할듯,83
user-zr3gf6le3v,의사든 변호사든 군인이든 인성검사 도입해야겟다 쓰레기 천지네,54
user-uc7uq2li5u,맘 아파서 끝까지 못보겠어요 ㅠㅠ 지켜주지못해서 미안해요 미안합니다 죄송합니다 ㅠㅠ,0
user-pe6dr7ip5t,국선변호사가 혼자서 저럴일은 없을꺼라 본다. 분명 위에서 덮게끔 지시가 내려왔을꺼임 최대한 합의 유도하게 끔.,205
user-oh2lu4uk1v,맘편히 쉬세요 저같아도 죽었을거 같습니다,0
youngjung1498,솔까말 .... 변호사 비싸도 결혼할사람이 그런일 당했는데 진즉안바꾸고 가만히있던것도 참,0
0-0a.,하 마지막에 한말이 속이 시원하네 도대체 누굴 비호하려고 그렇게 얘기하냐고 버럭한거,0
user-kn8gq4nd1c,"국선 변호사 당신도 책임이 아주 크군요 죄값들을 다 어떻게 받을려고,,,",0
user-fi1dh8cb9v,"저러니 나라를 지키고도 존경은 못받고 군바리 소릴 듣지, 하긴 저런 인간들이 나라나 잘 지킬려나 의심이 든다..",57
user-il1hv5eb2b,에구...사선 몇백 그냥하지....부담되는건 알지만 그래도 목숨값에 비하면 아무것도 아닌데...아까운 생명 진짜 ㅠㅠ,0
user-vq8qv3ye9s,군 전체가 가해자다 이건 몇몇 선임들만 구속한다고 될일이 아니라 군전체를 뒤집어서라도 바로잡아야 한다 법조계는 민간이나 군이나 ㅈ같기는 매한가지 사법부를 갈아엎어야지 나라가 살겠다,0
luciferdraven3948,일단 사람같지도 않은 변호사놈 면허박탈하고 관련된 공군 간부 전원 파면해라,250
user-et7rd8tv5y,'삼가 고인의 명복을 빕니다' 억울한 일 앞에서 발만 동동 구구르고셨군요 이렇게 목숨을 끊고 밝혀진 난뒤 밝혀진 내용이지 아니면 아니면 혼자 독박 쓰고 묻혀질 사건,0
seungchulpark2601,아니 남편이 있음에도 불구하고 저렇게까지 하는건 남편을 완전 호구로 보는거네???? 사람이 할짓인가;;;;,0
carrotplug2952,국선은 쓰지말아야겠네.. 국선변호사는 대체 왜 누구를위해서 무엇때문에 있는거지??국선변호사도 국민의세금으로 먹고사는거 아닌가요??,891
XeBiNl,관련자들이 다시는 재기할수 없게 지옥으로 보내야한다.,0
user-hi2pj8ui7d,"이해가 안가는게 자살할 정도로 스트레스 받고 했으면 몇백정도 들여서 확실히 하는게 맞지 도대체 왜 사선쓰자고 했을때 돈아낄 생각을 한거지..? 중압감을 느끼는 사건에 국선변호가가 대충한다고 느꼈으면 사선을 써야지 도대체 왜,,,,,,,,,,,,????",0
user-qr3wl6rs2g,진짜 더는 기사 보기도 너무 힘들다.. 가해자 잡아와서 모든 국민이 보는 앞에서 물리적 거세 시키자 노마취로,8
user-ud4ud3wf5h,양심에따라 숨김과 거짓이없이... 이사건 국선변호인 떡잎이 노랗구나 앞으로 얼마나 악을일을 할지 안봐도뻔하다 더러운돈을 벌려고 변호사가 되었네 너에게는 소신이라는 것도 없지~,12
jeeyye,아..욕나오네 참 슬픈 현실이다.,0
angelakyong9805,꼭 이렇게 사람이 죽어야 조사가 시작되는건가요? 스포츠계도 그렇고 다 썩어빠졌어.. 정말 안타깝습니다,3
heesookkim4759,국선변호사 사주받아나보네 그런인간은 면허취소시켜주시고 엄벌해주세요,0
user-vs3yd6ml3y,정황을 보니 국선변호인이 직무유기만 안했어도 한 생명 살릴수 있었던거 같다.,0
user-qj3lf7ic9b,국선변호사 파면으로 끝나면 안되고 형을 살게해야 합니다 그리고 국방부 감찰을 믿을수 있을까요? 가재는 게 편인데요 외부에서 감찰하게 해야합니다,68
user-dx3ov3vt5s,뭐든지 죽어야해결된다는것이 슬픈일 그전에 좀 잘들어보고 해주면 안될까요 정말,0
user-tz3wx1cv2e,"2:11 법사위원장이 소리칠 때 순간 울컥했음,, 피해자를 애도하며 진심으로 분노하는거 같아서. 공군 법무실장이란 ㅅㄲ가 가해자를 쉴드치네",0
user-di2hu2ry9l,"그나물에 그밥이지 , 저런것들이 뭔 장교랍시고 세금 받아가고 연금수령하는지 , 이번사건 연류자 , 상관들 싹다 전역시키고 연금도 주지말아라 역겹다",0
user-up8sy9mr6n,"사전에 막을순없나, 항상보면 누구하나 죽고 유족들 제보하고 해야 그제서야 움직이는게 시민으로서 믿음을 가지기 힘들게한다",0
parutia,"국선 변호사는 변호사 자격증 박탈하고, 민사로 목숨값을 돈으로 배상하게 만들어야 하겠네... 정부가 배상하고 국선변호사에게 구상권 행사하는것도 좋은 방법.",178
user-by2qz3qc6g,사람 죽고나서 사건이 해결되는건 죽을때까지 고치지못할 대한민국,0
ngede80,누구든 간악한 욕심 부리지 마라 이 사건의 모든 것은 사악한 욕심으로 시작되었다 인생 쫑 난다!!!!!!!!!,265
liiililliliiilililiiliili1521,ㅠㅠ국선변호인이 저정도일줄이야..,0
sonyah9480,아 저 관련 범죄인들 및 책임자들 인권유린을 기반으로 무마취 성기제거수술을 강행하고 그 과정에서 사망시 폐기물 분류시켜 무장례로 폐기처분 해주는게 진정한 정의구현라고 생각해요.,0
user-bp3cb6bm7n,법세련은 이수정은 뭐하고 있는거죠 비겁한 선택적 정의를 택한 그들이 더 상황을 악화시키는데 일조했을수도 있겠단 생각입니다 조사를 더철저하게 해야하고 법개정을해서 외부변호기관에 맡겨야할듯 합니다,17
user-xx3su4qb8o,자격 박탈!!변호사 자격까지 박탈시켜야 한다.,7
user-st4wc4tt9k,죄값 제대로 받게해라 군인 연금이고 뭐고 받을 생각 1도 꾸지말아 이 살인자들아!!! 국선 변호사 자격박탈,0
spacegg30,국선변호사가 문제네 공군법무실.. 아 열받네 시대가 어느시대인데 썩어도 한참 썩어있네,150
monchimonchi450,변호사도변호사지만 이사단을 만든 공군 가해자들 싹다 치우자 그사람들한테 나라는 어떻게 맡김..,0
user-wx2zo1df7z,국선변호사가 일은 하지않고 방관만 했기때문에 죽은겁니다. 가해자&공군 법무실&국선변호사 이 들은 있어봤자 사회.악일뿐입니다. 내보내세요. 국민세금이 저들의 월급을 줘서 피해자를 만든다고 생각하니 끔찍합니다,0
user-fu9vk2gk4s,"윗물이 맑아야 아랫물도 맑지~ 윗대가리들이 여성을 성착취의 대상으로 보고 끊임없이 성범죄를 저지르고 있는데, 아래는 오죽 하겠어~! 이게 우리가 꿈꾸던 나라였나???",22
user-ib7nn8ky7h,일반회사도 회식하면 여자직원들만 잇을때 말농담 섞는 사람들도 있고 성추행 진짜 아리까리하게 하는 놈들도 있음.,2
user-ns6sh3vs8r,진짜 창피하다 창피해 국선변호사가 어휴,0
user-uy5rx3xl9g,이사건 이중사 사건 조금이라도 관련된 인간들 싹 다 잡아서 전재산 몰수하고 국민들앞에서 공개처형 시켜라 화가난다 참나,9
user-ok2tv6sj8p,와 진짜;;; 저러니 군인들 개무시당하지,0
myungheekim6531,"국선변호사 신원 공개하라! 공군법무실 인간들도 모두 신원 공개, 직무해제 하라! 국방부장관, 너부터 그만 둬라!",42
user-pk2nl4xj8e,"성범죄 가해자와, 국선변호사, 그리고 사건을 덮으려던 군이 해당 군인을 죽인거나 다름없다. 이건 살인사건이다.",3
user-bf2bx1gt6l,가해자넘은 군법중형으로 엄중히다스리고 사법재판관 선임하여 합동조사판결 물건거세하고 무기에서 사형으로 판결되야한다,0
aurakim7859,너무분하고 억울합니다.,0
user-bf2ji1np7o,이 사건 ᆢ 분명 당사자들 처벌 받아야 마땅하고 그렇게할수있는 증거가 차고 넘치는데ᆢ 부부간 사적 대화내용까지 까발리는건 뭐지?? 요즘 언론은 언론이 아니다,6
user-li4pl3fu8w,관련된놈들 모두 사형시켜라!,0
user-xg1om4jx1k,나중에 가해자도 자기 자식이 저런 취급 받거나 자기 와이프가 당해도 말 할수 있는게 없겠네ㅋㅋ 내로남불이 될 테니까,0
user-pk4ff9it9g,남편은 아내가 죽기전에 고민을 상의 했을 터 죽기전까지 고민만 나누고 뭘하고있었나? 답답한 사람이란 생각이드네,3
user-pl2zn2kz8z,"극단적인 선택으로 해결책을 찿아서는 안된다고 생각한다 끝까지 살아서 박살내든가 묵사발내든가 그것이 최선이다 하나쁜인 생명은 귀중하다 가족들의 아픔은 어찌하고,~~~",0
user-johgh,전부다 연금 한푼없이 불명예 제대시키고 형법으로 중죄 처벌해라,6
tastegood1425,돈없으면 법의 보호를 못받는... 이게 인권문제지... 괸히 엉뚱한 인권찾아 흉악범형량이나 낮추고... 참...,0
user-zp4eh4hj1y,진짜 나쁜넘돌 빌어먹을것덜 다 범인들잡아 죽은사람 한을 풀어줘라. 사회경찰보다 군경찰이 낫네요.,0
user-qv5ds3oz3t,이게 세상이다 애들아 돈없고 빽없으면 수십년이 지나도 변하지 않는다,25
user-qr5ze7tr8k,안타깝당..ㅜㅜ,0
user-hj2qk8rq3y,나라가 망조가드네요 부디 조운데가시고 이일로인하여 또다른 이차 피해자가업기를,0
user-mq8fm1oe2j,국선변호사ᆢ정말 나쁜놈ᆢ샅샅이 찾아서 책임을 물어라ᆢ국민들은 눈뜨고 이 사태를 지켜보고 있다ᆢ누가 나라를 위해 목숨을 바치겠는가ᆢ이 나라군이 이런데 누굴믿고 살겠는가ᆢ자식 가진 부모로써 하늘이 무너지는 느낌이다!!,5
kimmr7581,진짜 열받는다 후~사회가 썩었자나,0
user-vd9ms7tg5b,몇백 선임료보다 재판이 먼저아닌가ㅠㅠ 돈이 웬수인나라ㅠㅠ돈많고 빽많으면 살인도 무죄되는 나라ㅠㅠ,0
jykim2096,우리나라 군대문화는 일제 잔재가 아직도 많이 남아있다. 윗물부터 뼈를 깎는 개혁을 해야하고 비리행위자는 엄단하여 발본색원 해야한다.,97
user-ch9wm3jp4o,얼마나 더 죽어야 고쳐질까요... 지금도 하는 시늉만 하는거 아닌지....당사자들도 나만 재수 없게 걸렸네 라는 생각 아닐지.... 썩은내 나는 각종 비리들 제발 좀....,0
howard1714,이러고 저러고 말 필요 없고 해당 부대장부터 관련자 모두 직위 해제하고 모두 교체해라 그리고 그놈들은 모두 구속 시켜야한다. 저런놈들에게 어떻게 나라를 맏긴단 말이냐 기강이 완전 당나라 군대보다 더한데 저런걸 믿고 국민들이 살아야 한단 말이냐. 모두 불명예 제대 시키고 민간인 신분으로 재판받게해야한다.,1
user-pk6rp4hv5o,말이변호사고 국선이지 국선변호사 제대로된 변호사가없네요 말이변호사지 돈안주면 거의구찬아합니다,187
user-de2mu6si5d,"이것도 그냥 넘어갈 확률이 보이는게 넘 슬프다 LH도 뭐 하나 족치고 넘어간거 없자나 꼬리자르기 하겠지 그러니까 악순환 미친것들 이미 국민들은 믿음,신뢰가 떨어졌어 삼가고인의 명복을 빕니다",0
user-fy5po6hc2c,고인물을 거둬내야...맑은물이도는거지.. 윗대가리들 썩어빠진것들 다 처내야된다..,0
user-lg9sj2pf7f,저 썩어빠진 늙은이들의 명령과 처우에 둘러쌓여 기다려야 했던 심정....토할거 같음,29
user-wy1uu9xt6b,저런놈은 변호사 자격 박탈시켜라 ! 저딴게 변호사라고,0
kevinkim9998,유부녀 이었던것 같은데 삼가 고인의 명복을 빕니다 남편님 그놈들 한놈 한놈 찾아서 거세 하든지 발 목아지 힘줄을 아니면 그 마누라들 몇년이 걸리든 하셔요 리스트 작성 하셔요 그놈들 밤에 못돌아 다니겠다 ㅎㅎ,0
user-ql2li6kn3y,썩을 넘의 국선변호사 이름을 공개하고 변호사 박탈 청원합시다.,303
qwerty0248-,와 저 자식 ... 직무유기로 사람이 죽었으면 이것 역시 살인아닌가,0
H-ARMOUR,인재 한명이 나라에서 사라지고 쓰레기들은 살아남고 이런식으로가면 나중엔 쓰레기들만남는 세상이되겠네,118
user-cn5gr2pp8v,잘 못했으면 벌을 받아야지 그게 군인답게 소극적인 도망가지말고,0
user-ld4lw6ei1b,자살하는건 지는건데 똑같이 갚아줬어야지 대한민국 법은 믿으면 안됨,0
wlgnswhejs,무조건 징계 받던말던 이런 큰사건은 언론에 크게 터트리는게 맞는게 절대 공론화 안되면 이새끼들이 덮으려고 함 절대 큰사건 안됨,85
albertlim1773,"국선변호사 신상 공개하고, 해당부대 뿐 아니라 그 상급자 전원에 크던 작던 처벌을 하지 않으면 대한민국 절대 안바뀝니다.",0
user-il4gb2iq9v,여성분들은 군에가지맙시다 성폭행당해도 누가하나 보호해줄 사람 없는데ᆢ 죽어야 끝나는 인생이라면 참 이나라 대한민국 법을 확~ 바꾸지않는한 범죄자들이 설치는 나라가 될것같아 후세 범죄천국이 될것같아 염려스럽네요 강력한 처벌로 약자는 억울한일이 없었으면 좋겠습니다,0
dedysokgni7735,군검찰 없애라 전시상황에만 있어야되는게 왜 있나~~고인물은 썩는다..모든권력집단은 서로의 견제가 되야 투명해진다 군검찰제 없애라!! 개검도 해체!!,63
Skjsjwndidolf8173,살인자와 강간범도 변호해서 형기 잘만 낮추더만 ... 어찌 억울한 사람 변호할때는 무용지물이 되는가 ....,0
user-hb4fj3be5h,관련자죄다파면하고 옥살이해야함 이건보면볼수록개빡치네진짜,0
GreatHeungJae,"사법부도 문제, 공군 법무팀도 문제~ 국선변호사가 누군지 관련자 모두 강력 처벌해라!!!",13
jeong4379,에휴 안타깝다..,0
user-on4bp1pd9t,남의 아내를 탐내지 말라...,0
jhshin9413,국선변호사는 수임료 적게 받는다면서 불성실한 부류가 많지.,25
kiseongyeom724,장관들에게는 법이없습니다,0
user-nj7fu6qz5z,"친정집에오는 마음이 좋지않다고라고라? 생떼같은 자식잃은 부모, 남편 좀 생각해봐라. 그마음은 어땠겠나. 죽음을 선택할수밖에 없는 상황으로 내몰은게 바로 그 너그 친정이다.",0
user-to3it1ip4k,세금 받고 그자리에서 잘놀았으니 벌을 달게 받아라 내가볼떈 10년이 적당할거같다,18
JungminRC,완전히 저 한통속 속에서 있었으니 해결할수가 없었군요,0
tv-gg9bw,약자편에 서라고 국선변호사가 되신것 아니었나요 혹 권력이 있어야 열심히 변호하셨을까요...,1
user-zz4vy9wk9c,그래 . . . 위에선 항상 하는말이 기자들에게 제보 하지 말라고 하더군요 조용히 넘어가자고 . . . 잘 먹고 잘 살아라,340
user-jm3ov5le5s,가해자 포함 암묵적으로 쉬쉬한 부대도 그나물에 그밥이다. 이 가해자가 이번 일이 처음이겠나. 이런식으로 쉬쉬하고 묻힌 성범죄 더 있을거다. 더군다나 저렇게나 군대에서 은폐시켜 주려고하는데 저런 군문화에 환멸감이 안느껴지는게 이상하지.,0
pinesun6380,저 양심없는 국손 변호사 ㄱ 속됬다는 기사부터 나왔음 좋겠네요!! 썩은 공군 저 쓰레기들을 믿고 나라를 어떻게 맡긴다고..,0
jhlee3355,딸이 군대간다그러면 무서워서 뜯어말려야하는 상황..그나마 이런걸 알게되서 다행이라면 다행이랄까..몰랏음 딸이 여군된다하면 그냥 보낼뻔했자나,4
user-rg1bb8rj2t,미친것들이 제정신 가진 사람들을 다 죽이는구나..기득권들의 민낯을 제대로 보여줬다.ㅜㅜㅜㅜ,0
CurtisAgain,"대처법이 틀렸어. 연계 책임을 지는 시스템을 당사자에게만 책임을 묻도록하고 상관들이 사건을 감출려고 하자않고 투명하고 객관적으로 진행할 수 있도록해야지. 그냥 윗대가리들 마이너스 되도록되어있는 현시스템 두고 어찌헤본들 이상한 것들은 사고치고, 윗대가리들은 숨기려 할 뿐이다",0
user-fq1nq4cz3m,국선 변호인 밥줄을 끊어 놓아야 한다~~~~!!!!!!,36
user-zs7gt5kw4m,남편 무능력 그자체네 아내 사건을 알고도 너무 방치한거아니냐 나라면 변호사 멱살 잡고 캐리하겠다 변호사 새키는 옷 벗는게 문제가 아니라 대부분 변호사들이 저러니깐 걍 로스쿨 없애,0
lea_sangeun,세상 더럽다 진짜,0
user-mw7xb2wt5u,이나라는 누가 죽어야 증거다 빼돌리고난뒤에야 뒷북치는 나라 피해자가족까지 혈압터져서 일상생활이 안될때까지 기다렸다가 눈가리고 아웅 개똥법,124
user-ht9jr2gc7c,이런거 뿌리좀뽑아라 솜방망이 처벌이니 이런일이 끊이질 않는거야,0
lani6580,"남편 ㄹㅇ 개불쌍하네 어차피 혼인신고 하고 자살할거면 왜 한거임? 남편 하루도 안 되어서 자살 유가족, 돌싱남 되었네.. 불쌍하다 ㅠ",0
user-cu9qs5ge9s,군대 갓다온사람은 알제? 계급이 깡패다 왠만한 이등병도 상병 갈굼에 머리통이 터질것같은 그곳에서 간부한태? 저분은 천사다. 나한태 걸렷으면 니들은 ....,17
user-jv6zg2th4t,국선변호사 해임 시켜야 합니다,0
user-iv8ir5gq7k,맡겨도 군국선변호사에게 맡기다니...,0
user-yd2dx6qm4b,아니 국선변호사한테 돌리는거봐라 ㅋㅋ 그냥 문제제기한거 씹은 윗대가리들 문제다. 걔네부터 잡아라,72
saystory58,아무리 국선 변호인이라도 이건 아닌거다. 코로나로 격리중이라면 변호인이 직접 다른 변호사로 바꾸던가 했어야 맞는거지 마냥 피해자를 기다리게 하나 그냥 변호를 하기 싫었던것 혹은 윗선에서 압력을 넣어 그냥 변호를 포기하게 만들었던것으로 보인다. 에라이 ~ 그 국선변호인 면허 취소하고 빵에 넣어야 맞을듯하다,0
MrCbn1515,"친정집이라고 스스로 증언하고있는 국방부수사기관도 없애고 경찰이 직접 조사하도록 법제도를 바꾸자. 지들입으로 친정집이라하니 객관적으로 제대로 수사를 쳐 하겠냐고. 국방부수사관,군사법원 다 없애고 경찰이 직접 수사하고 사법부가 직접 판결도 맡도록 법을 바꿔야한다. 국방부에 소속되어있는 기관들이 애초에 스스로 수사하고 판단하는 기능이 제대로 될 리가 없다. 국방부소속이 아니고 외부에 따로 독립적으로 존재해야 국방부 눈치나 압력없이 비판도 수사도 객관적 판단도 가능한거니까. 쟤네가 수사하고 판결하면 다 짜고치는 고스톱밖에 안된다. 사건 덮고 은폐하고 축소하고, 썩을 것들. 피해자가 왜 극단적 선택을 했는지 생각해봐라. 가해자와 모두 다 한패니까. 공군법무실도 인권센터도 공군소속 국선변호사도 국방부수사관도 군사법원도 숨막히게 전부 다 국방부 소속들 뿐이니까. 다 한패고 지들끼리 짜고치는 고스톱이니까. 국방부가 폐쇄적이라 외부기관이 하나도 참여되지않으니까, 감시하는 세력이 없으니 지들끼리 고여서 썩어서 온갖비리와 연고로 지들끼리 사건 은폐,축소시키니까. 피해자의 말을 들어주는 사람이 한 명도 없으니까. 군사법원, 국방부수사기관, 국방부소속변호사 전부 다 해체시키고 경찰, 사법부가 담당하게해라. 견제세력이 없으니 지들 세상인 것처럼 굴지. 다른 피해자가 더 많을 거다. 그러니 국방부의 폐쇄성을 박살내야한다. 경찰과 사법부가 국방부를 견제하도록해야한다. 그게 국방부의 미래를 위해서다.",0
hika3338,이건 맡은 국선변호사 누구냐...? 변호사는 공인된 사기꾼이란 말들을 이래서 하는거야!!!,25
27identity32,군대만큼 고이고 썩고 폐쇄적인 집단은 바꿀수가 없음. 하물며 2년밖에 안있는 어떻게 보면 계약직인 일반병들한테도 처우가 개판오분전인데..;; 개혁이 필요하다,0
avici3057,국선변호사한테도 직무유기죄를 물어야 되는거 아니냐?,3
36500manbok,공군이 매우 멋있어보였는데 안으로 썩어었구나.... 자정능력이 전혀 없었네.. 이럴수가.... 뉴스를 볼수록 점점 답답해지고 분노가 업된다. 피해자 가족의 답답함과 분노가 느껴진다. 난 지켜 볼꺼야 이번에 이일을 군과 법이 어떻게 결론내는지.. 아침부터 물도없이 고구마 백개먹은 기분이네,0
user-pq1fs7ik6m,"국선 변호사 면허 박탈시키고,군에 재입대 시켜서 갖은고초 다격게 만들어야된다,저런인간이 국선 변호사라는게 챙피하다,",1
anaalaya,성범죄 성향 강한 남자가 생존하기 좋은 곳: 조직.....자기 밑으로는 다 먹잇감.,239
user-cf8jh9zu5r,모든게 썩었다 더러븐 세상ㅜㅜ,1
11inmorning81,진짜 피해자만 죽어나가는 세상이네,0
blackreal1067,친정집 발언 ㅋㅋㅋㅋㅋ 이잡듯이 잡아내라고 보낸놈도 한통속이네 고인물에 썩은물에 .. 이런상황에 교체할 물도 오물이네,505
hobbyholic_LoveLive,국선변호인이 사망사건의 핵심으로 느껴지네요.,0
juliap7612,친정집..죽은 사람도 남겨진 사람도 어찌살라고 저런 말을 하는가..,0
user-jx5qt2gs8d,회식에 가봐짜 더런소리듣고 술마시고 이간질하고 회식문화 좋은게 절대 아님 오래전부터 회식 안좋다고 계속 말해왔는데도 못고치네,111
user-ex1rv6ek8m,변호사 면허박탈하라 영원히퇴출시켜라,0
sophiakwon4083,아니다 싶으면 직장이 공뭔이고 군인이고 제발 그만둬..... 왜 소중한 목슴을 버려..제발 제발 그만둬.. 어케든 먹고는 살아. 이중사가 변호사선임땜에 돈걱정에 직업을 놓고싶지 않은 걱정에 부노임 걱정에 이런저런거 다 치여서 본인을 못돌본거 같은데. 내가 죽으면 다 끝나요...제발 관두고 살자 좀 ...,0
user-Elfline,가해자들 소속을 친정집이라 표현하네 ㅋㅋㅋㅋ 사람이 죽고 이난리가 나도 저렇게 쉴드 쳐줄정도면... 평상시에도 많이 강간하고 무마시키고 했겠네,83
kju-fv6gq,공군 뿐만아니라 군 전체를 개편 해야한다 솔직히 너무 폐쇄적인 공간이라 저딴 범죄를 일으켜도 잘 나오지도 않고 나와도 지들끼리 쉬쉬 하려는것도 심하고 이렇게 3사 방송에 나와서 전국민이 난리를 떨어야 죄를 묻는척 만 하는데 이게 군인이냐? 깡패집단이지 국민을 보호하는게 아니라 목숨을 담보잡고 권력을 가지고 괴롭히는것들을 우리는 깡패라고 불러요,0
user-dd5xx6vu8f,국선변호인 엄벌에 처해주세요,0
user-oi7ld6wh6m,유전무죄 무전유죄 선생님 너무 빨리 가셨습니다 아직도 당신의 명언은 현재진형행입니다,0
jbk5349,더럽고 추악한 것들... 변명 그만하라고. 유착관계가 그렇게 자랑스럽던가. 일 하나 똑바로 안하면서 직업적 자부심은 넘쳤냐. 저런 것들이 왜 일자리를 꿰차고 있냐고.,0
