작성자,내용,추천수
user-yy1ky6lt4q,국선변호인 저넘도 못된 넘이네 시원하게 변호하고 합당한 벌만 내렸어도,0
ra4950,이새기들 군검말고 검찰 투입해서 싸그리 잡아들여 재판해라,0
user-mf6bb2nj9p,법에대해모르는사람들국선나무라죠?ㅋ 현실은변호사도마찬가지다 싹다가져다줘야한다요 증거며뭐며 모두다가져다줘야 합니다,0
stoo293,그냥 니들도 죽음으로 용서를 구해,0
user-pk3zo5sc1k,국민들이나 경찰관들이 나 다 나라 망해 먹었다,1
jobonguk77,저 남편이란새끼 지마누라 당했는데 가만있었다는거도 이상하다 고인만 불쌍하네,0
user-sf9bk5dp9t,그 나물에 그 밥이지.. 고양이 입에 생선을 물렸구나.. 못되쳐먹은 국선 변호사.. 저 자식 변호사도 못해먹게해라..,0
royKIM92,무면허인 내가 변호해도 저렇게는 안하겠다,0
user-sn6wy4xc6x,썩을만큼 썩은 조직... 이런곳에 내자식 내새끼를 보낸다고??? 난 유승준이 이해가 간다,0
user-vu9fl7gk3w,아직까지도 변명이나하고 . . 썩은것은 도려내야지 똥인지 된장인지도 모르는데 무슨 나라를지킨다고,0
user-ut3gp2ni4g,저 변호사 어떻게 됨? 여전히 잘 먹고 잘 살고 있겠지? 이 검찰공화국에서는 당연한 일일듯,0
user-lw9wc5ml6c,국선변호사두 다똑 같은 인간입니다,0
user-wt7bv6lu1q,"가해자, 국선변호사 얼굴공개해라!!",0
J.H.C.,국선변호사 신상공개 하고 자격박탈해야함,0
user-ux5mg2ov5w,국선변호사 직무유기 처벌해야 하지 않나요? 이런데 여자도 군대 가라고? 욕나오려고 합니다. 무덤 팔일 있나요? 절대 안가지.,0
user-zu4ce5ni3c,결국 저 변호사 소송걸리고 다른변호사 선임했잖아 ㅋㅋ 좀 문제 많은거같은데,0
user-ok5wv2qg9y,지금 정부의 무능이 드러난 현실 국민의 죽음이 여기저기 성추행도 여기저기 그래도 부끄럼없이 뻔뻔하고 책임없는 현실,0
kty083,세월이 지나도 변하지 않는 군대 그나마 인터넷이 발달했으니 이정도 까발려진거지 예전에는 얼마나 더 더러웠을지 갔다온 사람들은 잘알지,0
BLUESKY-ps1fw,이건 국선변호인도 자살에 50%는 영향 줬다고 본다,0
user-wv2hq5ui9s,변호사가 제일 나쁜넘이었네;; 국선이라 일제대로 안하는거냐 나라돈먹고 사는애가 국민을 위해야지 넌 돈 받아 먹을 자격이 없다,0
user-gy4yd5pc9p,캬아. 역시 대한민국...,0
user-gy7xc9mn2t,"일 그렇게 할거면 그냥 사선하세요.... 누구나 자신을 변호할 권리가 있지만, 사정상 사변 선임이 어려운 이들을 위한 제도 아닌가요??? 특히나 이렇게 특수한 환경에서 자기 변호가 더 힘든 경우라면, 더욱 그러셨어야죠... 탄원서는 왜 한달이나 보관하세요??? 읽긴 했나요? 너무 답답하고 불안했을 당사자와 그 가족을 생각하니 화가나고 슬픕니다.",0
donghyuckkim,국선변호인 한달보관하셨으면 한달 구금하고 나오세요,0
user-zf2pj9rl8k,도대체 이 ㅈ같은 정부는 하는일이 뭔가요? 왜 이런 말도 안되는일이 벌어지는지 참.... 진짜 한번도 경험 안해본 나라...지긋지긋하다,0
user-sf6me6tz8m,국선변호사 자격박탈합시다,0
user-zf7cc5pc9q,국선변호인 그놈을 구속해라,0
deborahkoo3778,충분히 막을수 있었는데 한통속이니 ? 국선 변호사 ~ 법망을 피해서 또 살아 나겠지요 아직도 한국은 국민성이 후진국이네요 I'm Korean 이라고 말도 못하겠네요,0
user-kp5er8xq4r,국선변호사 군검찰 모두 수사해라,0
user-hz3kp5ci9s,정떨어지는 나라 진심,1
KimGWanHo,그것들 거세해라 물리적으로 그담에 여군으로 편입시켜라,0
user-lr4kd4sg8u,나라가 개판이다 국선변호사는 공범이다,0
vvdnqnfiwkqv7684,점점 갈수록 가해자가 한둘이 아닌데??,0
user-nh4ot9vc4r,군법으로 총살형이 맞겠군. 이러면 성범죄 하겠냐?,0
user-mm3fs6je6k,깡그리무너뜨리고 첨부터 다시시작해야한다 얽히고섥히고 엮혀있는데 어느한곳을 손본다고 끝나겠나,0
reev3617,아버지가 보낸 탄원서를?????? 왜???ㅠ나쁜,0
user-be3yx2gn8b,"공군이 겉으로 들어나지않아서 그렇지 썩을대로 썩은 부대갔다. 공군법무부 국선변호사 자격박탈안시키나? 저런놈이 무슨 변호사? 직무유기,근무태만,자살방조, 등등",1
sokna-music,국산변호사를 처벌해라~!!태만하다,0
user-uj7fm4lu2w,군인이고 나발이고 내가 남편이였으면 걍 까버렸어,1
user-rr6zi3tx6e,국선 변호사가 한통속이었으니 그 모양이었지,0
user-bv6lt5qb6i,아니 전남편은 왜방간만 했나 전남편이 무심하다,0
user-bj7xw2vv7g,진짜 썩을대로 썩은 나라구나,0
user-fc6bk3tv3r,국선변호사 저넘을 직무유기로 구속하라,0
user-fg1ox9op3b,공군 법무실을 없애라,0
user-ql1nv6zj9t,우리나라는 진짜 다 해 줄 수 있을 것처럼 굴지만 사실… 단 한 명의 성범죄 피해자도 지켜 줄 수 없는 보수적인 사회임 이걸 보수적이라고 표현하는 것도 창피할 만큼… 존나 구린 사회라는 뜻임,0
user-cw1im2tl7m,변호사도 한패였구만...ㅜㅜ,0
user-pc9xe7od7n,그 국선변호사 박탈햐줘요 진짜뭐냐;;,0
user-fw7yc2lj5j,아니 군대 간부가 이런데 나라를 지키라고? 지 그지같은 밥그릇 지키기 바쁜데 애꿎은 병사들만 죽어가는거지,0
hunlee8921,'법'이란 글자만 들어가도 정상적인 사고가 안되고 온갖 썩은내가 진동을 하는데 '군'이라는 더 썩어빠진 글자랑 합체를 하니 아주 ㅈㄹ이 발광이 나는구나,0
user-ed4jc1zr4o,이런일 조사하면 많을거임 군대 안가는게 최선이고 여경도 같은경찰서내 성추행 성폭행 국가에서 변호사10명 고용해서 이런일 당하면 무료 소송 해주어야 함 국선 변호 쓰레기들 말고 연봉1억해바야 10명 10억예산인데 그래야 남자들이 정신차림 같은 인간으로 안보이고 접대부로 보네,0
hunk128,국선 감옥 보내야하는거아닌가요,0
user-bm8vt3zb9e,이게 살인이지 뭐야.,0
user-ty8be2jc5b,참 대한민국 공군이 걱정된다,0
user-ib3py1ks3o,사건 휘말리면 변호사 때문에 두번 죽습니다,0
user-ok9ib9ok3v,이렇게 조사하고 뭐하는척하다가 흐지부지될까 걱정이네,0
user-ib3py1ks3o,잠도 장기간 못 자는데 남친이 같이 좀 살지 혼인신고만 뒤늦게 했는지요,0
s4gk548,변호사 사형하라,0
user-di2el2dt7z,변호사도 조져야지,0
user-ey2dt8bp4n,아직도 여전히 남자들만 좋은세상이라 문제지 ㅅㅂ,1
yellers25,군대를 월급주는 직장으로 만들고 여자들을 남자들 사이에 끼어넣는 촌극이 만든..,0
rosesim1105,여전히 권력과 돈.. 그리고 방관자..,0
NaDa-hz2bm,썩을대로 썩은 군대와 사회를 한번에 보여줬다. 이게 나라냐?,0
user-jl6nf9ec5z,이게 나라냐 진짜 ㅉㅉ,0
user-gv8wd9dt7w,변호사 비용 비싸 도리없이 엉터리임을 알아도 국선에 머물렀다. 왜 변호사 비용은 비싸야만 하는가? 이들 법무 서비스 제공 인력 지금보다 10배 이상 늘릴 수 있는 열린 경쟁 체제 마련해야 한다. 무엇 때문에 저들은 앉아서 코인을 빨아먹는가? 문 닫아 걸고 지들끼리 독식하기 때문이다.,0
user-ex9jj7je2d,국선변호인자격박탈해야지,0
user-sg6fd2dp1i,남편분카톡내용도 그렇고 날짜도그렇고 별 적극적으로 안나선듯... 여자분이 거기에더 수치심이컷을수도잇을듯... 남편분이 들고일어섯어야죠.... 톡내용이..조금.. 연락왓냐고만 확인하는듯...,0
kimkyle4917,비단 군대 뿐만 아니라 아직도 사회에 만연해 있다,0
dongseokchoi3938,국선변호사 구속해라,0
rh-le3pt,한 남은 말살이 답이다. 가만 냅둬도 어차피 멸종하겠지만,0
user-oz7ff7vb5t,이런 것 좀 소비 안하면 안되나. 고인 동정하면서 착한 나에 빠져 사네,0
user-ko4jk8cu2y,"국선변호사가 살인에 동조 한거나 마찬가지, 공부 잘해서 변호사 되면 그래서 대한민국의 기득권이 되어서 지 처자식 떵떵거리며 살지는 몰라도 당신은 이미 살인자야 그것도 벼랑에서 살려달라고 애원하는 의뢰인을 뒤도안보고 밀어버리 결정적 살인자!!",0
user-ik7st2ej5e,군검찰이 법무실을 잘도 철두철미하게 조사 잘하겠다 같은 식구 아닌가,1
user-ft1hf4yx2e,국선 변호사자격 박탈해라,0
milkchoco2964,아니 왜 호통을 침 됐고요?!! ㅋㅋㅋ 개웃기네 이성적으로 좀 해라 감수성이 풍부해서 감성적으로 언행 하지 말고 저런것도 법사위원장 직무대리 하고 있냐,0
evawn4019,공군내 법무실 소속.. 애초에 제대로된 재판이 되지 않는 구조네,0
skykong12s,전쟁은 인간의 몸과 정신을 갉아먹고 문명을 파괴하니 일어나선 안됀다. 근데 저 공군은 전쟁도 안났는데 왜 저러냐? 우리나라 군대 괜찮은거 맞겠지?,0
user-cx6it5wj3o,안그래도 군인보고 군바리 군바리남새난다 할거없어서 군인하냐 남들취직할때 머하고 군인됬냐 놀림당해서 암울한데 이제 공군강간범들이라고 놀릴듯,0
user-on3ft7hd1b,군대를 뒤집어 까서 바로잡아야한다 엄청썩었네 ㅜ,0
user-bt8pz3cv5l,저기 군 검찰법원변호사 다 한통속이에요 군법무실 산하에 있어서 서로 다 형동생하는 사이입니다 재판전후 밥먹고 전화로 다 얘기하고 그래요,0
jmj1399,잘못되면 남핑계을 대는지 모르겠어요 아직도 옛날식입니다,0
wadda3631,이정도면 국선변호사도 공범수준이네 그래 뭐 까라면 까야지,0
user-rw8bp4zz5f,ㅁ ㅣ친... 대놓고 거짓말하는 시대다... 요즘사람들 너무 무서워..~ 뻔뻔해서 무서워,0
meet2423,저 변호사는 구속안하냐?,1
user-ty3pn5tg9c,영화 모범시민이 계속 생각나네요..,1
user-vu5jl7oc3p,남편이 아니고 처음엔 남자 친구라 안 했나?혼인신고 마치고 ....,0
user-dk4jl8yl7p,사람이 죽었어도 변명하고 제 식구 감싸기 바쁘네,0
user-cb2tt1wc2j,변호사가 오히려 중사를 죽였네.,0
user-wm1xo5ku1x,이슈화 시키지말고 사형시켜,0
yen041311,이런것도 변호사라고ㅠ,0
hanae8995,아...... ㅠㅠ,0
lousalome20,국선변호사 신상좀 공개해주면 안되나,0
user-qz2bi9mz9j,변호사이거 아웃이다 정말문제다 문제,0
user-ko9jx6nm4v,요즘 군대 얘기 많은데 임오군란 한번 일어나자..,0
arson1559,첨과 끝이 더러운 집단,0
kim-rh4mw,좀보고배워라 장하영이변호사 적극적인 피해자 변호 아 진짜~,0
user-bv4qo1lz7t,대체 이나라는 언제나 바로 설난지 궁금하다,0
user-cd8eb6su8y,국선변호사 Xxx~하는일마다 열받아요 국선변호사 누구편이냐?도대쩨?,0
user-jl7gc5rc4t,예비역들은 다 알겄이다 군 조직이 얼마나 썩었는지,0
KooWang,국선변호사 99%는 저따구로 일 함. 어떤 사건도 그냥 법정에서 똑같은 패턴으로 만든 서류 낭독하는 앵무새임.,0
user-zt1cv4bv3s,내가 남편이었더라면 다 죽였을꺼다,0
user-qb9fz5xe5l,군대가 조직적으로 다 막았구만... 와~~ 변호사도 국방부소속이구만..이거..,0
user-fy2vi6dm9h,국선변호인 넌진짜뭐냐??ㅜㅜ,0
user-vg1fu5pz4r,국선변호사 보다 그냥 동네 말잘하는 아줌마데리고 와도 변호잘하겠다,0
shlee8872,국선변호인은 형식적으로 하는척만하고 세금만 축내는 건달이오,0
gdol2033,뻔할 뻔 字의 국선 변호사의 무채임한 언어와 행동 ㅡㅡ 지탄을 넘어 응징바람니다 ㆍ,0
happykhys3564,이 사건 보니 공군법무실 국선변호사는 믿을 게 안되는 거?,0
user-zg4qm5uu5t,친정집... 군본부에 속해있는 새끼면 제대로 뭐했겠냐고 다 한통속이지.,0
user-fq7ie4ul4w,저정도면 저 인간도 2차가해자,0
user-jb3gs3nx7l,변호사에 쓰레기 군인들이 사람 죽였네 하,0
user-mm7cf4de8p,국선변호사 진짜 별로인 인간들 많음,1
user-zy5mz5eq9o,월급이 아깝다 뭐하나 제대로 하는거 있냐,0
user-mj4jp7lw4g,전쟁도안했는데 집을뺐기고 노숙자신세가되는세상 광명뉴타운에는 국가유가족에게 입주권도안주고 강제로내쫒아버리는것은 국민차별 노숙자양성 양극화시대 보이지않는 전쟁이다 라는 말이 왜. 모든뉴타운에서 집을뺐겨버린원주민들에게 입주권이라도 찾아주어야 진짜민주주의정부 입니다 저는,0
user-fo1hf3wr5x,가석방 없는 무기징역 시켜라 독방으로~,0
johnpark135,이 국선 변호사 무기 때려야 한다,0
koreayll3239,친정집에 오는게 마음이 좋지않다. 이건 무슨 소리 ... 다 한패거리다. 다 믿는 구석이 있으니 저러겠지.,0
user-mq6xj1jg2p,아니 당일 하루 혼인신고서한걸로 무슨 남편행세를 해? 글고 사선변호사가 몇백이 들어도 남편행세 하려면 지가 대야지 도통 이해가 안되네...도데체 뭘한거냐고?,0
user-nb1qm3fs5w,국선변호인.......너 처벌받자..나쁜× 니 가족일이여두 그러겠냐? 니가한짓도 갑질이야~ 가해재랑 너랑 뭐가달라?????,0
jaeeunshin2010,여군들이 위험하다. ㅠㅠ,0
user-eg8wf1ez2x,국선변호사 문제많습니다!,0
yl170,박주민은 뭔... 어휴 꼴보기 싫다. 물어보려고 불러놓은 것 아니냐. 낱낱이 묻고 답을 받아야지. 버럭하면 지 이미지 좋아질 줄 알고 저러는 거 진짜 역겹다.,0
user-oy7gw9il8n,이정도면 국선 변호인도 공범임 ㅇㅇ,0
user-nj1nd4hs9r,말할거 뭐있어 나는 공군 입대해서 육군에서 재대했다. 그안에 온갖 못된 부조리와 엄청 폭행이 있었음 알려지면 위사람 진급에 문제가 되니까 육군으로 강제로 전출시킴,0
user-kn8bx9cn9y,국선은 그냥 일당챙기는 세금루팡일뿐입니다. 국선중 제대로 인권을위해 변호하려 애쓰는 사람은 지극히 극소수에 불과하지않습니다.,0
user-hu5bi8er3k,다 썪은것들~~정신차려라 이것들아 국민의 세금으로 월급타면서 ᆢ,0
ghkim2220,요즘 같은 때에 무슨 회식이야. 방역수칙 무시하고 아주 제멋대로구만 국가에 의한 폭력으로 생을 마감하는 민초들이 어디 한둘이었던가?,0
moonp3890,근데 자살 당일에 혼인신고는 왜 한 건가요? 좀 이해가 안 되요...,0
MegaBeautifulme1,남자가 성범죄 당했어도 이렇게 뉴스에 나올까..? 남성 피해자는 주목도 못받는 현실...,0
user-tx9xu3pq2z,어이가 없네 이게 나라냐,0
user-yo9xq5yr8v,아 욕 진짜 심하게 하고 싶은데 여기에 써도 되나,0
skyhot586,여가부는 이럴때 필요하지않냐,0
user-gj5us5ep8t,하는거보니...국선변호사도 한통속이네ㅡ.ㅡ,0
user-lz9jb9uv2z,세금이 아깝다,0
user-pp4mg5hn9m,법 전문가도 AI로 교체하자,1
muzicaally7909,색스산업을 활성화해야합니다! 남자든 여자든 하고싶은사람은 하세요. 잘못된 원인이나 사회불만 해결이없으면 다양한 변태적 싸이코패스가 많아진다는 생각을해야지. 성적욕구도 중요한 삶의 부분이고 우리사회가 피하지말고 풀어줘야 성관련사건이 많이 줄어듬. 기술과 의술의 발달로 성병예방법도 많아지고 발전시켜나가서 모든생물의기본인 성활동을 자유롭게해야지 나쁘게보고 못하게만해서는안됨. 예전에는 무지해서 나쁘고 위험하게 인식한거죠. 이제 인식의 전환이 필요합니다. 열린마음으로 쉽게 생각한다면 이상하고 극단적인 성행위가 많이 줄어듭니다. 돈을 제한하면 지하 검은돈이 많아지고 술을 제한하면 마약이 많아지는것과 같음.,1
user-pn9gs7sd8b,어이 그분들? 뭐하냐? 응? 뭐하고 자빠졌냐? 상대가 국방부라서 조용하네 상대방 봐가면서 화력을 보여주는 그 집단 그 학자들..,0
user-xt6gv1we5p,왜이리 변호하는거 처럼 보이지ㅡㅡ 지금 사람이 죽었는데 변호인은 잘못이 없어요 해명한거 처럼 보이네!,0
97ajja,군검찰이나 검찰이나 다 똑같은 놈들이지 뭐...,0
user-ip5ji5bi2e,국선변호사란놈 세상그리살지마라.,0
user-hk6wd7lh7u,"지금 꼬라지를 봐라 정부도 썩었고, 법무부도 썩었고, 군부도 썩었다.",2
rimike6728,군대도 성폭력도 문제네..참...,0
user-wu5gv5ur6o,저런게 군 국선변호사 라니 에라이,0
user-yo4oj1me4l,성폭력은 잘못된게 맞습니다 정말 찢어죽여도 풀리지않죠. 하지만.. 제가 우려되는건 감성정치입니다. 성폭력을 뿌리 뽑는것은 옳은일이지만 지금 우리 사회에도 나오는 무고에대한 성폭력도 엄청납니다. cctv가없는 곳에서 성폭력을 당했을시 무죄추정원칙이 아닌 일단 가두고 보는게 우리나라입니다. 한강사건에 친구또한 그렇습니다. 다들 친구가 범인이라고 외칠때 분명 저는 이상해서 댓글을 남겼었죠. 무죄추정원칙을 너무 빗나가고 기울어지게 유튜버에게 너무 의존하며 경찰만 나무라는 사람들에 대해서.. 성폭력은 없어져야할 사회문제지만 무죄추정원칙에 대해서 바탕에 깔고 성폭을을 대했으면 합니다. 확실한 증거없이는 어느누구도 감성적으로 일을 판단하지 말았으면하네요.,0
user-hm4zk9jy9k,됐구요~ 누구를 비호하레고... 그게 군 검찰의 본 모습인가보네.,0
marsdriver,합참이하 전원 주간 군교대 야간 입찰시켜야 정신차릴려나,0
YSD1301,이모중사는 전태일 같아 굳이 안죽어도 되는데 성격이 갈치 같아서 죽어버린거 같아,1
user-gv8wd9dt7w,"밀타 1초 전 공군 해체하라, 그리고 여기 간부 배출한 공사도 폐교 진지하게 고려해야 한다. 그리고 다시 재건해야 한다. 썩어도 이리 썩을 수가 있는가? 보나마나 진급에 지장있으니까, 저리 똘똘 뭉쳐 진실을 가리기 급급한 것이다. 전부 가을 배추 밑둥 자르듯 칼로 쳐내고, 새로 심어야 한다. 지휘라인 모두 연금박탈하라.",0
user-ux6xt5wt5h,상급기관 지휘관들을 여자로 교체해라 군검찰 경찰도 다여자로 교체 해라 남자들이 여자및에서 다 기게 어쩌나 보자,2
user-pg4dv8er3f,공군참모총장 사단장 다 옷벗어야 되는거아니냐? 안부끄럽냐? 니들이 사람이냐?,0
user-vz4rn1vl5t,변호사도 또 다른 가해자네,0
7942s,거세시켜라!!!!,0
debug_rjk212,국선변호인도 공범인가요... 에효...,0
jjuwawang,범죄자가 살기좋은나라,0
user-iv4vq1tb8o,왜그냐 진짜,0
user-mb9xo3mk7e,국선변호인 인간도 같은 한통속이네!,0
bencook0724,윗물이 맑아야 아랫물이 맑다,0
user-xx5hq4lb4t,우리 헬조선은 전쟁과 훈련이 아니라 군내에서 정치를 잘해야 승급을 하니 저모냥이지 ㅉㅉㅉ 군법 처리후 꼭 형사법 처리까지해서 두번 처벌 받아야합니다. 군법으로만 처벌 받는건 군법상 어긋납니다. 그래서 휴가나가서 사고치면 형사랑 말하지 말고 무조건 헌병요구 하는이유가 형사처벌 피하려하는건데 이사건은 무조건 두배로 보직해임 군징역살고 나와서 또 징역살기를,0
stj0308,저 국선변호사라는 놈은 쳐놀면서 월급만 받아가는거야?,0
user-sk9nc2op6v,병사의 적은 간부 간부의 적도 간부,0
user-xh1pg4di9i,싹 다잡아 쳐넣어,1
metal28,대체로 공무원사회가 다 부폐했다.,0
user-lu5iv8tj2q,국변 감옥 보내라,0
user-zm3wt8uh9b,와 그냥 싹다 털렸으면 마지막 친정집 이ㅈㄹ 나오니까,0
user-zc5dl2zh3q,변호사가 저러이 나라가 나라것나? 망할민국맞내~~~~,0
kyungheekim5340,국선변호인 이름 왜 보호합니까? 이름을 알려주세요.,0
user-yw9pd4yc7o,근데 자살하려면 혼인신고 전에 해야지 남편은 한순간에 사별남 됐네 ㅋㅋ루 삥뽕,0
user-hi7yl9gi9h,"언제나 국방은 보수가 잘 한다면서 60년가까이 넘게 썩은 거지. 개혁할 건 많고 변화하는데만 몇십년이 걸릴것이다. 그런데,사람들은 단번에 바뀌지 않으면 실망하고...",0
user-xb6mu5rb7v,남편도 군인이면..총있잖아..내가 군인이었음 자동소총으로 날려버렸다,0
ohbrother76,국선 변호사ㅅㅋ들 공짜로 해준다고 의뢰인들 개무시하네…지들도 급도 안되서 국선 하는것들이…,0
user-pg9ep1hb2e,쟤네를 갈아제끼면 좀 깔끔해지려나?,0
user-zm2cn4mp7o,만약 전쟁이나면 군대가 썩어서 참패할듯,0
Ungmin,조들호 같은 변호사 어디 없나,0
user-cj7hg3tf4j,이러다 잠잠해지면 은근히 묻히고 넘어가는것도 ㅈ같애,0
user-in7ew9dq5j,꼭 죽어야 이렇게 시끄러워져야되는 대한민국이 싫다,0
Nahonki,군대가 뭐 그렇지 ㅋㅋㅋㅋㅋ 지금에서야 군대 핸드폰 사용가능하니까 폭로도 되고 사람 죽어나가야 이슈화되고! 이번기회에 저 가해부사관 강력처벌해서 고쳐라,0
user-ru6kg2oj5g,아주 썩을대로 썩었구나 나라꼴 잔 돌아간다,0
user-sq8ni8pi2t,국선변호사 조만간 얼굴 공개하고 기자화견 당할 삘인데 ㅋㅋㅋㅋㅋ,0
hanbaekkang3999,국선변호사를 조지면 굴비처럼 다 불거다,1
user-bx1cl7sc2c,그러고도 변호사냐;;,0
peppykim6786,정신나간 변호사네 변호사 왜 하니,0
rogerkim3696,국선변호인도 공범!!!!,0
w9936,저런것도 변호사라고...,0
user-ns4gi3ge2f,변호사 자격박탈,0
user-ry3zc3zc7s,결국 죽음으로 몰아간건 국선변호사네,0
stingchoi8358,국선변호사 이름이나 좀 알자 좀 알려줄수없을까나?,0
user-rk4sh3fr1c,혼인신고하고 남겨진 남편은 무슨죄람?,0
user-wv6fx2nq6s,국선 일안하는구나...,0
user-cs1he9qu5u,국가가 책임져라... 국가를 지키는것이아니라 국민을 비통하게 하는 행위 이디 이번에 뿌리 뽑아야한다 다시한번 고인에 명복을 빕니다,0
user-dp6sj5ko8q,공수처 가자,0
user-zu6qp3fr3m,장관 부터 그밑으로 싹다 모가지 쳐,0
moroll1171,사건 은폐한 너네가 죽인거다 본인도 알겠지,0
1206kohjin,"내 직장에서 내 상사가 내 마누라를 성추행했다.... 근데 이걸 재판으로 가려한다... 남편이 침착한거냐? 병신인거냐? 아니면 이 나라의 문화가 좆같은거냐? 군대라 총도 있것다, 나라면 일단 성추행범 장애인부터 만들고 시작했을거인디...",0
user-cy3gc7mp6h,만진당에서배웟나 우리군이 왜이러냐,0
qodhxjql5998,군사 검찰.. 다 부패했네 지들끼리만 이익보고 살려고,0
user-ci6tq9fg5f,내가 남편이면 총기들고 난사했을거같다,0
user-sp9xr4wm8c,ㅠㅠ,0
ggopnik844,그래서 남모르게 죽어가는 남성들은 다음에 취재해주겠지?......,0
GoldenGeneration695,요즘은 변호사도 사짜들어가는 사기꾼입니다 조심들 ㅋㅋ,0
user-uf9ye7qx9j,박주민 저거 커메라 도니까 화내는척 감정 쫙 끌어올리네 뱃지좀 달더니 연기력이 물이 올랐어,0
user-wd6gr8bv5v,이 사건은 제대로 보도 하는건가??,0
user-bg3wq2ls3x,썩어빠진 군대 50년 전이나 현재나 변화지 않는 군대 누구를 지키자는거냐?,0
user-jl5xm4hs7d,국선변호사도 한패다.,0
peoplekorea2391,대통령부터가 이런 사건들에 관심이 없는데 제대로 수사가 되겄냐. 말만 여성인권. 박원순 오거돈 등등 사건처리한거봐봐. 윗대가리가 저런데 아랫것들이 함부로 내놓고 흔들고 다니지~,0
user-gs8ti9rk3u,저 국선변호인도 가해자네,0
m_s8252,국선변호사가 사람 죽였네,0
tybe846,그러게 강제집용도 아닌데 군대를 뭐한디 가서 남자들은 강제집용이라지만..,0
Oli_Planet,법무실장도 잘한 거 없다 나가라,0
RF50mm,탄원서 법원에 제출 안하고 한달동안 방치한 국선변호사 대놓고 옹호하는 공군 법무실장 작은 양심도 없구나. 국선이 누구편인지 확실히 팩트 체크해주네...애휴..,0
user-ch8my2wj8v,혼인신고 왜 함?,0
tinggle688,남편은 뭐했냐??,0
tvwanitv1347,짜고치는 고스톱인듯... 누가 누굴 변호한다고 ㅋ,0
red-vj6pl,그밥에 그나물이라는말이 딱 맞네,0
user-gu3fy9ek5s,고인좀 그만 울궈먹어라 육수나오겠다,0
user-fq8vr3jp4d,국선도 성과제 도입하자 일정 성과 달성 부족시 자진 사퇴나 박탈,0
user-zw2we3mt1w,뭐야 국선변호사가 죽인거네 ㅡㅡ,0
user-nf7ud6hx9k,아직멀었다 대한민국,0
user-lg3vm5fm5q,싯바 군대에서 가족이나 친구 도움 안된다는말이 구라가 아니였어 이제부턴 방송국에 전화 꼬라박을거임,0
sungsulee8801,저게 국선이다.... 세금을먹는...,0
user-lh7wt8tw4b,이정도면 상부에서 국선까지 매수한거 아니야?,1
jyk1944,다 옷벗어라 씨 세금아깝다,0
user-jd6vn7xe2w,다른나라 이거저거 어쩌고 저쩌고하더니 누굴 할소리는 아니네 자기앞가림이나잘하셔,0
user-cf1ho3cq7d,2:20 됐고요!!!! ㅡㅡㅡㅡㅡ속에서 나오는 짜증감이다,0
ssuni7675,국선변호인은 필요가 없는거네!! 그러면서 무늬만 국선변호사네!!,0
deapomu895,변호사 자격증 취소해!,0
naldoko461,이사건 첨 나올때 약혼자라고 하지 않았나요,0
user-pz8wm4fo9x,화가 치미네요. ㅆㅂㄱㄷ,0
