작성자,내용,추천수
user-zs1ye1ih1g,남편도 내용을 다 알면서도 군인이라는 신분으로 적극적으로 대응하기가 현실적으로 어려웠을 상황이 마음이 아프다. 부부가 됨으로서 가장인데도 가족을 지키기 위해 어찌 할 수 없는 상황..얼마나 끔찍한 상황이냐? 악마 같은 놈들 살아도 사는게 아닐만큼 평생 고통 속에서 살도록 만들어줘야한다.,230
earth9716,"옛날이 좋은게 아니고 그냥 다 묵인하고 넘어갔던거지, 터질게 터지고 있는 것일 뿐 서로 노력해서 앞으로 더 살기 좋은 대한민국 만듭시다",2.4천
Ju_Hee_Lee,"다시는 이런일이 발생하지 않도록 가해자들, 방관한 사람들 전부다 벌 받고 반성을 했으면 좋겠습니다...",157
user-ns1ec3oz8j,직접적인 가해자 뿐만 아니라 모른 척하고 암묵적으로 동조했던 주변 군 관계자들에게도 불이익을 주어야합니다,596
dorrr3940,저 국선변호인은 변호사 자격이 없는 범죄방관자이자 직무유기자입니다. 자격을 박탈하고 강력하게 처벌해야 합니다.,1.4천
jaguarsee2043,남편까지 있는 분을 그렇게 괴롭혔다니 믿을 수가 없네,16
user-ul1ok3cp1i,저따위 변호사한테 일을 맡기면서 그동안 얼마나 불안했을까요...천벌받았으면좋겠네요,257
user-uq4db4gb2c,너무나 슬프고 안타깝고 허무하게 한 젊은 인생이 갔습니다. 이번을 계기로 똑같은 상황이 반복되지 않도록 강력한 법단의 조치가 필요합니다,1천
TV-lg9kd,까발리든 머하든 그 가해자 끝까지 쫓아가든 용기있게 같이 살아갑시다 국민들도 힘을 모아줄겁니다 저런 몹쓸 가해자때문에 누가 되었든 제발 소중한 목숨버리는 일은 앞으로 없기를 바랍니다,123
n.e.m.0,국선변호사 그게 대박이었지 아버지 : 좀 열심히 해야겠다는 생각 들지 않아요? 국선 : 하하하.네 아버지 : 웃어요? 자식잃은 아버지 앞에서 웃음이 나와요?,402
r.o.korean_army,이번사건 국선 변호사는 '공군 법무실' 소속 공군 법무관인 국선 변호사입니다. 이게 중요함. 결국 공군이랑 한패니까 저딴식으로 안움직인거지.,3.9천
user-xx6zh1gr7f,삼가고인의 명복을빕니다 오죽했으면 선택했을까요 시간이흘렀지만 하나씩 진실이 밣혀져 모조리 엄벌해야죠,0
user-bv5dj5gq9k,왜 꼭 사람이 죽어야만 문제가 부각되고 해결한다고 다들 난리야ㅜㅜ 신고했을때 이난리였으면 사람이 죽어나가지 않았자나 모든걸 뜯어고쳐야된다 이번에도 서로 봐주고 대강대강 넘어가면 또 힘없고 답답한 을이 갑에 의해 죽어나간다 ㅜㅜ,1.8천
user-fu9kf6ox2r,불안하고 기분더럽고 복장터지고 억울하고 무기력하고 억울한 시간들 보내다 자기목숨 거뒀을꺼 생각하니 진짜 눈물난다... 가해자가 한둘이 아니네..,3
user-fg5do6bu2x,이중사님 삼가 고인의 명복을 빕니다,1
user-mh9tm1ov6u,진짜 나쁜놈들이다..피해자 혼자서만 싸워야 했어다니 정말 힘들고 외롭고 괴로워 했겠구나.. 문제는 저런 장교들이 너무 많다는 것이다..자신의 힘을 가지고 남을 괴롭히는 인간들..,1
user-lc8zh4qw7b,맘아프네요 고인명복을 빕니다~,16
user-we7yk5jb5z,기가 막힙니다 누가 누구를 지키고 있는지 싹 쓸어야 합니다 불쌍한 사람이 저 세상에서라도 퍈안해지도록...,0
user-gz5ie1oz8d,그 국선변호사 면허 박탈해주세요,5천
kamiebeaumadier8488,맘이 너무 아프다. 얼마나 억울하고 또한 불안했을까..,2
JHeKIM,군에서 억울하게 돌아가신 모든 분들 애도합니다.... 제 자식은 절대로 군에 보내지 않겟습니다,2
pluto3775,고인의명복을 빕니다,0
yunhikim2289,참가슴이 아프네 사랑하는 사람을 등지고 극단적 선택을 할수밖에 없었던 심정이 오죽했을까,37
ssuneekim3990,얼마나 억울했을까요ㅠㅠ 이사건 끝까지 밝혀내야합니다,0
user-skysmile,살인을 일으킨 살인자의 수사를 다른 공범에게 맡기는 일이니. 대체 어디서 공평하겠나. 이래서 수사권과 기소권이 분리가 되야하는거다. 살인을 일으킨 살인자를 공정하게 심판하기 위해서.,659
user-me3pc4mz5m,이런 안타까운 사건이 일어났는데 국선변호사가 제대로 일을 하고 있지 않다니 정말 화가 나네요 하루빨리 유가족들과 남편분이 억울함을 푸셨으면 좋겠습니다 응원합니다!,1
user-eg6fd8vl2h,"이 사건에 연루된 지휘관, 군검찰, 가해자 모두 가능한 최대의 실형을 선고하고 불명예제대시키라. 그리고, 군인연금 박탈하면 향후 사건재발을 막을 수 있다. 처벌이 경미하니 애들이 겁도없이 이런 짓거리를 반복하지.",277
LLQlinedance,답답하다. 다 처벌받길 ㅠㅠ...얼마나 힘들었을까 ㅠㅠ,0
Many141,"이런일 생기면 변호사든, 군대 직무유기 상관들이든 신상공개부터 했음 좋겠습니다. 시간지나고 다시 아무렇지도 않게 돌아갈 비양심들 평생 낙인이라도 찍어 참회하게 만들어야 합니다.",0
user-dg4dj1ro3k,지금이 어느시대 인데 감히 여성이라고 개무시하냐 살인자다,93
user-eu9xr4nt5f,이 사건 기사만 보면 유독 더 답답하고 화나더라 죄없는 젊은이가 허무하게 가버린 게 너무 안타깝고 가슴아프고..,667
sunnyyun2707,철저한 수사로 이중사님의 죽음이 헛되지 않도록 억울함을 꼭 풀어주십시요.,0
user-fr2mw4yu5n,살아서 모든 치욕 다받을거예요 하늘나라서 지켜보세요 삼가고인의 명복을빕니다,0
user-he3yc2el6p,삼가고인의명복을빕니다,0
kcocostar,국선변호사도 직무유기와 근무태만으로 꼭 처벌받아야 한다.,1
user-vl1cs6ue2k,"에휴 카톡 보니... 가까운 사람이라도 감정을 막 쏟아내고 그러는 타입이 아녔구나 어쩐지 가슴이 아프네... 저런 분들은 속으로 감정을 쌓아두는 타입들이 많아서 차분하고 조용해 보일 때 잘 관찰하셔야 합니다. 사람이 겉이 강해보인다고 씩씩하다고 덜 아프지 않아요, 마음에 가해지는 상처는 모두에게 평등합니다. 가해자가 꼭 제대로 된 처벌을 받았으면 좋겠네요.. 에휴",1
hyn121,이런 인간들을 믿고 나라를 지켰는데 결국은 허무하게 가셨네요ㅡ 울화통이 터질것 같아요ㅡ 고인의 명복을 빕니다,333
nerfrtan5378,죽음으로 문제를 해결하려는 일이 재발되지 않았으면 합니다 누가 무슨 잘못을 했는지 확실히 밝혀졌으면 하네요,12
user-kv6qd9ip6w,청춘이 아까워서 눈물이 다 나네 너무 고생했어요 편히 쉬세요,1
ThehiTV,너무 안타까워요 사건해결되고 가해자 처벌받는걸 봐야하는데,0
Power_Vlog,다시는 변호사직 못하게 해주세요... 사람도 아닌 사람이 변호한다는거 자체가 안될 말입니다.,0
Heroinsivan,피해자 가족분들 심정이 어떨지 감히 상상도 못하겠다…에휴 이게 나라냐,0
digbynam2923,어머니 우는 소리들리니까 마음이 찢어진다.... 하...... 가해자 인생 진짜 찢어버리고싶다,10
alsrud617,"끝부분에 박주민 국회의원님ㅜㅜ 목소리 높여 따져주시는모습 순간 제 마음이 거기있는줄 ,, 너무 화가 나네요. 무책임한 국선변호사 반드시 무거운 처벌 받았으면 좋겠어요",9
user-qq8dn1zq4g,이런 뉴스 가슴 아파 보기 싫었다. 허나 모두 지켜봐야만 한다. 저같은 일이 누군가에게 되풀이되지 않아야 하므로. 고인의 명복을 빕니다.,11
user-rg1yi6lp2s,진짜 .. 마음이 너무 아프다 하 .. 관두지 그냥 ㅜㅜ 하 .. 우리나라 조직사회 다 똑같 나도 지금 조직안에서 살아남으려고 발버둥치는데 상사란사람은 구속에 사생활 침해에 .. 아무리 주변에 호소해도 참아라 ....,0
navermusicyou,돌아가신 분께 더이상 치욕스러운 일이 벌어지지 않기를 바랍니다. 국민들이 눈 부릅뜨고 지켜봅시다,0
user-iu9xc4rf6h,성 관련 법을 강화해 주세요. 진짜 심각한 문제라고 생각합니다,1
user-ru4vo4dd7o,말 잘했다 누굴 자꾸 비호하려고 변호해주고 그러냐 국선 변호인도 살인자다 제대로 임했으면 피해자가 저런 선택을 했을리가 없지,408
pompokopurin,제발 제발 고인 억울한 마음 풀고가게 해주세요........ 너무 마음이 아파요...,0
yareyare114,아휴 얼마나 분하고 억울했을까.. 너무 가엽네요,2
user-qt2gp6re6r,제발쫌 강력하게 처벌하자 진짜 부탁한다,0
user-qj3tj3es1o,앞으로 군관련 사건도 일반 사법기관에서 하도록 바꿀수 있으면 좋겠습니다.,0
user-rx4se8yk2e,우리나라 군대 참 쓰레기다 싹다 갈아엎어야 할판이네 피해자 추모해줄 생각은 안하고 집단따돌림 이나 하고 싹다 감빵에 처넣어라 불쌍하게 애꿎은 피해자더 안생기게,32
user-kg4cf5oz2o,변호사 자격 박탈 해야한다!,1.1천
user-lv8kq4lv7n,죄는 지은대로 가고 공은 딲음데로 간다는 속담이 있다 모든 죄는 자기 가정에 되돌아 온다는 걸 알아야 한다 모든 선행의 댓가도 내 가정에 평화와 안정을 가져다 줄 것이다 자기가 맡은 일에 불충실 할 때에도 엄청난 댓가를 받게 될 것이라는 걸 특히 공직자들 가정의 가장들 직장의 상사들이 또한 모두가 알았으면 아네요 수고 하셨습니다,1
yoori3340,국선 변호인! 너의 딸이 똑같은 범죄를 당해도 그렇게 처리 할건가요? 당신의 가족이 그런 호소를 해고 그렇게 무시할 건가요? 양심도 없는 인간들... ㅠㅠ. 예쁘고 아까운 이중사님... 유가족께 심심한 위로를 전합니다,0
roisadhks4071,어떻게 몇십년전이나 지금이나 군대내 성폭행.성추행사건의 피해자들만 억울하게 당하고 가해자는 떵떵거리는지 하..악성댓글 법정소송강력대응,182
DreamHomeUSA,믿었던 공군도 결국은 바닥의 치부를 보여주네요. 관련된 피의자들 징계 후에 나중에는 연금받으면서 편하게 잘 살겠지요. 모든 혜택들 박탈하고 벌받으면서 살게 해주어야 하네요!!!,112
user-ic7ws8gi7h,"다 똑같은 사람들이라고 써있네요.. 가해자들, 따돌림한 무리들, 국선변호사 이놈들 다 처벌 받아야 합니다",0
mjkim8370,"뭐라고? 결혼해서 남편까지 있는 사람을? 이세상에 용서라는 단어가 존재하지 않았으면 하는 마음이다. 저지른놈,방치한놈 다 불구덩이로 던져버리고 싶다.다만 그부모들을 생가하면 너무 마음이 아프다.피해자 부모도,가해자 부모도 고통의 무게는 별다르지 않을게다",38
insookhong390,끝까지 버티고 싸우지 얼마나 힘들었음 그런 선택을 제대로 된 인격 갖춘 사람은 없는지,0
user-dw3rd9em2b,스스로의 선택에 부디 고인께서 더이상 슬퍼하지 않기를..,0
sohee1325,중점이 흐려지는 느낌.. 국선변호사도 제2의 가해자지만 진짜 범인은 따로 있다고요...,164
user-lq9rj3wy8w,얼마나 괴로웠을까 피해자입장에서 철저히 관계된분들 처벌해주세요.,0
user-zz3yv4ii7k,사람이 어떻게 저러냐... 소름끼치게 악랄하고 비열하고 망측해서 같은 사람같지가 않네요 꼭 파면하고 죗값 치뤘으면 좋겠습니다 이번에도 그냥 넘어가면 안됩니다 국민을 개바보로 아는것도 정도가 있어요,0
user-qd3xm6th7i,저렇게 자식잃고 아내잃은 사람들의 심정을 어떻게 이해하겠냐만은.. 사람이 죽어나가도 살길만을 도모하는 저들이 목숨걸고 대한민국을 지킨다고? 진짜? 전쟁나면 민간인들 강간하고 그러겠지... 진짜 창피하다. 창피해.,192
user-wo5bj2jf7d,"얼마나 답답하고 억울하고 절망적이였을까,,ㅠㅠ",0
dannylee1245,"밖이나 군이나..왜 이리 사람 같은 사람이 없을까요.. 이참에 다 개혁해 주시고...국선 변호사도 짤라 주시고.. 무책임한 변호사에 대한 책임을 물어 주시고, 지시한 놈들도 ..짤라 버려서 법의 심판을 받게 하고 살게 해야 합니다..",0
kyungjayi7213,성범죄자는 거세가 답이라고 본다. 시범케이스로 해봐라.,188
sendusmile,"군대내 부패범죄비리의 온상 ' 회식을 법적으로 금지시켜야한다 근무가 끝나면 곧바로 귀가, 귀대하여 휴식을 충분히 취해야 다음날 근무를 제대로할수있기때문이다 피해자에게 국가가 충분한 보상을 해주어야한다 삼가 고인의 명복을 빕니다",10
user-ti9ew7yb1w,진짜 너무 안타깝다...,0
user-kh9hy1xx9m,학교폭력이건 성폭력이건 이놈의 나라는 범죄자들은 잘먹고 잘살고 인권도 보호받고 피해자들이 왜 극단적인 선택을 해야만 되는건지~~생각할수록 마음아프고 안타까운 일이네요 남은 가족들은 얼마나 힘이들런지~~~국선변호사는 변호사 자격 박탈해야 된다고 보네요,10
lmh5284,"100만번 잘못했다 말하고, 스트레스로 인해, 자괴감으로 인해, 실신을 해도 모자를 사람들이 그 모든 이유를 설명하려는 모습을 보니까 이 나라는 가망이 없구나.",0
user-rs1jr6uj7o,목숨을 버리면서 맞서야했던 고인의 선택이 너무 애잔합니다,0
gyujonglee3376,답답하다 일은 이미 벌어지고 피해자는 이미 삶을 포기했다. 일이 커지니까 이제서야 언론에서 떠들고 슬픈 일이 생기기 전에 그걸 막아 줄 수는 없는 거냐 정말 안쓰럽다. 무섭다. 변하지 않는 그들의 생각이,0
jeonghwanchoi6339,공군 법무부부터 관련된자 해임을 시켜야한다. 우리 모두 힘을 모아서 공군 법무부 관련자들 해임 되도록 힘을 모아야하지 않을까요?,103
user-ms3dv3ew9q,변호도 제대로 못 받았다니 정말 안타깝습니다. 약자들 보호를 위한 보장이 계급사회인 군에는 없는듯 보이네요! 제도개선이 이루어져야 합니다.,1
---on7xw,국선변호사는 평생 변호사질 못하게 자격 박탈하고~처벌해야 한다~~!! 저런게 변호사라고..,414
carinechung7180,이런 안타까운 일이 없게 수사 정당하게 해주세요. 여군 뽑았으면 여기에 합당한 교육과 시스템이 되어 있어야죠. 이런 일이 80년대도 아니고 2021년에 말이 됩니까?!!,0
kantonie6465,변호사만 잘 선택했다면 이런 일은 ㅠㅠㅠㅠ 아쉽다.. 왜 약한 피해자만 이래야는지,0
ghkfkdwkd2417,힘들어도 죽음선택은 결국 지는거나 다름없는데 분해도 좀 참고 끝까지 살아서 싸웠어야지란 생각드는데... 부모님 우시는것봐요.ㅜ,0
user-ef4xz8pv1e,왜 피해자가 떠낫나요 가해자가죽어야하는데 너무마음이아픕니다 남은가족들마음이어떨지....,0
rilyrose,국선변호사까지 다 한패거리였구나… 진짜 쓰레기들 다 짤려야하는데 현실은 또 그렇게 안하겠지? 진짜 고인만 불쌍하다 남편분하고…,601
skp9241,억울한 일이 있어도 관계자들의 소극적대응으로 억울함을 호소하지 못하고 포기하는 경우도 많죠.,0
kickofftheworld,이런 사건을 사선으로 해주는 단체도 있어야할 것 같다ㅜ,0
korean-american,가정파괴범들 너무 맘이 아픕니다 ㅜㅜ,0
user-md7vp5ec1n,철저히 조사해서 나쁜놈들은 모조리 처벌하라,0
Ktax,제일 큰 문제는 피해자가 여러군데 도움을 요청했지만 자정작용이 1도 안됐다는거지 사전예방은 못해도 사후조치는 신속하게 해야될거 아니야 얼마나 심리적으로 힘들었을까,0
jennieryu2976,공군만이 문제가 아닐겁니다 육해공쪽에 이런일이 허다할겁니다 위선에 눈치보고 불이익 받을까봐 가슴앓이 하는 분이 얼마나 많을까요? 제대로 도와주세요!!!,240
axess1227,공군 법무실장까지 전부 줄줄이 처벌해야 한다,13
user-xz7xr3jy5t,우린 이모중사를 추모하기전에 생전에 그녀가 어떤사람이였는지 짐꾼을 수레에 끌고 언덕을 오르는 할머니를 보고 선택에 따를 어떤 인성을 가졌는지에 대해 알아봐야한다,0
user-ci4xc3mz7r,국선변호인 잘못대처했다는게 밝혀진다면 반드시 처벌해야함,0
kan7984,"성추행,성폭행은 가해자들은,별거 아닌걸로 치부하는게 참으로 슬프다.역지사지를 생각 할 수도 없는 노릇! 왜? 자기는 여자가 돼 보지 않았으니~ 예전에 어떤 사건이 생각난다.백일된 아가와 함께 자다가 괴한에게 성폭행 당한 엄마이야기!! 엄마는 죽을만큼 반항 하고 싶었지만,애기가 잘 못 될까봐 피눈물 흘리면서 반항조차 못했더니,가해자 가 잡혀 법정에서 그랬다지? 여자와 합의했고 좋아 하더라고,,,,그리고 더 괴씸한건,,남편이란 작자~~그저 행위 자체만 꽂혀서는 아내가 고통받았을 맘은 생각안하고, 결국 이혼까지 한 일화ㅜ.ㅜ 일단 여성으로 살아 간다는건, 약자 이기에 그저 감수해야 하는것이 너무나 많다...젊은 남성들은 성불평등을 외치고 있고, 폐미니 뭐니 하면서 공격 하고 역차별을 당하네 하지만, 여성권한지수만 봐도 부끄러울정도로 다른나라에 비해 낮다는걸 볼 수 있다. 이 단편적인 것만 봐도 사회적 인식 이나 성인지 감수성이 얼마나 아직도 먼 것인가를 볼 수 있다.군대 라는 특수한조직 에서 마저 저런 말도 안되는 일이 벌어지고 있으니,,기가 막힐 노릇이다.여자 상사를 상사로 보겠는가,,그저 성쪽으로 바라보는 이시대 모든 남성들에게 물어보자!!",1
user-unass2,제발 가해자들을 공개해주세요. 피해다니게. 피해자들만 공개하면 뭐하나요. 인권때문에 가해자들 공개안하는데 피해자들은 인권이없나요? 피해자들의 가족들은 어떻게 살아가죠? 제발 모든 가해자들 공개좀ㅜㅠㅠㅠㅠㅠ,0
3im948,"대한민국 국민으로써 내나라을 지키기위해 국방의 의무을 다 해야하지만 이런일이 벌어지면 장차 우리 아이들을 군에 보내야하나 걱정이됩니다,",238
raonphill,어쩜 저렇게 사람을 고립시킬수 있던건지,0
user-jc2is1us6q,열심히 하시는 분들도 있을듯 이런 쓰레기국선변호사만 있다면 마음이 너무 아플거 같아요,0
congmingjin5922,담당 국선변호사가 유족과의 통화에서 하하하고 헛웃음 짓던거 너무 화가나고 소름끼침 억울하게 자식 앞세운 아비앞에서 웃음이 나와??,43
user-co6tn8em8k,"전시상황이면, 어쩔수 없이 군검찰이 필요하겠지만, 이런상황이라면 평시에는 군 검찰이 필요 없음을 세삼 느낀다...",1
user-um7iq1kf1l,예전 부터 저런 사건 많았는데 그냥 묻쳐 버린거지 지금은 시대가 바뀌어서 세상 사람들이 알게 되고 이슈 라도 된것이고...그리고 변호사 의사 잘못으로 피해 봐서 재판 하게 되면 변호사 상대로 하는 재판이라 변호사 찾기도 힘들고 의사 상대로 하는 재판엔 증인으로 나서 주는 의사 찾기도 힘들다고 하더라...,1
user-kh9mf3ew5o,안쓰럽다... 윗대가리들 다 물갈이 됐으면...,467
user-cb3pq7lh1c,국선변호사건 그 변호사랑 엮여 있는 검찰이건 판사건 대대장이건 간부건 잘못이 있으면 명명백백 밝혀야합니다,0
user-eg5vx2yh2r,변호인은 자신의 의뢰인에게 불리하게 하면 안되는것이 법으로 정해져 있는데 변호사법 위반으로 변호사면허증 날라갈수도 있습니다 피해자분 고소하세요.,1
kwangsoonp,공포는 마주서야 작아지는데.... 등을 보이면 커지고 ... 들을수록 안타깝네요. 범죄자 공범 자발적 부역자들에게 합당한 조치가 있기를 바랍니다.,0
user-uw1eh8hr2l,다 한통속이구만 ‥ 진짜 억울함을 어떻게 풀 수 있을까 한참 행복을 꿈꿀 나이에‥ 가족들 남편도‥ 누가 위로가 될 수 있을까ㅜㅜ,0
user-jc7iz7yj9l,꼭 이렇게 아까운 생명이 떠나고 해야 관심을 갖고 이슈가 되는건지... 근데 남아있는 놈들은 아직도 정신을 못차린듯!! 가해자도 그렇고 무성의한 국선 변호사도 그렇고 주변 고참들 지휘관 모두다 혼나야겠다!! 정신차리자 쫌!!!!!,0
kimsu468,"국선변호사, 상담사 둘다 처벌해라 그들도 살인자다",775
Bigwing_J,"사건 관련자 전부 처벌해주세요. 상관들 2차가해부터 해서 국선 업무태만, 조롱까지...",1
raybrown5890,또 한번 먼저 고인의 명복을 빕니다. 박주민의원님...믿습니다. 부탁합니다.,0
user-wy1yq5lx9u,안타까운 죽음이다 결국 피해자가 죽어야 해결되는구나... 너무슬픈현실이다,0
HEARK_GO,군 조직의 처신은 마치 피해자가 지쳐서 있었던 일이 유야무야 처리하지 않고 해결되길 은연 중 바랬던 것으로 보여... 쓰레기통 조직의 모습을 적날하게 보여준다.,0
gogiburger,인간이... 국산변호사가 직업윤리고 나발이고 집어치우고서라도 최소한 인간으로서 피해자한테 어떻게 저럴 수가 있는지...,0
g.m.j8717,군에서만 일어나는 일이아니라 우리 사회 전반에 뿌리내린 모습입니다. 피해자가 말뿐인 피해자인 사회입니다. 노인을 위한 나라는 없다?! 아니 '약자를 위한 나라는 없다'입니다. 약자를 보호하는 게 아니라 약자를 도려내고 싶어하는 사회가 아닌가요?,33
user-pr2bp5km8o,국선 변호사와 관련자 모두 강력 처벌하여 다시는 군대 내 성폭력 일어나지 않도록 하자,0
user-lx5yq1pr4s,"관련자들 말로가 과연 비참해질지, 다음 정권이 어떻게 이 사건을 이어갈지, 여러분 절대 포기하지 말고 끝까지 감시합시다",0
user-tk9yu3jg9b,진짜 욕 이럴때 쓰라고 만든듯 ㅠㅠㅠㅠ비통합니다 하루하루 얼마나 힘들었을까요,0
user-jh8ei8tw5k,군부대 만큼은 깨끝하고 순결했으면 좋겠다.ㅠㅠㅠ,0
aka8598,모두 파면 해임처리해라. 서로 쉬쉬.국선변이란놈은 눈치만보나.제발 모두 갈아치워야한다. 저런식으로 회유하고 얼마나 많은피해자가있을까. 가슴아픔 젊은 인재가 또억울하게 더러운 손목을자르던 사형에처해라 . 삼가 고인에 명복을빕니다.,0
user-dr1uv9mu5p,남편될 약혼자도 군인인데 같은동료군인이 성추행한것은 군대의 모든기강이 무너진거다 앞으로 어떻게 나라를 지키겠는가? 동료 여군도 보호하고 지키지 못하면서ㅡㅡㅡㅡ,61
user-mn5ek3du9w,죽은이가 억울할것이오 그 곁을 지켜주지 못한 이도 안타까움이로다,0
user-ki9im2vt6w,남편이 큰 힘이 되었네.그당시 남편도 아니고 남친이었는데.,0
cocoranliz1339,국선변호사까지 제 역할을 못해서 절망적이었겠지만 자살하기전에 여성인권보호단체에 제보하고 기자 불러서 공군의 이런 사태를 폭로했다면 이 사건이 전 국민들이 안 이상 그냥 묻히지 않고 피해자인 이중사를 보호해 주고 가해자인 장중사가 처벌을 받을수 있도록 할수 있었을텐데 안타까워요.,6
user-zt4ou8dd3s,변호사라는 직업에 대한 소신검증없이 그저 암기잘하는 순서로 전문직이 결정되고 그러한 인간들이 타인의 인생을 대변하는 직위를 가지니 이런일들이 일어나는거지. 그들은 그저 군 복무대체로 국선을 할뿐 직업강령이나 윤리의식 따위는 1도 없다. 그저 대충때우다 로펌이나 들어가던지 개인사무실 차려 대충 일하며 수임료를 벌 생각뿐.,0
user-eg5bg3jk5c,짜증난다. 가해자 ㅆㄹㄱ들 천벌받아라 ㅡ ㅡ 삼가고인의 명복을 빕니다....,0
user-yb2tk3oe2n,국선변호사 구속수사 해야 합니다,440
user-zv3vv3jn8j,편견을 갖지말고~ 내용을 정확히 파악하는것이 무엇보다 중요하다고 생각합니다,0
user-wr6og1du2y,진짜 죽이고싶네 가해자.. 부모님 슬픔을 감히 헤아릴수가 없다,0
user-vu9js1fb9n,이 사건은 국방부가 아니라 감사원에서 맡아야 합니다. 친정집 운운하는데 제대로 되겠습니까? 아마도 은폐하는데 문제점 찾아서 보완할 듯.,0
user-hy2je5ic5v,나쁜 인간 저런 사람이 무슨 변호사를 한다고 화난다 진짜,0
SJ-xw2gm,피해자를 제대로 대변하지않는 변호사가 자격유지되고 누군지 공개도안되면 다른데 취업하거나 개인변호사가 되면 또누군가는 자기도모르게 피해자가 될 가능성이 높지않나?,346
chrislee6694,국선 변호사 잘잘못 따져서 꼭 응분의 책임 지게 해라,0
miala3012,엠비씨 후속 보도들 최고,0
user-go5he9hl6n,성폭행으로 죽음까지 몰고간 가해자에게는 평생 성행위를 할 수 없도록 하는 법이 필요합니다.대체 누구를 위한 인권이 필요하단겁니까? 가해자를 위한 인권입니까? 그러니 계속 이런일이 반복되는겁니다. 가해자는 그동안 이번 말고도 수없이 저질렀을겁니다. 피해자들이 쉬쉬했을거구. 쓰레기는 쓰레기통에 버려야합니다.몇년 지나면 또 할겁니다 그놈은.,0
