작성자,내용,추천수
user-cb8qp7hn6u,같은 부대라는건 조사가 더욱 필요하다는 말입니다.. 제발 자세하게 조사되었으면 좋겠습니다..,6.5천
staringbeyond9649,고인의 명복을 빕니다... 한국사회 곳곳이 병들어 있음을 다시 보여주는 가슴아픈 사례라고 생각합니다. 다시는 이런 비극이 일어나지 않길바랍니다...,3.8천
plmnko098,21살 너무 어린 나이인데 안타깝습니다 고인의 명복을 빕니다 반드시 죽음의 원인을 밝혀주세요!!!!,2.3천
likeme9588,왜 회사에서도 그렇고 군에서도 그렇고 도대체 일하면서 같이 일하는 여자 동료를 보고 무슨 생각들을 하는거지? 어떻게든 뭐 해보려는 생각들 뿐인가? ㅈㄴ 역겹다. 꼭 저지른사람 인생 성폭력 범으로 평생 괴로움에 찌들어 살기를. 삼가 고인의 명복을 빕니다.,1.8천
user-zw3fw3zm3o,참대단한 부대인듯 여러모로... 고인의 명복을 빕니다..,2천
ShinJjang,21살? 나랑 동갑이라고? 이렇게 어린 나이에 젊은 나이에 죽는다니... 얼마나 괴로웠으면 그런 선택을 했나 싶고.. 너무 안타깝다... 삼가 고인의 명복을 빕니다. 이젠 행복만 가득하길 바래요.,432
user-jb1uy2kr3x,대체 얼마나 더 많은 사람이 죽어나가야 저사람들을 벌할 수 있을까요...안타깝네요,3천
heedae111,같은 부대라... 제대로 수사해서 고인들의 억울함을 풀어 드립시다..,2.3천
mkg7513,피해자의 명복을 빕니다. 가해자가 반드시 밝혀지고 처벌을 크게 받았으면 좋겠습니다.,386
user-wg6up3jl1e,삼가 고인의 명복을 빕니다 같은 부대에서 2명이나 숨진채 발견되었다는 건 문제가 있다고 봅니다.. 사건조사가 어떤 외압도 없이 명명백백하게 밝혀지길 바랍니다 후속 기사도 추후 꼭 내주세요,546
tobitaru4579,"같은 부대안에서 또 피해자가 나왔다는건 심각성을 인지하고 신중하게 수사 진행해주시길 바라고 시간이 걸리는 한이 있어도 진실이 밝혀져 한을 풀어줬으면 좋겠습니다, 고인의 명복을 빕니다",168
annjung8416,고인의 명복을 빕니다.. 어떤 말로도 유가족을 위로할 수 없겠지만 힘내세요,88
alexpark8557,고인의 명복을 빕니다.. 정말로 안타까운 일이 재발하다니 이것은 고쳐져야 한다고 생각합니다. 제발 자세하게 조사되어 근본적인 문제가 해결되어야 한다고 생각합니다. 유가족분들에게 미안한 마음을 전달하고 싶습니다.,395
borissal8100,21살 동갑이라니 더 마음 아프고 안타깝네요.. 더 이상의 피해자들이 생기지 않도록 철저하고 명백한 수사가 이루어지길 간절히 바랍니다,288
free7459,고인의 명복을 빕니다. 또 같은부대라니 정말 할말이. 철저하게 수사해서 다시는 저런 슬픈일이 발생하지 않길 바랍니다.,164
user-pw9fv4xg3s,삼가 고인의 명복을 빕니다 군부대 내에서의 가슴아픈 사건이 자꾸만 발생해서 막막한 마음이 드네요. 이런 비극이 반복되지 않도록 철저히 조사해야한다고 생각합니다.,90
pauluciasam,이 정도면 그 부대에서 기존의 범죄를 덮고 옹호하는 분위기가 형성되어 있을 가능성 매우 높다고 합리적 의심을 할 수 밖에 없겠죠. 이미 이전에 비슷한 사건이 터진 상황이었는데도 반복된다는 것은 전혀 변한 것이 없다는 말... 곧 해당 부대의 최고 책임자 급이 이전 사건에도 불구하고 아무런 개선 조치를 취하지 않았다는 것을 의심할 수 밖에...,2.6천
user-gt2gl9do8o,"이악물고 부사교 수료과정 거치고 수료했을텐데 얼마나 참담한 일이고 ,,, 안타깝네요 꼭 벌할수 있기를 .. 고인의명복을 빕니다…",372
user-qn6yo3pk5t,"사건 조사 안해도 뻔하다 ,, 진짜 남의 귀한 딸을 아버지 어머니가 얼마나 슬퍼하실까",942
user-ki8rc5uk3j,21살... 얼마나 힘들었으면... 삼가 고인의 명복을 빕니다,204
bigstar1319,삼가 고인의 명복을 빕니다 군대 정말 부조리가 많은 곳이죠. 같은 부대에서 2명이나 숨진채 발견되었다는 것은 정말로 문제가 많이 있다고 봅니다. 가해자(들)이 밝혀지고 강한 징계 그리고 처벌을 받게 정확하고 빠른 조사 부탁드립니다. 제 나이보다 어린데 정말 안타깝습니다.,65
user-gg8kw1od4u,21살이면 02년생 어린 사람입니다…. 제발 이런 일이 안 일어나게 해주세요,31
user-vv8bw2sx5n,삼가 고인의 명복을 빕니다,579
user-xk4qx4ir8z,고인의 명복을 빕니다.,0
user-br4mv5kr8y,아직 우리 군은 여군을 받아들일 준비가 안되었나봐요... 씁쓸합니다... 딸같은 아이를... 삼가 고인의 명복을 빕니다,285
user-dx3do5gn4v,너무 마음이 아픕니다.. 고인은 생전 어쩌구저쩌구만 하지말고.. 가해자들은 어떻게 살아왔고 어떻게 살고 있다 이런 기사 좀 써주세요ㅠㅠ 어떻게 살아왔으면 가해자들은 그러고도 발 뻗고 잠만 잘 자는지,156
howims1165,부대 윗 사람들이 제대로 된 군대 기강을 잡아야지.. 군대는 남녀로 구분 짓지 말고 사람으로 봐야지.. 안타까운일이 또 발생 했네..ㅠㅠ 삼가 고인의 명복을 빕니다.,723
316att,고인의 명복을 빕니다,0
user-vp8dr2cf6u,고인의 이름으로 사건을 명시하지말고 가해자의 이름과 사진으로 사건을 명시했으면 좋겠습니다,195
bichbyeol,진짜 가슴 아프고도 너무 슬프다 은폐 축소 골몰하는 군 발표에 유서조차 없었단 건 못 믿겠다 이 중사 사건 때 진작 뿌리 뽑았어야 했다 저 분도 진짜 살고 싶었다 바람에 흔들리며 꽃피우며 반짝이며 그렇게 살고 싶었다,177
user-zq4wt2ot3z,헐... 진짜 저도 여군이 꿈이였는데 진짜 이런 뉴스 소식 들을때마다 너무 마음이 아파요...진짜...,53
user-gw2yt1dr8r,진짜 답답하다... 저 유가족분들은 얼마나 더 마음이 아플까.. 삼가고인의 명복을 빕니다.,16
user-bq4ti2cq3y,너무나도 안타깝네요. 삼가고인의 명복을 빕니다. 부대관리 실패로 보여지는데 책임자와 이에 관계된 사람들에 대한 수사를 통해서 엄중하게 책임을 물어야 된다고 봅니다.,1
hyunjaelee0967,ㅠ.ㅠ 삼가 고인의 명복을 빕니다,1
rot19,우리나라 사람들은 참 착해.. 나쁜짓을하는놈을 죽이진않고 자신이죽다니.. 특검이고뭐고 내딸이면 범인들을 어떻게할지 모르겠다..,203
yucn5201,뉴스에도 나오지 못하고 잊혀진 7월에 돌아가신 3명의 병사와 2명의 부사관 그리고 2명의 장교의 명복을 빕니다,29
user-se6sb2su8i,상급자들 싸그리 옷 다 벗게하고 철저하고 투명한 조사가 되야할듯 합니다 그러지 않는다면 이런일은 세대가 바뀐 후에도 사라지지 않을거 같네요,128
koss4772,아직도 사건명에 피해자의 이름이 들어가는게 안타깝습니다. 피해자의 신상 보호가 되는 세상이 오면 좋겠네요.,34
NM-lr3pr,그 부대가 얼마나 썩은건지 이번에 전부 도려내서 부디 우리 군인분들이 조금더 나은 환경에 있을수있기를,14
user-bz1uq3bg8z,고인의 명복을 빕니다...,7
user-cv9ev2je8e,제발 가해간부들 옷기벗고 처벌 제대로 해주세요 고인의 명복을 빕니다,0
hyunjaelee0967,삼가 고인의 명복을 빕니다,1
freemam6971,책임자들 모두 강례처벌 해야 한다,146
serimpig,생각만 해도 끔찍하다.. 이제 막 꿈을 펼칠 나이인데. 고등학교 졸업한지 얼마나 됐다고..왜 자꾸 이런 안타까운 일들이 들려오는 걸까요? 처벌을 강화해서 이런 일들을 조금이라도 예방할 수 있었으면 좋겠습니다. 이미 충분한 희생이 있었어요.,16
MrAsdfwwwww,쉬쉬하고 은폐만 하려하니 뭐가 되것어~ 도대체 몇명이죽어나가야되나.. 안타깝다.. 가해자 꼭 엄벌을 받게끔해서 다시는 이런일없도록 강력처벌되길..,66
user-md7dz4xb5h,진짜 군대 나오길 잘 했음. 진짜 맘고생 부조리 힘듦 고인의 명복을 빕니다.,12
papertiger9557,나라를 지키는일을 아무나할수없지만 지키는사람들을 지켜야하는건 우리가 해야할일이다. 국방력은 전시에만 발휘되는것이 아니라 항상 그존재만으로도 제역할을 하고도 남을것... 무고한 젊은이들이 죽어나가지않게 어떻게 힘이될수있을지 고민해봐야한다.,0
Gyoonji,삼가고인의명복을빕니다,0
user-ic7vk4lk6l,군인이기 이전에 여성으로써의 인권보장도 필요한 법,18
user-jy1vr4bu1h,사람이죽어나갔는대 달라진게 없다니 참 어이가없다 수사 제대로해서 강력처벌부탁드려요 부디 억울한 피해자 안나오길 ㅠ,32
user-ls5gu1dh9z,삼가 고인의 명복을 빕니다.,53
swyang007,부검을 통해 사망원인을 밝혀내야 정확한 사건 경위를 알 수 있을 것 같습니다. 약물로 인한 수면제 다량 복용인지~아니면 외부에 어떤 가해흔적이나 침입흔적이 있었는지 철저히 조사를 통해 진실을 밝혀내야할 것 압니다.,70
user-rh9yx6px6j,"참... 여러가지 의미로 대단한 부대다 진짜... 얼마나 2차 가해와 외압, 가스라이팅이 만연하면 창창한 젊은이들이 스스로 목숨을 끊을까...",77
user-ls7ii7js9i,삼가고인의 명복을 빕니다,0
user-so6sp6my8e,우선 고인에 명복 빕니다. 또 같은부대에서 안타까운 참사가 일어났는데 굉장히 심각하네요. 고질적 폐쇠성과상하관계가 낳은참사 바뀌지 않는 한 이 병폐는 사라지지 않을거고 이로인해 피해자는 속출 할 겁니다. 근본적 대책마련 시급한데 변화는 더디기만 하니 참으로 가슴아픕니다. 어무튼 발본색원 하여 경각심을 바로 세우고 견제장치를 재정비해 만약사건사고를 예방해야 합니다.,17
2window314,"여동생이 여군이라 오빠된 입장으로 저런 일이 발생한다면 어떻게 해야할 지 참,, 처벌은 당연히 받아야겠지만 처벌을 받는다한들 한 가정을 인생에서 가장 슬프고 완전히 망하게 하는 행동인데… 가슴 아픈 현실에 참.. 고인의 명복을 빕니다..",12
ota-wang,여군을 상대로한 군간부들의 성범죄는 위안부 문제를 겪은 우리나라에서 벌어지기엔 수치스러운 범죄입니다. 더구나 명예를 중시하는 군에서 범죄를 은폐하려는 시도는 있어서는 안 되겠습니다.,94
montrio3d829,군 전역한지 8년쯤됐고 지금 생각해보면.. 몇 안되는 여군들 중에 항상 표정이 안좋아보였던 사람들이 있었던거 같은데 그 때도 이런 일이 은연중에 있었지 않을까 싶으면서 진짜 썩어빠졌었구나하고 또 깨닫게된다 ㄷㄷ,71
Rica-ks1ns,너무나 슬픕니다. 스스로 삶을 포기할 정도로 괴로웠다니... 저라고 더 나은 선택을 할 수 있었을까요... 썩은 군대에서... 다만 조금 더 힘을 냈더라면 총들고 가서 그놈들 싹 죽이고 나도 죽었을 듯요. 억울하게 왜 혼자 죽어요 ㅠㅠ,1
user-xs2mz8vi5s,정말 대체 이게 무슨 일인가요.. 어떻게 된 건지 빨리 밝혀야 됩니다!! 어린 나이에 참.. 너무 안타깝고 마음이 아프네요.. 다시는 이런 일이 없어야 될텐데요..삼가 고인의 명복을 빕니다..,0
RichRichSuperRich,21살.. 하.. 부모 마음 찢어지겠다 ㅠㅠ,3
hwanhikang6367,왜 사람이 죽어야만 움직이냐 진짜 가해자보다 피해자만 더 피해받는 세상 지긋지긋하다 진짜 난 내 가족이나 친구한테 이런일 생겼으면 지구 끝까지 쫓아가서 어떻게든 할거다 진짜 처벌 제대로 내려라 저런 사람들 무기징역? 필요없어 사형 때리세요 제발 ..,34
user-ri9vz9xf8v,"아무리 군 이지만 어지간히 좀 해라 여군이라고 성폭행, 추행하고 상관에게 시정처벌 보고 하면 조치도 취하지 않고 괜히 소문나면 여자인 니가 손해볼테니 그냥 넘어가라, 나중에 진급에 지장 많다 이런식으로 넘어가니 너도 나도 할것없이 성추행 폭행을 하지 제발 어지간히들 좀 해라 하는것 보니 너무 구역질 난다",9
user-sj6yg2xf2d,이게어찌된일이야....... 삼가 고인의 명복을 빕니다. 꼭 진실을 밝혀주세요,4
seomin0845,"공군20전투비행단, 왜 이 부대에서 반복적으로 이런 문제가 발생하는 겁니까? 20비 해당부서 관계자님들! 양심선언하셔서 고인에게 예의를 갖추십시오! 함구에 동참하시면 딸같은 고인에게 평생 죄를 짓는 일입니다. 가해자는 즉시 사과하고 벌을 받으십시오.",255
user-rq7wl5tr1l,너무 어린데 친구가 죽었다….안타까워서 어떡하냐…….너무 수고했다 이유가 뭐든. 편히 쉬고 다음생에는 좋은 일 기쁜일만 가득하게 태어나….,0
rlawldbsdl,진짜 말도 안되는 일이다.. 21살의 나이에 ㅠㅠㅠ,4
user-tu8ev5ob9q,명확하게 조사되어 밝혀지길 바랍니다,0
z31575,성폭력 가해자는 반드시 처벌 되어야 합니다 물론 재발 방지도 필요하죠 근데 이런 사건의 해결이 자살 밖에 답이 없다는 여군의 인식의 전환도 필요하다 봅니다. 사건의 진상의 규명을 위해서라도 남겨진 유가족들을 위해서라도,24
user-uc9xs7ll3c,제발 그곳에서만큼은 행복하시길...,5
sonyah9480,진짜 저런 불미스러운 일 계속 만들어서 진짜 전쟁나는 순간에 배신과 암살이 판칠꺼라고 밖에 안 보이네요. 관련 가해자들에게 과도한 처벌이 가기를 정말 원하는 군요.,1
user-iv3xw5wq6m,삼가 고인의 명복을 빕니다. 보잘 것 없는 나라도 지켜주셔서 감사합니다. 죄송합니다.,0
peachealry4298,왜맨날피해자가죽어야돼 가해자는 엄벌안받으니까 당한사람만 지속적으로 시달리고 아무것도 변하는게없으니까 무기력하니까 지쳐서 피해자가 눈감고마는거아니야 가해자 엄벌에처하게 법좀바뀌어라 ㅅㅣ발진짜욕나온다,474
user-te5yn9fv6s,같은 부대에서 사건사고가 끊이질 않는다면 이건 철저히 조사해야합니다!!,5
user-vu4nq5pn2z,제발 제발 진실을 밝힐 수 있게 정확한 조사가 필요합니다.....,6
Happy-ye5jp,제발 조사 철저히 해주시고 또 이런일이 안생기게 처벌내려주세요 또 한명의 피해자가 나왔잖아요,0
hongzuo1997,징계주는 것으로 끝내는 것이 아니라 관련있는 사람들 다 쳐내서 이런 일 다시는 없게 부탁드립니다,18
user-et2sd7bw8c,고인의명복을빕니다,0
jaeheon9367,대체 저 부대 안에서는 무슨 일이 벌어진 건가요... 삼가 고인의 명복을 빕니다.,10
gun1305,여기서 아무리 댓글 적어도 변하지 않는 슬픈현실 안타깝다 정말,18
Jay-ih9vm,같은 부대 안에서 또 같은 사건이라니요.. 이번에는 어떤 판결이 나올까 걱정됩니다...,0
user-en4gh9bd4u,죽어없어져야 끝날거 같으니까 자살하는거다.. 얼마나 사람같지 않은 짓거리로 사람을 괴롭혀야 21살짜리가 죽어야되겠다는 생각을 하게 될까.. 죄책감이란것도 없겠지 저 짐승만도 못한것들,3
mmvery7781,와.. 저 부대에서 도대체 무슨일이 일어나고있는거야..,0
user-zt7uc4le1s,아이고....21살이라니 너무 어리다ㅠㅠ제대로 조사해서 다시는 이런 일이 더는 생기지 않았으면 좋겠네요,1
user-ve7ig6hu4x,한번이 아닌 두번은 문제가 없다는건 말이 안된다,12
user-gq4lg5ox3b,그곳에선 행복하세요,0
user-xt3hx6dk9w,삼가 고인의 명복을 빕니다..,0
goattohell,죽음에 대해선 진상 규명이 되어야 하겠지만 이게 무기가 되어 엄한 사람들이 피해 입는 경우가 생기지 않길 바랍니다,7
user-qb1rm2bo6p,삼가고인의 명복을 빕니다. 이러한 일이 또 벌어졌네요.,0
ysin77,삼가 고인의 명복을 빕니다 아 진짜 안타깝네요 자꾸 사고가 나는부대면 철저하게 조사하고 부대를 없애야된다고 생각함,11
user-fv3km1eq4h,가장 격렬한 비판과 가장 강력한 감시가 있어야 최소한의 합리성을 보여주는 곳,9
hsk4215,군 사법권은 평시엔 회수 되야 함 전시도 제한적으로 사용되야하고 현행 군 사법권은 악법 레벨도 넘어섬,28
user-iw6mq8vy6j,형량을 제대로 내리지 않아서 유족들이 법원앞에서 항의하고 그러셨는데 또 같은일을 자식이 죽고나면 부모가 평생 안고 살아야 되는데 진짜 이런 뉴스볼때마다 말문이 막히네요,0
user-es8oc3yt3y,샅샅이 파헤쳐서 .. 고인의 억울함부분을 꼭 밝혀주세요,1
Lee-ul3jq,삼가고인의 명복을 빕니다. 어차피 검.판사는 수사 안할꺼니 기대는말아야되겠죠? 돌아가신분만 불쌍하고 속상해야겠죠? 또 한숨이 나옵니다.,0
user-nw1vq9tm9b,힘들게 열심히 노력해서 들어갔을텐데 안타깝습니다.. 고인의 명복을 빕니다,3
art-pv3ie,고인의 명복을 빕니다. 그리고 제20전투비행단을 한번 뒤집어 놓고 다시 창설하였으면 좋겠네요.,0
nondit028,저 부대는 분명히 조직적인 음험한 무언가가 있는게 분명하다. 그것도 치밀하고 뿌리깊은. 저 부대 소속 장교와 부사관들 전체를 들어내라. 아니면 썪은 사과가 된다. 파일럿 포함 싹 다 들어내지 않으면 뿌리는 더 깊어진다.,7
user-rn6fj7vb4y,삼가 고인의 명복을 빕미다 정말 안타까워요ㅠ ㅠ 어떻게 이럴수 있을까요? 또 이 같은 비극이 일어나는게 말이 되나요? 수사 중이라면서 정말 나라가 왜 이러는 걸까요....... 어린아이들 청소년들에게 부끄럽지도 않은가요??,0
J_DDo,악행과 부패만 있을뿐 정의는 죽은지 오래 ...,2
user-kc6uy7mc7j,아진짜 안타깝고 개탄스럽다 어린나이에 얼마나 힘들었을까,0
stj0308,저 안에서는 도대체 무슨 일이 벌어지고 있길래 계속 여군들이 계속 죽어 나가냐??,435
bluegold8322,감추어진 문제가 굉장히 많았고 사실상의 수사는 부분적이고 형식적이였다!,4
yeriop4103,민간 조사위원회에 담당자들이 들어가야 합니다.,24
0_0zzzz,또 한 명의 청춘이 사라지다니요.. 너무 안타깝습니다.. 이렇게 사람이 죽어나가도 변하지 않을 정도면 얼마나 고이고 썩은걸까요 어떤 범죄에서도 재발하지 않도록 하려면 관계자 책임지게하는 수밖에 없습니다 그무엇도 생명에 대응할 순 없지만 본보기가 될 수 있게 관계자 강력하게 처벌하여 책임을 물어야합니다 .. 제발요!,3
BLA1NE,저들이 익숙해질까봐 겁나네요. '피해자를 연달아 죽여버려도 빠져나갈수 있구나' 라는 반복 학습.,10
user-md2ko7iq4t,진짜 개썩어버린 쓰레기 집단에 솜방망이 처벌.. 범죄자들이 본성을 숨기고 살아갈 이유가 없는 나라가 되어가고 있다.. 힘든 시기에 극단적인 시도를 하는 사람들이 많은데 제일 아까운 사형수들 평생 먹여살리는 혈세부터 살려라,38
skyblue721,안타깝네 .. 피해자만 죽고 가해자들은 변함없이 그자리에 있고,75
msbrad,또 같은 일인지 단정할순 없지만 그런 경우라면 정말 이 참에 다 까뒤집고 재발 방지를 위한 단호하고 획기적인 조치를 취해야 할 것이다,0
User-bonjour2000,임기가 겹친 2개월동안 같은 여자들끼리 느낀 감정이 .. 뭔갈 봤단 말인것같다. ..,18
user-ql4mh8kx6l,왜 대체 성범죄는 안 없어지냐 그냥 옷도 벗게하고 거세하자 어린 나이에 저런 선택할 정도면...... 하,4
stealthboyjoseph1048,해병문학과 비문학이 성행하니 공군도 질 수 없다고 더욱 분발을 하며 오도짜세잡힌 군기에 더욱 박차를 가하는 건가? 여윽시 해병대에 지지 않는 공군!,11
user-kc8en4fm9x,21살이라 ㅈ같은 상황을 대처하는 능력이 부족했겠네요.. 에효 ㅠ 일찍 취업할정도로 기특한친구인거같은데 안타깝네요,5
YangYANG-vx9st,문제가 있구먼... 범죄자 들은 체포 안되고.. 수사 한다고 흐지부지 시간만 끌고 있으니.. 피해자는 증가하고...,569
soleepdo,여기 얼마전에 훈련때문에 갔던부대인데 소름이다..,1
yuha5158,이 중사 사건을 꼬리 자르기가 아니라 철저히 조사했다면 이런 참사를 막을 수 있었을 것이다.,0
nose1294,아이고.. 21살이면 이제 막 시작할 나인데.. 꼭 가해자 밝혀졌으면 좋겠네요,2
user-zk8sv1my1x,같은 전우를 전우로 보지 못하고 가지고 놀수있는 후배로 보는 문화가 먼저 바뀌어야 합니다..,0
user-kg5xt2hm4i,가해자 엄히 처벌해야합니다,0
user-mx7ew1xd9w,이런 씨.... 도대체 왜 이러냐 이 나라는??????? 왜 바뀌는 게 없어. 여자가 매일 죽어나는데 바뀌는 게 없어,14
user-wu7jj4zl6n,세상은 바뀌는게 1도 없네요~^^,4
SIHYUENGJO,참 대단하다. 또 어떤 사연이 있을지 비행단장은 어떤 새끼인지 진짜 궁금하다,15
user-hp5yj2yf1y,21살..너무 어린나이다 성인된지 2년도 채 안돼서 저런 선택을 하기까지 얼마나 힘들었을까,6
user-oi7gc1oe2m,"살아도 죽어도 억울하고 분통함은 피해자의 몫이고, 인간이기를 포기한 가해자는 되도않은 쓰레기 인생을 죄책감없이 당당하게 살것이다. 법과 정의가 갑이 아닌, 권력만이 갑! 되도않은 인간들이 이끌어 가는 대한민국이 안 망하는 것보면 신기할 따름이다!!!",1
user-of9gh8oq8s,너무 안타깝네요.. 좋은곳으로 가시길 바랍니다,0
user-sx8kh7jt3t,아니..국방부장관머하노? 똑같은 부대에서..또...여군이 죽었다? 와...진짜 심각하네,160
sulee1821,후속 보도 계속 부탁드려요.,4
user-hp2mp5ck8d,내가 전역한 부대에서 이런 비극이...,0
user-bw1hi3wn6y,같은 부대에 또 피해자가 발생했다는게 진짜 믿기지 않는다,0
jhkim6126,부대 없에고 관련자들 전원 징역보내고 피해자분 보상확실히 하고 마무리 하세요~넵!!필승!!~사이다~~,4
user-zp8bl1ib2t,숨죽이고 있는 범죄자와 방조범들은 자신이 행한 죄를 본인이 그대로 당했으면 좋겠어요 물리적 화학적 방법으로 추가범죄도 예방하고요,0
kimyongnam6947,안타깝네요... 진실을 밝혀주세요,18
hbee3293,왜 적군에 의한 사상자보다 아군에 의한 사상자가 압도적으로 많이 나오게 하는거냐..,0
user-oe7sg6xl1j,특수부대 공군CCT는 UDT/SEAL 위탁훈련도 받는데 . 물론 특전사 도 UDT/SEAL 위탁훈련 받고 . 중사 쯤 되면 위탁훈련 및 각종 부대 자체 특수훈련 이수 휘장도 많이 달게 되지 . 이처럼 바쁘고 훈련 많으면 잡생각 없는데 . 타군 일반 부대 내 무슨 사건 사고 터지면 뭔가 군기가 빠져서 그럴수도 있다 훈련도 널널하고 . 물론 아닐수도 있지만 그럴 가능성도 있는거,0
user-zq5fs6or7b,계속되는 악순환.. 언제쯤 끝이날까요.. 삼가 고인의 명복을 빕니다..,1
-_goodboy,같은부대에서 또... 소오름..,24
user-kf9dj6gm7s,맙소사 끔찍하네요 해결되지 않고 있는 고질적인 문제가 있는게 확실하다고 봅니다 이건,0
jdch1203,이래서 감옥이라는게 있고 사형제도가 있는거다! 가해자를 처벌하지 않으면 내가 당할수 있고 내 자식이 당할수 있다! 으..끔찍하다!,5
gai6612,미쳤다 미쳤어.....,0
clion3573,이정도면 개선의지가 없는거 아니냐?K-군대 자랑스럽다!!!!!,0
user-rk1jf8wr5d,가해자들도 똑같이 영원히 고통 받았으면 좋겠음,0
rcv__keix9117,20비는 사람도 많아 관리를 하고 있다는건 보여주기식의 얘기 같네요..,0
user-uu7dt5hm7r,삼가고인의 명복을빕니다 참나라가. 어떻케 대려고~~!!!!,0
user-eo3yj7cz5d,성폭행범은 목숨은 살려두고 토막을내는 벌을내려야 된다봄요,169
slclo6911,범인을 안잡고 매번 풀어주고 봐주니 계속 범행을 반복함,3
user-jo6xz6kt5u,이쯤되면 대단한부대다,0
user-ne6yb7ux9g,왜~ 자꾸 이런일이 일어나는지 조사를 제대로 해주시길 바랍니다. 덮으려고만 하지말고 억울한일 없게 투명한 조사요~ 삼가 고인의 명복을 빕니다.,0
user-ly8xb8ju6n,같은 부대에서 두번씩이나 나올정도면 저거 생각보다 저 부대에 심각한게 많은건데...?,1
anastasiaflo673,미쳤다 정말...21살 여성 하사.. 제대로 수사하고 엄벌하라,0
joan88young59,문제가 많은 사단을 엄청난 비리가 있음을 죽음으로 알려주네요 안타깝네요 꽃다운 나이에...,6
jabe8600,저 정도면 부대를 해산해야되는 거 아니야?,1
user-bz3tc3ob2e,와 아주 부대전체가 지옥이네,1
khr5478,제발 처벌 좀 강하게 해버리자ㅠㅠ,2
user-yd3wh7gs1w,레전드 부대다 아주 레전드야,2
user-zn2wd7qy9u,인기척이 없는 방을 들어가 우연히 발견한 척 하는게 말이 되냐? 군대라는 곳에서 간부 하나가 방에서 안나오는데 그걸 모를리가 있을까 과연 실제 그렇더라도 이미 여기서부터 잘못된거임 인간도 아닌 X들 제대로 조사해서 처벌 꼭 내려주시길 바랍니다,2
