작성자,내용,추천수
user-nn4ko2sc2x,판사 가족이 저렇게 당해봐야 하는데,0
user-cu4zw1sf6d,가해자는 전과 20범이다. 전과 20범 흉악범을 거리에 풀어놓은 판사를 당장 잡아서 구속시켜라. 판사를 전부 해고 시키고 AI를 빨리 도입해야 된다고 본다.,0
user-xr5qt9gi9r,경찰은 매번 말하지 경찰들이 알아서 다 해줍니다. 피해자가 따로 조사하고 그럴 일 없어요. 저희 관할이에요. 그치만 현실은 저렇게 피해자가 1년간 뛰지 않으면 12년 형으로 끝났다. 검사들이 해주지 않았으면 12년 형이 정말 끝이었다. 3권 분립이 점점 망가지고 있으며 그리고 구시대적인 법안이 원인이다. 제발 사람좀 살자,0
user-wm3iu4oz7m,이런 이슈가 되는 사건은 국민참여 판결해야됨 사형투표제 이런건 못 만드나,0
user-zu6gq1nn3s,한국의 법은 너무 물렁합니다. 폭행으로 5살수준의 사람이 되었는데도 초범에 술을 먹어 판단이 흐렸다는 이유로 징역 1년 그어떤 보상도 받을수 없었죠. 음주운전으로 사망에 이르게했는데도 징역3년 피해자는 평생 고통속에 살고 가해자는 1년~3년 살다나오면 끝인세상. 이번 사건도 20년형에서 살인마가 반성하고 있다고 판사의 재량으로 8년이나 깍아줬죠. 그래도 살인마새끼는 형이 높다고 징징대고요. 판사도 갈아치우고 법도 강하게 만들필요가 있을것같습니다. 피해자는 더이상 피해를 받지 않게 가해자는 평생 반성하며 살수있게 만들어야합니다.,0
fill2393,12년 뒤에 나오면 양아치범죄자가 또 보복하고 살인을 저지른다고 하니 피해자를 살리기 위해서라도 양아치 범죄자를 무기징역 판결!!!,0
user-jb7em5gb2t,판사님 현명한 판단 내리세요 진짜 가족이라 생각 하세요 화납니다,0
user-xf9dj7xv8r,앞으로 모든판결에 범죄자 신원보증을 판사가 서도록,0
user-pp7vu6mn3o,부산경찰서는 수살 어찌하는거냐?? 악마를보았다 신상 공개하고 악마를 영구 격리하자 하나님께서 필시 그렇게 하실거다 탄원서 썼고 다동참 합시다 강력한 여론만이 검경판사 정치인를 이깁니다 여러분,1
user-cy6pz9ng9c,저 범죄자는 가만보니 전과 18범에다 인생을 그냥 교도소에서 살았구만 무기징역 때려라 사형은 안될꺼고,0
zhaoyunzulong,"판사놈들, 사회에서 이슈되는 사건 맡으면 주목 받으니 영광이라고 생각할 것 같음??? 그냥 일년에 맡는 사건 개수 중 하나일 뿐.... 법조계도 돈으로 돌아가는 곳이라 가해자, 피해자 사회적 위치와 각각 변호 맡고 있는 변호인단들 수준을 보고 판단함.... 한마디로 더러운 곳이 법조계임.",0
user-fj7jl2du3m,영화에서나 보던 길거리여성 폭력갱이 실제로 일어나는걸 대한민국에서 보다니 ㅋㅋㅋ정말 어처구니가 없다 저걸 징역 12년 때려놓고 반성문으로 감형까지 해준 판사도 어처구니가 없고 ㅋㅋㅋㅋ 그저 힘내세요 얼굴도 모르는 네티즌들뿐이지만 응원하고 기도합니다,0
user-sq9tq9zn7s,안타깝지만 늘그랬듯이 판결은 심증은 가나 성폭행은 증거불충분이나 죄를 반성한다는 사유로 원심대로가거나 형량이 몇년 줄거같네요 판사는 법이정해준 형량을 과하게 초과해 판결할수없기 때문이죠,0
sanggukang7074,힘내시고 평범한 일상으로 다시 복귀하시길 무기징역 갑시다,0
twekim8334,이건 인재임. 초범도아니고 판사문제임진심.....,0
user-nb8sj3ns3s,응원합니다. 무기징역 입니다!!!,0
user-hu1st7oc5g,꼭 사회에 못나오게 해주세요 반성문썻다고 감형해주는 개같은짓거리 하지마시고,0
laphaelajung5582,12년후 죽는다는 생각을 한다니… 우리 모두가 느끼는 공포입니다. 사회 부적응자는 사회에 함께 살지 않는게 법기준 이어야 합니다. 가해자는 12년 20년이 아니라 종신형이어야 합니다. 전과 18범을 사회에 왜 두어야 하는지. 12년 후는 판결한 판사님이 데리고 사셔야 합니다. 사회 부적응 재범자들은 종신형. 무기징역 내려 20년 살다 모범수 뭐 이런걸로 몰래 사회에 배출 시키지 말고. 종신형 !! 사형이면 더 좋겠구만. 교도소 안에서 이미 어린 죄수들에게 돈 뺐고 산다며. 그 죄도 추가삿 아닌가???,0
user-jt4rg5hx9i,판사는.니여동생이당했다고새악해봐라.사형시켜라!,0
user-mp5hf5cq2c,100% 기절시키고 끌고가서 유사성행위라도 했다 무기징역때려라,0
vhon1vhon1,"최소 무기징역, 최대 사형.. 제발.'",0
user-fz5mu2ys7b,힘내요~ 가해자는 무기징역으로 사회에 악입니다.,0
samy1276,"한국에선 그냥 저렇게 돌려차기 해도 된다~ 어차피 처벌도 가볍고 언론에서도 얼굴, 이름 다 가려준다 ㅋ 전세계 범죄자들은 한국으로 오세요~ 단, 판사 딸은 건드리면 안된다.",0
user-kw4jw6dh1e,판사들 니딸이라면 저형량 때리겠냐?ㅠ,1
user-vt3he5he2f,"탄원서 제출했습니다. 저의 지인은,데이트 폭력남 감옥보냈는데, 출소 그 다음 날 보복 살해 당했습니다. 저 폭행범도 보복한다고 협박하고 있다고 기사 봤습니다. 실언이 아닌것 같은데... 무거운 형량이 필요합니다!!",0
user-on4gs9ez5r,사형이 안되면 가석방없는 무기징역 독방에 가둬라,0
user-zy8qe6cu7y,반성문 썼다고 왜 감형 한지 이해 안 간다 피해자 용서 안 했는데,0
user-eu3jt5dq6n,징역 20년 + 전자발찌 50년 착용... 어차피 우리나라 법이 20년 이상 안나옴..,0
user-sh3ww7tw5m,가해자 놈은 어릴때부터 상습범이더만 . 그냥 감옥에서 자위나하게해라 . 판사도 정 선처를 하고싶으면 야동이나 한달에 몇편 보라고 지시해놓던지.,1
user-nu3sq6ce3e,뻔뻔한 범죄자 거짓말 하고 있다.가해자 분명 성범죄 저지르려고 cctv없는곳으로 피해자를 끌고 간것.무기징역 가야 함.,0
leet0513,미국에서 이런사건 이면 최소한100년 가석방없는! 12년을 때리는 우리나라 판사님들~ 그전 전과도 어마무시한데 ....... 참! 우리나라는 판XX 들,0
elle_k9452,판사는 본인 자녀들이 피해자가 될 수 있다고 역지사지 생각도 하시고 다음 피해자 줄줄이 나올 수 있다는 생각도 하시고 판사뱃지 한번 더 쳐다보고 판단하신 것 맞으실까요???????,0
user-wu7ny1oh2o,반성문 1장 쓰니 8년 감형 반성문 2장 쓰면 16년 감형...이게 k판사다.,2
user-it6sq2yd8g,12년 후 나는 죽는다....와닫습니다. 판사 살인범들 양형 그래 범죄자들과 짝짝꿍~~~~ㅗㅗㅗㅗ,0
user-vu7jk2pg7e,가해자 인권 들어가기 시작하면 전부 감형..,0
mementomori..,12년...음... 무기징역으로 하지...절대 반성안할것 같아보이는데,0
gruHan-bk3dp,가해자 무기징역 감옥에서 나오면 내가 돌려차기한다,0
user-mt8yr6ls3b,내가 여자편 드는거 그닥 싫어하는데 그넘은 그냥 징역 30년 해라,0
cs7441,최소 징역 12년×18범= 216년,0
feridbathory7280,가해자 가석방 없는 무기징역 ㄱㄱ,0
user-qv4iw5cs4u,무기징역도. 관용배푸는거애요,0
user-jw3ri7gm8c,영상을 보는 순간 너무충격 적이다 힘없는 여자를 저렇게 무참하게 발로차고 밟고 저 인간 쓰레기 진심 청소해 버리고 싶다 무기징역 50년 살고 틀딱 70살 할배되서 나오면 보복 하지말고 나랑 1대1 입뽕함 까자 184.92kg 킥복싱.권투좀햇다 자신잇음 번호남기라,0
