작성자,내용,추천수
servant31,뒤에서 무방비 상태인 여자를 저래 했는데 12년 이라니..말이 안나옵니다..딸 키우는 아빠로서 가슴이 무너져 내립니다. 저런놈은 무기징역 가야 됩니다,1.3천
user-gl9rw7zk7f,저런 악마가 12년 뒤에 다시 우리 사회에 나온다....뭔가 섬뜩하지 않냐? 법이 제대로 작동하고 있는 것 맞냐? 판사 니들 딸이 저렇게 당했으면 어떻게 하겠니? 니들 딸이 당했으면 분명히 무기징역 때렸을거잖아!!! 암기만 잘하는 싸패들.....,202
sun-heepark9945,고작 12년이라니... 이 나라 법은 얼마나 더 악질이어야 제대로 형량을 받을 수 있는지... 제발 피해자가 조금이라도 더 회복되시길 빌어요.,3천
kingston6923,영상을 보니 경악 스럽고 분노가 치밀어 오르네!!! 내자식에게 그렇게 했다면 어떻게 하던 저승으로 보내고 말거야! 법이 약하게 판결이 적용 된다면 더 더욱 용서 할 수 없다!!!,120
user-ok6xd3gk8y,"저런 범행에, 저 정도의 손상에, 저 이유에... 저 정도의 처벌이 내려진 법체계는 한... 참 잘못된 것이다. 피해자 개인에게도 가혹할 정도의 처벌이고 대한민국 사회에 12년 후면 길들지 않은 맹수를 풀어 놓는 격이다. 판사가 제정신이 아닌지, 대한민국의 처벌한계가 잘못된 것인지... 우리의 또다른 암울한 미래이다. 가해자 인권을 위한 법은 사회를 좀먹는 소수를 위한 그들만의 논리이다.",5.1천
winniesam6092,너무 끔찍하고 소름이 끼쳐서 손이 덜덜 떨립니다~ 비슷한 또래의 딸이 있어서인지 가슴이 뛰고 정말 죽여버리고싶을 정도의 충동이 드네요. 제발 제발 제발 저 짐승새끼가 최고의 형량을 받기를. 영원히 불에타는 고통을 겪기를. 사지를 절단하고 끝나지않는 고통속에 살길.,17
reylee4394,진짜 이런 묻지마 범행들은 무조건 최소 무기징역 때려야 한다고 봅니다.. 판사들은 본인들이 저런 범행 당해도 12년 때릴건지? 피해자분이 꼭 상처에서 치유될 수 있기를 바랍니다.,321
user-mq1ib5lj5q,징역 30년 이상 해도 피해가족들은 울분을 참지 못합니다.. 제발.. 이런 쓰레기는 사회로부터 영원히 격리 시켜야 됩니다.,712
gorekim4462,"이런 뉴스 계속 반복적으로 다뤄주시는거 너무 좋습니다! 덧붙여서 피해여성 지퍼도 내려가져있던 것도 언급해주었으면 더더욱 좋았을 것 같습니다. 항소심에 추가 징역 받고, 최종심까지 알려주시고, 이후로 감옥에서 어떻게 혈세로 잘먹고 잘사는지 까지 알려주시면 더더욱 감사할 것 같습니다. 아예 그런 내용 전용 채널을 하나 만드셔도 구독하겠습니다. 채널명 권선징악으로",120
pradaramzi,"어머니가 있고, 누나가 있고, 여자친구가 있고 앞으로 미래엔 한 가정의 가장이 될 사람으로서 너무 분노하게 되며 재판부의 판결을 받아 들일 수 가 없습니다.. 분노라는 단어 말고는 욕 밖에 나오지가 않네요...",4
user-tz8nl9zt7r,사회로부터 꼭 격리되서 또다른 피해자가 나오질 않길 바랍니다 재판부에서 부디 현명한 판결을 내려주시길 부탁드립니다,0
user-iq1th5io7c,"무기징역 받아야 마땅, 사회와 영원히 격리시켜야",3
user-cw8ru2jl7g,가해자편인 대한변호사협회를 없애야 미국처럼 강력범죄자를 120년 징역형을 감빵에 쳐 넣을 수 있습니다.,5
yjjy-du8ls,진짜 판사를 AI로 대처 해야한다고 생각한다 사심 감정 다 빼고 오직 사건만 보고 판단할수있는 저딴 쓰레기를 항소 받아 준것만으로도 문제라 본다,21
user-oc4bn1gd4e,12년 나참 판사양반 당신딸이 저렇게 당해도 이런판결내릴건가요? 딸 키우는 아버지롯서 자괴감이드네요,11
abcdefg0772,저런 법절차와 형량 때매 피해자가 더 불쌍하고 안타까움. 얼마나 속이터지실까..,3
_whitecolor7072,징역 + 신상공개 가는게 사회질서를 위해 필요한거 같은데요 재판장님,320
mkchae2825,우리나라 판사들은 각성해야한다 법개정도 너무 필요하고! 고작12년이라니! 피해자입장에서 이해하고 처리할 수 있는 연수제도라도 있어야 하는거 아닌가,1
user-zv8re7fv5c,정말 화나고 어이없네요 판사님들 제발 저런 인간에게 무거운 징역으로 처벌하세요,252
johnjamesan7626,피해자분 기적같이 회복하길 바랍니다! 얼마나 억울하겠어요 가해자는 무기징역도 부족하다!,56
wearefriends21,저런 악질 범죄자에게 관용을 베풀려는 판사들이 있기에 더 큰 문제입니다.,44
user-wu2oo5vw5s,끔찍하다 판사들은 제발 저런 악마들을 사회에 풀어놓지좀 말아라,411
user-vy6em9it2z,저런 범죄자는 무기징역형을 내려야 한다고 봅니다,1
user-di8gl2wz3o,이정도면 법이 쓰레기인지 판사가 쓰레기인지 범죄자가 당당한 한국 범죄자 얼굴가려주는 인권의식 대단합니다,82
adele7642,이 나라의 법은 누구를 위한 법인지 묻고 싶은 판결입니다. 동물보다 못한 인간의 행동이 경악스럽습니다.,1
sugsugidd,제발 판사님들 이런사건은 주관적으로 해석해서 형을 많이 주세요,3
TheTeddygom,판사님 제발 선량한 시민들의 안전한 삶을 보호해주세요.,4
TheMeisterKang,싸움도 못하는 것들이 무방비한 상태의 사람한테 저런다. 저런 것들이 밖을 아무렇지도 않게 싸돌아 다닌다는거지 법을 좀 바꿔라 주먹만 휘둘러도 징역 살게끔 해라,2
user-xm7xh8sk8s,"피해자에게 정신적, 신체적 영구적 손상을 입히고 성폭행 형량꺼지 검색해본 저런걸 또다시 사회에 풀어놓겠다...? 겨우 12년? 들처없고 허겁지겁 숨어드는게 징그럽다. 저런건 인간사회에서 영원히 퇴출해야 한다.",100
user-cw8ru2jl7g,"1차 재판에서 쓰레기의 반성문 보고 정상 참작해서 8년 감형했었고,2023년 4월19일 재판에서 가해자편인 판사가 또 감형한다면 국민들 제발 들고 일어나야 합니다.",2
user-si8tt9kg3c,12년은 무슨 징역 20~30년은 때려야지. 저런 인간이 사회에 나와봐야 뭣에 쓰냐?. 아놔 진짜 법좀 엄하게 적용해라.,198
user-qb1wv4sg1p,"판사님, 제발 저 쓰레기는 사회와 영원히 격리 시켜주십시오. 절대 감형없이, 얼굴부터 공개해라. 그리고 법만드는 국회의원들 일안하냐? 니들이 우리 세금으로 월급 축내고, 왜 일반 시민들이 피해를 받아야하냐?",4
user-em2lo8qi3h,사회에 영구적으로 나오지 못하게 해야 합니다 저 쓰레기가 사회에 나오면 더강력한 범죄를 할수도 있읍니다 동영상을보면 너무참혹하고 헉소리가 나오네요 판사님 부탁드림니다 엄중한처벌 해주세요,1
bong737,한인간을 불구를 만들고 인생을 가져 갔는데.. 12년 판사들 장난하냐?당신들 딸래미 저렇게 당했어도 12년 때리고 용서 해줄래? 내일은 아니지만 분노가 치미르 오르는구나!,160
user-yn2er1po7j,보면볼수록 화가 치밀고 소름이 돋네요..딸 둘을키우는 아빠로써 늘 불안하네요..평생 감옥 독방에서 반성하며 살게했으면 좋겠는데 형량이 너무 약해요 ㅠ,343
user-ly8fd6ng3m,이런영상을봐도 역시 대한민국의 법은 피해자가 아닌 가해자에게 유리한 판결이많다. 법이 무서워서 범죄를 멀리하게해줘야지,6
yjrm7634,30년 징역은 살려야. 저건 사람이 아니다. 악마다.,794
iik6882,"진짜 충격적이네, 저 범죄와 판결 모두",2
user-zu5dh4ub8x,"징역 12년이 과하다? 딸키우는 부모입장에서 저런 쓰레기는 극형 만이 답이다. 영상만봐도 충격은 헤아릴 수 없는데, 피해자는 얼마나 고통 스러울까. 반드시 엄벌에 처해야 합니다.",98
djdrkek,제발 판사말고 AI가 대신해주길 바랄게요.,52
TheCreamapple,저런 잔혹한 범행보다 형량이 12년밖에 안된다는게 더 무섭다,11
msk1395,"이번엔 꼭 판사의 결과를 보겠다. 이 나라의 법이 말로만 지엄하지 않다는걸 보여줘야 한다. 음주취약, 심신미약, 정신미약등 어설픈 민주흉내는 그만하고 제대로된 법의 순기능을 보여주길 바랄 뿐이다.",5
leegun9556,피해자가 몸이 뻣뻣하게 굳어 기절해버렸네 저런 와 정말 화난다 검사 판사 니들 도대체 뭐하냐,0
user-ef6ih3yx1z,우리나라 법은 항상 가해자편이다 언제쯤 고쳐질까 우리나라 국회의원들은 이런거엔 관심이 아예 없다 판사가 아니라 법이 문제... 판사는 법대로 판결할 뿐 그 이상 할 수 있는게 없음,1
user-cw8ru2jl7g,대한변호사협회에서 성폭행 가해자는 고객입니다. 가해자편인 대한변호사협회에서 높은 점수를 받은 판사가 성폭행사건 재판을 맡고있는 현실을 바꾸어야 더이상 이런 어처구니 없는 판결을 막을 수 있을 겁니다.,2
user-if8uw1xu9k,법…. 판사가 문제다 겨우 12년 이라니….범죄인들은 할만 할듯…..,2
april-ii2ko,12년 뒤에도 범죄를 저지를게 보이는데 무기징역 나와야 하는거 아닌가요???? 사람이 어떻게 저럴수가.....진짜...,0
linjayhoneyred4061,"형기를 마치고 석방되는 죄수와 검사의 가장 어린 자녀, 판사의 가장 어린 자녀가 하루밤 같은 방에서 보내게 했으면 좋겠습니다. 법이 진정한 의미의 법으로 거듭나려면 이렇게 해야만 할 거 같습니다.",0
k76106,사회와 영원한 격리가 답이 맞다 판검사가 엄벌하길,4
myeongkyukim,헐 피해자분 어떡해 마비로 평생을 살아야할지도 모르는데 형량 더 높여줘요,12
bluestone9430,"저런 넘은 사형을 시켜도 모자란데, 겨우 12년이라니. 이러니 법은 우습고 검사와 판사가 검새와 판새가 되는거 아니겠어",0
user-cw8ru2jl7g,"법정에서 중립을 지켜야만 하는 판사가 가해자편만 들고있는 대한민국을 방치하지 말고, 외면하지도 말고,우리가 세상을 바꿉시다.",1
hyunchulkim8974,피해자를 생각해서 법이 제대로된 판결을 확정해주시길...,0
Kim-yq3oy,피해자가 고통속에 살고 있어도 용서가 취미인 판사나으리들이 하루빨리 사회에 나와서 또다른 피해자를 만들게 도와줄거임.,0
ganogano274,형량 늘리는 공동서명 링크같은거 없나요? 어쩜 더러워도 저렇게 더러운 인간이 있을까ㅜ 피해자분ㅜ... 어떻게든 위로가되드리고 싶고 마음이 회복되기를 진심으로 바라고 끝까지 기도드리겟습니다ㅜ,0
komodo142,어찌 우리나라판사들은 이렇게나 범죄자한테 친절할까? 참 대단들 하셔,1
user-kq7kh2fj4r,저도 재판에서 불법을 저지른 쪽에 손을 들어 주었습니다 명성이 높은 변호사를 추가로 선임해 억울힐 판결을 받았습니다 판사님들 정말 너무도 자격 없습니다 ㅠㅠ,0
user-om9op7yo2b,인자하신 판사님께서 모든걸용서 하실겁니다,0
user-cw8ru2jl7g,판사들의 승진시스템에 문제가 아주 심각하다고 봅니다. 가해자편을 들고있는 대한변호사협회한테 98점의 높은 점수를 받은 부장판사들은 성폭행사건때는 특히 피의자편을 많이 듭니다. 전국피해자협회로부터 높은 점수를 받은 판사가 되어야 억울한 피해자가 더이상 발생하지 않을 것 같습니다. 또 피해자협회로부터 높은 점수를 받기 위해서는 성폭행사건은 30년 징역형이 최소가 될 것입니다.,1
user-nc2lq3de3n,사회악이다..감방에서 안내보내는게 답이다..제발 무기징역 때려주시길,452
user-wb3rc9vk3k,판사 가족들이 당하는 일들이 많아져야 형량이 바뀔거다...이 나라 판결에는 이 말밖에는 할 말이 없다...,0
user-ri7tq9yv5j,한 사람의 평생을 망가뜨려놓고 저 형량인게 대단하다,0
user-bc9ip6yu4v,우리나라 법이 왜 이래요? 이게 말이되는 법 형량인가요?,2
happyvirus4077,판사 검사 딸이 저렇게 똑같이 당해도 징역12년 때릴지 의문이다~~~!!! 재판이 아니라 개판이네~~!! 인간의 존엄은 최소한의 도덕적 양심이 있을때만 존립목적이 있는것이지 저런 짐승같은 것들한태도 인간의 권리가 주어진다는게 변호를 해준다는게 누구를 위한 법인가???,0
jamiehuh301,12년 금방간다.. 아직 젊은놈이고 나와서 또 범죄 저지를건데 도대체 법이 왜이렇게 관대하냐? 헌법부터 싹 고치고 판사는 특히 ai로 우선 대체해야 한다..,202
user-pj8ic5jv2o,"이런 범죄 재판은 판사를 위한 판사에 의한 판사 형량 결정 대신, 국민청원을 통해 배심원단 구성하고 재판해서 사회정의가 무엇인지?를 똑똑히 세상에 알려야 한다. 결단코 사회 ""형평""의 의미가 판사에 의해 엿가락 잘라내듯이 결정되어서는 안된다.",0
user-lz5vv7oj5k,감옥에서 쇠파이브에 하루에 3000천번씩 돌려차기 시켜주세요. 판사님 ! 사회 나와서 다시는 돌려차기 못하게,4
user-rl1qr4wk1s,이런사건에서 사법부의 존재 이유를 모르겠으며 내 세금으로 월급 처받는 판사들을 도저히 이해할 수가 없다,0
user-gv9hd2fb2c,길거리 Cctv 보면.. 집요하게 이 여성을 노리고 쫓아왔다고 함.. 고의성 있음. 게다가 건물내 cctv 사각지대로 끌고가 성범죄 의혹 있다는데.. 꼭 밝혀서 형량을 더 때려야함.... 판사아저씨 이번엔 좀...... 에혀...,268
user-et2so4jl9b,판사에게 사과하면 형량 줄어드는 대단한 나라!!! 대단하다 대한민국!!!,0
user-yg5ij7vq9q,우리나라 판사님들은 강력범죄에 참으로 관대하십니다 사람이 아닌데 사람 취급을 하는,0
adggg4982,이건 무기징역으로 가야되다고본다!!판사님 현명한 판결 부탁드립니다!!,0
justiceontheway,아제뷰턴 판사들이 판결 제대로 못하면 판사와 가해자를 같은 감옥에 보내야한다,0
user-ww5dy2en3h,판사에게도 깍듯이 인사하는척 돌려차기로 형이 과하다 표현하면 진정한 시대의 영웅이 될듯..,1
betterthanyesterday2709,"처벌 못지않게 중요한게 손해배상이라고 생각합니다. 특히 뇌손상이라면 간병비, 치료비 등 많은 비용이 들 겁니다. 재판에 임하는 태도를 가지고 추측컨데 가해자가 제대로 된 보상을 할 것 같지도 않습니다. '징역'이란 형벌명에 걸맞게 가해자를 고속도로 등 국가기간시설 공사장에서 강제노동시키고, 그 임금을 피해자에게 주는 제도가 필요하다고 생각합니다.",1
user-vw4gu4br3l,사형 구형을 하고 집행을 하지 않는 것이 혹시라도 진범이 아닌 엉뚱한 사람이 잘못 잡혀와서 억울하게 죽는 것을 방지하기 위해서라면.. 이렇게 증거가 확실하고(영상에 조작이 없다면) 다분히 의도성이 있는 것이 확인되었는데 이런경우 사형이나 최소 무기징역이 아니라면 대체 법은 누구를 위해 있는가 생각해보게 되네요.,1
user-dx4fr2zl9w,저건사형시켜야된다! 이나라는법이없나! 판사들아처벌좀해라!판사왜하노?,0
sukskan,법이 있으나 마나한걸 무법천지라고 하죠. 대한민국은 무법천지 입니다. 퇴직후 전관이 되고 싶은 공무원 대신 AI가 판결해야 합니다.,22
dony4770,12년뒤엔 또 누군가 다치겠네요 판사님감사합니다 12년뒤엔 국민들이 알아서 몸사려라는 깊은뜻 잘 알겠습니다,0
user-zs1ed5cm7b,이런 사람들은 현실판 악마판사 만났으면 좋겠네요,0
user-cw8ru2jl7g,법관들은 삼권분립의 정신에 맞게 대한변호사협회의 높은 점수로 부장판사가 되는 시스템이 아니라. 전국피해자협회에 의해 높은 점수를 받은 판사가 부장판사가 되게 하라!,1
sarabab1100,가해자에게 월등히 유리한 법이 말이됩니까..... 제발 좀 피해자가 납득할수있는 판결이 내려지기를. 저런놈은 평생 사회 못나오게 해야합니다!!,112
user-ie1tk8no3w,역시 부싼 ~! 우리가 남이더나 사회에 시한폭탄 같은 애를 풀어놓고 아프다니까 구속 안하고 재판장 안내비쳐도 존중해주고 역시~ 좋습니다~!,0
user-lx4pr7qr1l,아주 그냥 무기징역을 때려버려야 됨 저게 사람이냐;;_,1
user-ko7th8ff4q,12년형을 때린 판사를 조사해서 처벌해야한다. 저런 놈은 법정 최고형으로 다스려야한다.,0
user-kr9fl3vq9q,"성폭행 백퍼했다. 그리고 무기징역이 맞다. 대충 징역살고 풀어준다면 사법부, 입법부 인간들 제발 똑같은 범죄당하길 빌고 또 빌겠다. 욕도 아까운 버러지...",1
inkyukang7639,사형 또는 무기징역이 아닐시 남은 일생의 주거를 판결한 판사의 집으로 한정하자,1
user-dy5yc5mi3m,강력범은 사형으로 다스려야 사회정의가 바로선다 12년이. 뮌말이고 판사들 밥값좀해라.,627
jsm8674,범죄자가 범죄를 저지르고 징역받으면 다가 아닌것 같습니다.. 지금 국민의 법감정과 추후 나라 운영을 위해서 경범죄를 제외한 그 이상 범죄들은 획기적으로 개선해서 사형을 선고하고 실질적으로 집행하여 범죄자들을 위하여 세금을 낭비하지 않는게 좋다고 생각합니다.. 저런 범죄자는 징역을 다 마치고 사회에 나와도 쓰레기입니다.,0
nanassikim5553,형량 낮게주는 판사들 세워놓고 돌려차기 한대씩 체험하게 해줘야한다,1
user-wj1ss8jd1w,저느마 항소심에서 형량좀 왕창 늘어나길 두손모아 기도 합니다.,0
user-rw3ir9nf6r,"피해자가 죽던말던, 항상 범죄자의 인권수호와 재산보호에 앞장서시는 판검사 및 짭새들!! 멋져",0
sdk815,도대체 우리나라에 무슨일이 벌어지고 있는건지 물어보고 싶다. 하루에도 수십번은 더 총기 소지가 허용되면 좋겠단 생각을 하게 된다. 악성으로 판단을 해서 분류가 되면 종신형을 최소 형량으로 선고해주길 바란다.,1
seuingminlee4596,남이봐도 끔찍해서 다시 못보겠는데 가족분들은 오죽할까요 정말 안타깝네요 남의인생 망쳐놓고 12년이라니 형량이 너무 작은거 같습니다,21
19532984,대단하신 판.검사 분들 가족이 당하면 12년이 아니라 30년은 넘게 나올탠대,0
shshin839,판사님빨리 풀어 주실거죠 훗날에 옛날 성인들에말씀에,0
user-gc2yr4it6m,항소심 판사님 제발 무기징역으로 형량 올려서 일벌백계 해주세요.,0
user-gn1xb6kj3r,법이 바뀔수없고 형이 감형되거나 집유가 되는이유는 권력자들과 가진자들이 법위에서 놀기위해서 바꿀수가없음,0
james-gc5kr,판사님의 현명한 선택 부탁드립니다...,0
jordanpark3811,대한민국 법 최고네요!!!! 아주 감동입니다~^^ 판사 검사되려면 법학원3개월만 속성으로 하면될까요?,0
kml3337,저런 놈들은 신상 다 까발리고 징역 20년은 때려야지,0
user-er1wm7mo2b,무죄아니면 집행유예다 판사님들은 공명정대하시니까요 피해자가 아닌 범죄자들을 위한 개한민국의 판사님들~~~~,0
user-k399,절대 법앞에 평등할수없는 개한민국 법조계!! 12년? 13년? 판사 자신들의 딸이 당했어도 같은 판결을 내릴까?...피해자에 대한 진심어린 사과한번없고 본인 죄목 검색하고 걱정하는게 정상일수가 없는듯!! 싸이코패스검사도 해봐라!!,0
user-qv5qh4wj3n,무기징역 때려라. 저건 사람이 아니다.,78
zevines,이건 판사의 문제가 아닌 국내 법체계의 문제 즉 형법을 국회의원들이 개정해야 하는 문제입니다. 그런데 문제는 가해자? 인권 존중하는 시민단체들과 형법은 자기 정치적인거에 도움이 안 된다고 생각하는 국회의원들 문제죠. 대륙법이 아닌 형법은 미국처럼 형량을 누적할 수 있도록 해야 합니다.,0
user-hq7cv7vf7y,영상 보고도...판결이 이럴수가 있나..와...무기징역이 답인데...본인들 딸이 그랫으면 어쨋을까 ?,1
user-kt3nl6yp3y,"술 마시고, 심신미약이라는 이유로 감형해 주는 일 없이 제대로 처벌해야죠. 이런 ㅆ레기들은 세상에 존재할 가치가 없습니다. 오늘도 대한민국 바뀌지 않는 게법에 그저 개탄스러울 뿐입니다.",85
ahnheejoo3041,형량이 무겁다고 정신인 이네요 저건 형량을 아주 무겁게 곱으로 24년 형을 줘야 한다,2
him317,"한국의 사법제도는 오직 피혐의자, 피의자, 피고인, 수형자를 위한 인권이 거의 대부분이고 피해자에 대한것은 거의 전무인 상태 이게 정치 경제 권력자들이 언제든지 피의자 피고인이 될수 있기에 제도도 이렇게 만든것임 게다가 판사들은 이런제도 하에서도 더욱더 관대하게 법을 적용함. 저렇게 갑자기 뒤에서 가격하면 ufc선수도 졸도함.",0
Angkimochi77,저런 미친 사이코때문에 한 사람의 인생이 아예 뒤바뀌었는데 뭔 처벌이 저따구야?? 형량을 올려야 저딴 사이코들 사회에서 다시는 안볼수있다,17
user-ws2cl9dz7s,항소심 판사들 왈:어~그래! 형이 과하긴 했어! 에~! 반성도 잘하고 있고~! 나이도 어리고~! 에~! 징역 2년에 집행유예 3년~! 판결은 이걸로 끝! 이따 한잔하조고오!,1
user-xd1bo5cu8f,판 검사들 자기 딸이 저렇게 당해도 12년 밖에 안줬을까 저런놈은 살인죄로 적용해서 사형이나 무기징역에 처벌해도 모든 국민들이 잘못된 처벌이라고 말 할사람 아무도 없다,0
_cobham,저런 짐승만도 못한 인간에게 저따위 판결을 내리다니..,36
hdscc360,맞고밟는 순간에 하반신마비온듯 무기징역해도 피해자는 분할듯하네요,0
user-cz4jv6pw9u,저런 인간쓰레기는 평생 감빵에서 나오지 못하게 해야한다 사형.무기징역이 정답이다 여자분을 들쳐업고 사라져놓고 저놈 스스로 성폭행 검색했다는건 7분간 안보였을때 무슨짓을 했는지 안봐도 모든사람들 추정이 가능하리라 본다 무조건 무기징역 보내라,63
user-xr1en3cj3g,일단 하루 빨리 판사들 다 해고 하고 AI로 대체가 시급해 보이네요,0
user-eo4fo5gg5l,본인들 딸이 당헤도 12년 담당하시는 판사님 너무하시네요 40년 정당 합니다,0
user-ej6sk2sb4r,저 인간은 나오면 또 범죄 저지를것 같은데 반성도 안할듯 무기징역이 맞지 않나 ... ㅠ.ㅠ,1
user-cw8ru2jl7g,"성범죄 유무 밝히기 위한 피해자 옷 전체 유전자DNA추출검사 안했습니다. 최환판사는 사건과 직접적인 관련이 없다며 서면(글씨를 쓴 지면)으로 제출해라고 했습니다. 법정에서 판결하는 판사는 가해자의 인권, 편만 들어 줬습니다. 최환판사는 범죄자편 입니다. 전국피해자협회에 의해 판사가 승진되는 시스템으로 가야 성범죄가 많이 없어집니다.",1
user-yu7xi6vm9w,우리 자비로우신 판사님은 또 솜방망이 처벌로 사회에 늑대를 풀어놓겠지,0
user-zd5go5ut8n,이거 중형 안 주면 진짜 판사는 챗cpt로 대체해야 한다 반드시,1
user-yb6ts1gc3c,ㅋㅋ 법수준 대단하다. 뇌손상이면 일상생활 불가능한 수준일텐데 그럼 사는게 의미가 있나? 그 정도면 살해랑 비슷한데 그마저도 12년형 ㅋㅋㅋㅋ 지들이 당해봐야 형량 올리지 그 전에는 절대로 안올릴듯,2
jiminsong7,고작 12년이냐 판사들아 쫌! 너네자식이 당했다생각해봐라,0
user-cw8ru2jl7g,"항소심 맡고있는 최환 부장판사가 전국변호사협회에서 98점의 높은 점수를 받았지만, 서면 돌려차기폭행 재판에서 피해자의 변호인이 CCTV가 없는 8분동안 성폭행이 의심된다며 피해자 옷에 유전자 DNA검사가 필요하다고 말했지만, 최환 부장판사가 이를 받아들이지 않았습니다. 최환 부장판사는 민주적인 사건에는 의로운 판사입니다. 하지만, 성폭행 재판때는 가해자편을 엄청 많이 듭니다. 피해자의 고통을 전혀 생각하지 않습니다. 유전자DNA검사가 성사되었더라면 징역12년이 아니라 30년 이상의 징역형을 감빵에 쳐 넣을 수 있었을 텐데 말입니다.",1
user-xf7dd5jx3l,판사놈 정신 나갔나봐 50년 때려야 정상이지,1
fgr2536,권력자들의 악행!!전과자를 풀어줘야 다시 범죄를 저질러서 자기들 일거리가 생기지 법이 엄격하면 범죄 절대안일어난다! 그럼 판검사들 존재가 무의미하지! 이처럼 이유는 간단명료해!!!,0
mario5004,역대급 잼민이 징역안에서도 돌려차기하다 추가 받기를 간절히 기도한다,0
tjddnjs8531,"예전에 태권도를 가르쳤던 사람으로서, 저 남자는 무기징역에 처해야 옳다고 보여집니다.",1
user-qj9ql2tn4z,대체 판사색희들은 보복이 두려워 맨날 저러는거냐 지네 딸내미가 저런 일 당해도 12년줄려나,1
y2ktoo232,저거는 사람이 사람한테 할수 있는 행동이 아니다. 징역이 중요한게 아니고 몸전체 관절 마디마디를 산채로 끊어버려야 된다.,58
