작성자,내용,추천수
estellepark2786,"본 사건 뉴스에서 보고 너무 끔찍해서, 잊혀지지가 않았는데, 피해자는 얼마나 큰 고통속에서 살지.. 마음이 너무 아파옵니다. 그런데 형량이 고작 12년이라니,, 그게 더 충격적이었습니다..",1.1천
user-bw8ic2ed7i,꼭 그 판사 가족들도 똑같은 일 당하길,1.6천
user-hk2ng2by6b,꼭 사법집행하시는분들 가족분들에게도 이런일이 일어나셔서 똑같은 판결을 부탁드립니다.,495
user-xz6he1ty8l,형량이 고작 12년이라고? 말이 돼냐ㅡㅡ 진짜 적어도 무기징역은 줘라 제발.. 피해자와 가족들은 무슨 죄냐 진짜 화가 치밀어오른다,74
user-rb6kl7xy7c,판사님 가족분들 이 피해자가되어 만나시길 그래도 이런 판결이 나올지 궁금하네 진짜,724
user-dg5ln6us2m,"피해자가 범인이 잘못을 뉘우치고 있다고, 진정으로 용서를 구하고 있다고 느끼지 못하는데 왜 판사가 뭔 자격으로 지들이 그렇게 판단하는 건가요?? 감형 좀 제발 하지 마세요~~~ 감형 사유 좀 제발 한번이라도 피해자 입장에서 생각 좀 하고 판결 좀 내립시다!! 왜 잘못을 저지른 인간을 입장에 서서 판결합니까?? 그것이 억울하면 죄를 짓지 않으면 됩니다!!",202
user-ct5cd2yv2f,12년이라니ㅠ 판사들 정말 반성해야지 한사람의 인생을 망쳤는데..이러니 강력범죄가 계속 생기는거지,846
DAWN_w,꼭 재판한 판사들 자식도 돌려차기 맞으세요,413
user-in8eb7sk6n,저는 죄인들에게 인권을 논한다는 것 자체가 있어서는 안된다고 생각합니다! 왜? 저런 자에게도 판결을 저것밖에 안 내리는건지....판사님 제발 죄인들 인권 없어요~~법 잘 지키는 자. 질서 규칙을 잘 지키는 자 선하게 사는 자들에게만 인권 적용해 주세요,482
user-nh5dz5xp6y,"범인못지않게 판사에게 더 화가나네. 악질범죄자는 반성이란걸 모르고, 진정성 1도 없는 억지 주장에 설득당한 판사의 판결에 분노가 치민다",683
user-zw8me6eb3x,이런범죄는 고의적이고 의도적으로 저지른 범죄인데...최소 징역 30년이다.재판부 정신차려야 한다,51
jaesuklee9921,"전과4범이고,저렇게도 잔혹하게 사람을 짓밟았는데 징역12년?저렇게 젊은 나이에 복역 후 나와서 또 제2,3의 피해자가 생겨 피해자들을 불행속에 살게 하라는 재판부의 판결에 선량한 국민은 두려움에 떨어야합니다.사형시켜야지요",80
user-qc9vq4xi7x,부디 형을 때린 판사에게 똑같은 일이 일어나주기를..,36
user-hi1qf4ze2c,판사님~판사님~가족이 당했다면 딸이나 아들이 당했다면 반성 하세요~다들,123
user-td6vz4oh8x,판사가족들이 똑같이 당했으면 어땠을까요? 판사님?!!!,568
mihyejung4725,판사 가족들도 꼭 이런일을 당하기를 빌겠습니다,23
user-ot6cx9og9x,저런 범죄자들을 만드는건 법을 집행하는 판사들의 목도 하다고 봅니다 반성도 없고 형량줄이기만을 위한 개인적 주관일뿐인 사람을 12년도 어이없는데 8년으로 줄였다고 정신차리십시오 판사들 당신은 법을 정의롭게 판정할(시민의식) 의무가있습니다,11
Lucia-mw4mp,10년정도 뒤에 나와서 진짜 누구하나 죽이겠네. 우리나라는 진짜 가해자를 위한 나라냐? 피해자는 영구 장애가 남고 저런 중범죄자는 사지 멀쩡히 금방 다시나오는 게 이게 무슨... 판결이 왜 꼭 저모양이지,14
user-ep7fe4qn7r,우리나라 판사들 억울한 판결 할때마다 판사 가족이 똑 같은 상황이 생겼으면 하는 생각… 많은 사람들이 할것이드,111
Lucky-vf9lv,"이쯤 되니, 판사의 판결을 (피해자가 억울하지 않도록) 현명하게 판결하는 누군가가 있으면 좋겠다.",8
user-pc5kl1ss4f,판사님 가족들도 똑같은일 당했으면 좋겠네요 진짜 소름끼치는 판결이네 범죄 저지르고싶으면 술먹고 하면되는거네요? 와.. 구역질난다,33
YOU_joung_1004_love,"아~~ 술먹고 난 후 기억 못한다고 하면 되는구나... 그럼 처벌이 약해지거나 없어질수도 있는구나... 진짜 어이가 없어서 ""판사님 꼭 똑같은 가해자를 만나서 가족들이 똑같이 당하라고 기도하겠습니다"" 진짜 뭔 이런 그지같은 판결이 다있어요. 그냥 러시아에있는 블랙돌고래 교도소에 보내세요",279
user-so5hb4iq3h,저렇게 악랄한 놈들이 술취해서 그랬다고 하면 더 강력한 처벌이 있어야 한다!! 재판은 누구를 위한거냐! 검사나 판사는 일을 그때위로 할거냐! 아무도 대꾸한번 못하게 하는 법조계도 시간이 흐른 후에라도 형량이 죄질에 비해 현격히 차이나거나 국민들이 이해하지 못할만큼의 형량이 나오게 한다면 끝까지 책임을 물어 그들에게도 책임을 지워서 대충대충 형량을 내리지 못하고 열심히 일을 하게끔 만들어야한다!! 모두 다 그렇지는 않지만 정치 검찰이나 판사들 혹은 그 자리의 명예만 가지고 싶은 혈세충들은 일반 개인의 일들에는 신경을 쓰지 않는다는 것이 큰 문제다!!,6
PARK34371,아무 죄없는 일반인을 평생 장애가 남을지 모르게 만들어서 인생을 망쳤는데 형량이 시바.....여자친구한테 하는짓이나 뭐를봐도 싸이코패스인데 저런 인간은 언젠가 살인도 저지른다 사회랑 격리시켜야한다,8
user-uh3wb9bn6k,우리 자에로운 판사님들이 용서해준 결과물이라 생각합니다 전과 18범을 저렇게 풀어준게 있을수 있는일인가요?,7
Pujin.,여성분이 당시 그리고 추후 얼마나 힘들었을지 감히 제가 다 헤아리지는 못 하겠지만 어느정도 상상이 됩니다. 정말 세상이 아직 너무 무섭다는 걸 느꼈습니다 가해자는 말 그대로 가해자입니다 가해자의 형량은 늘리는 것만 있지 감형이라는 단어는 억울하게 누명을 씐 사람에게나 말할 수 있는 단어입니다 또한 술 먹고 기억이 나지 않는다 라는 증명은 맞다고 표현할 수 없습니다. 비틀거리지도 않고 술에 취해있는데 어떻게 돌려차기를 합니까. 여성분의 정신적 피해보상 다 지원해주시고 가해자새끼는 똑같이 정신적 피해와 지옥같은 삶을 즐기다 저 세상으로 가시길 바랍니다,2
gbk9224,가해자에게 한없이 관대한 우리나라 검판사들에게 피해자가 당한 돌려차기를 한번 맞아보시기를 추천드립니다.,9
user-hf7xm9kt6t,12년..답답하네요..피해자분들이 느낄감정을 알수는 없지만 12년을 고통속에 사실거 같고 12년이 지난후는 더더욱 공포속에 살아갈거 같습니다..비정상적인 사람에게눈 정상적인 판결이 나오길 바랍니다..,1
user-vx2dy5ce3v,사형을 구형하고 최하 무기징역이 나왔어야했다~왜 사회에 저런사람들이 돌아다니게 12년을 주는가...ㅡㅡ,20
jungyoon7349,저런 범죄자도 여자친구가 있다니 ㅠㅠㅠ 하 .. 거기다 판사분 진짜 어떤 감정이 상실된 사람인가,227
TheParkparazzi,이런거 보면 판사들 다 짜르고 AI판사를 채용하는게 맞는것 같다. 그럼 누구에게나 공평한 판결을 내지 않을까..,28
sungwon89,진짜 아무리 그래도 판사.검사 가족들은 이런일이안생김ㅋㅋ존나신기함,12
qkrtnwn,16:35 이미 증거도 다 있고 죄를 인정하는게 당연한거지 그게 형량을 줄여줄 만큼 특혜를 받을 일인가??,4
kooksdiary4762,판새님들이 그렇게 풀어줘서 저지경까지 왔고 다음은 살인인데 또 감형 해주셨네,12
user-gr5ts3ne2e,모든 증거가 저 사람의 죄를 말하고 있는데 고작 반성문 진심 담기지도 않은 그 종이쪼가리 몇장으로 8년이나 감형이 되다니... 법을 잘 모르는 일반 국민들도 저 사람이 반성하지 않는다는 것쯤은 압니다. 앞으로 저 사람이 세상에 다시 나와 피해를 입게 될 누군가가 너무나도 걱정되고 두렵습니다.,1
hush1004,ㅋㅋㅋㅋㅋㅋ판결 진짜 기가찬다,64
ddhk771,판사놈들도 지들이 판결낸 범죄자가 사회에 다시 나와서 살인저지르면 판사들도 그에대한 책임을 져야한다,12
yu4575,우리나라 법이 정말 한심하다 아니 법이 문제가아니라 판결을 낸판사가 정말 한심하다,8
moveon2,"저 전과18범 가해자는 무기징역해야하고, 신상공개도 해야한다. 이게 안전한 한국인가? 사법부는 국민들을 보호해야한다!! 국회의원들은 법을 개정해야한다!",1
user-eq4ie5vo1h,"Biastophilia 낯선사람과 싸우는것에 대해 흥분을 느낌(강간도...). Agalmatophilia 조각, 인형, 마네킹과 같이 움직이지 못하는 것에 흥분을 느낌. Abasiophilia 휠체어를 타거나 붕대를 해서 움직이기 힘든 사람에 흥분을 느낌. Erotophonophilia 살인을 하며 흥분을 느낌. 성적 쾌락을 느끼는부분이 상상할수 없을만큼 다양합니다 저도 지금 소송 준비중에 있는 형사사건이 하나있는데 판사가 솜방망이 처벌 내릴까봐 두렵네요",14
lynlynrhoro5735,미친거 아니냐. 전과가 저렇게 많은데 저정도면 그냥 영원히 사회에서 격리시켜야 하는거 아니냐? 12년이면 감형받고 해서 10년도 안돼서 나올텐데 그땐 사람 하나 죽겠구나. 욕이 나온다. 그리고 저게 무슨 자백..? 도망다니다가 Cctv 다 찍히고 체포돼서 끌려온건데ㅋㅋㅋ 지발로 찾아와서 자백한것도 아닌데 감형?,8
user-ij7yf3jo9y,"술먹고, 상해, 치사, 운전,살인등 심신미약이 아니라 가중처벌이 나와야한다고 생각한다. 술먹고 기억안난다 하면 그게 끝인가? 판사들이 썩어도 너무 썩었다.",3
user-ve3qw3sg8j,판사가 필요없는 이유. 저런 악마들은 사형시켜야 함 피해자분 힘내시길 바랍니다.,1
user-fp2df7io4w,사각지대에서 100프로 성폭행 하려고 한거지 팬티도 한쪽다리에 걸쳐져있다고하눈데 이건뭐 100프로지 ㅡㅡ 저런놈을 12년구형준 판사도 대단,116
user-hh5oh7xh4i,저런말도 안되는 판결을 내리는 판사 가족이 꼭 당했으면 하는 바램..그럼 저따구로 형을 때릴까?,28
finalfestival4673,세상 밖에 나오게 하면 안될 자를 판사는 무슨 생각으로 저렇게 양형을????......검사들은 어떻게 재판 과정 중에 이야기를 했을까?,2
user-gx5lz8xc7n,대한민국 판사놈들...자기 가족이 당해봐야 제대로 판결을 할것인가??? 판사.검사 ...다 파면시키고 다시 뽑아라~~!!,197
user-zb1gg8jw7z,화가난다 어떻게 저 쓰레기같은 전과자놈이 12년 밖에 안 나오냐 재범100% 저지를꺼같은데 판사도 공범이라보고 처벌해야됨,6
pwilly-pr4ub,고작 12년 판사가 저 돌려차기한 쓰레기랑 뭐가 다른가요 출소해서 또 다른 사람 죽이면 저 판사가 책임지나요 진짜 저따위 판결을 법 공부 했다는 사람이 내릴 판결인가요 꼭 판사가 저 쓰레기한테 돌려차기 맞아봐야 정신차릴려나요,3
user-ey2sk9dx8i,형량이 말도 안된다 진짜ㅜㅜ 사회에 발도 못디디게 해야되는데 어휴,147
roadfightermr.878,"판사가 범죄자 양성 조력자다!!!~~~강간 전과 18범이 될때까지 감방에 안썩게 만들어준 판사들도 처벌받자~~뭐햇냐?? 판사 니들이 강간 전과 18범될때까지 계속 범죄인을 풀어주고, 또 풀어주고 했잖어!!! 판사가 사회악을 조장하네!!",3
user-jm7zr5bz1p,가해자는 징역살고 사회생활하면 끝인데 피해자는 평생 정신적피해보고살아야되네 ..,140
basiliokim6902,양형 기준이 저 따구라니.. 지나가는 초등학생한테 대리판결 시켜도 해당 판사보단 잘하겠네. 판새 딸이 저렇게 맞아서 생사를 오가도 8년씩이나 감형해 줄 수 있는지 참 궁금하네.,4
user-zy5og4yg5l,꼭!! 하늘이 있다면 저렇게 가만히 나둔 판사들 가족들이 똑같이 당해서 억울한 피해가 생겨야! 판사 자격 없다는걸 알아야지!!! 그리고 우리나라 법 부터 문제!! 증거 자료 다 있음 !! 그냥 사형 시키거나 악질 범죄자들에게 국민들 세금으로 왜 저런 인간들 밥을 먹이냐고!!,59
user-kj3wf4ek9h,우리나라 사법부도 정말 쓰레기가 되었네ᆢ욕도 아까운것들이다ᆢ우리나라 검사 판사 이대로는 정말 안된다ᆢ잘못한 판결과 조사한 검사 판사는 다시는 법정에 쓸수없도록해야한다ᆢ변호사도 할수 없도록 스스로 책임감을 가질수 있도록 법을 만들어야한다ᆢ절실하게,3
nicolekim393,판사가 미쳤군 ㅠㅠ 지 여친한테 하는꼴 보면 출소하자마자 살인 날 판국인데 가식적 반성문에 8년 감형이라니 ㅠㅠ,3
user-eu6fm6cr6b,"미친 거 아냐 절대 봐주면 안되지. 전과가 한 둘이 아니고 출소후 짧은 기간에 범죄가 재발했는데 고작 본인의 죄를 인정했기에 정상으로 보아 감형해준다고?? 반성문 보니까 정신 못 차렸드만 협박 편지도 보낸 마당에 방송까지 나왔는데 여자친구, 피해자 제대로 보호해줄 거 아니면 절대 못 나오게 판결해줘야지. 처음 뉴스 나왔을때도 충격이었는데 뒷배경 알고 나니까 더 충격적이네 사람 아니다 저거.",16
user-si3nl6gs8g,아휴 속터져요 이런 판결 가해자도 벼락맞아 ㄷ졌으면 좋겠다요 반성문은 미쳤다고 판사한테 바치냐고 판사한테 잘못했냐고,69
user-km7wm6wx7e,감형이 말이되나 살인미수 자체가 살인자다 피해자를 두번 살인하는 물러터진 법 ~ 정말 답없다,26
user-some_see,댓글에 12년이라고 하는데 위대하신 대한민국 판사님께서 범죄자가 죄를 인정한다고 8년형으로 줄였는데 성범죄자가 또 형을 줄이기 위해서 항소를 하셨답니다..ㅅㅂ,119
rkdwjsdu,판사는 출소한다고 과연 교화가 될 사람으로 보여지냐????그냥 평생 사회와 격리를 시켜야지 나오면 큰일 나겠다.,6
user-cp9lw1fz9k,재판부는 대체 누구를 위해 존재하고 판단하는건지…참으로 개탄할지경! 판사란것들 법들척이며 상식적이지도 않는 피의자편들면서 형량때리는 같은 범죄자! 판사들부터 자격검증필요해보이네 맨날 법령이나 공부하지 죄의 무게는 글로만 정하는게아니다 선진국좀.보고.배우길!,4
sunippang5834,이 나라 사법부는 미쳤다 그들의 판결로 인해 피해자가 고통받고 재범이 일어난다면 오로지 그건 재판부의 잘못이다,0
user-qt3zl3bx2u,판사님 생각 잘하시고 판결하세요? 짜쯩납니다. 악질 범죄자 인대 형량이 적습니다.,158
sam-qh9ru,판사 가족이 똑같은 일 당했으면 좋겠다는 댓글 싫어했는데 이제 공감하게 됐다 31살이 전과18범 되도록 방조한 사법부 범죄하기 좋은 나라 대한민국,2
morigeratiofides3856,12년이 말이되냐.무기징역 해야지.저건 절대 사회에 풀어놔서는 안된다,1
user-jh2kn8nx6n,대한민국 판사는 개판사가 아직 많구나,52
user-iv4jb9jl7s,아니 반성문을 제출하기만하면 다 반성으로 받아주는 거임? 법 문구하나하나 다각도로 해석을 파고들어 공부하는 사람들이 범죄자 전문가들이 반성하는 말이 하나도 없다는데 뭘 반성했다고 해석하고 감형시켜주는 거지? 안 읽었으니 가능한 얘기 아닌가. 안 읽고 걍 반성문 잦게 제출했다는 얘기만 듣고 반성하는군해서 감형 때린 거 아닌가. 바빠서 못하겠으면 보좌관 시키던가 따로 고용하던가. 이게 학교 깜지도 아니고 반성문 장수보고 감형의 여부가 결정나는 거임?,92
user-ou9gw4tq6n,어떤 검사와 판사 인지 나라를 믿는 국민만 바보로 만든다. 살인미수 와 다른 범죄까지 해서 무기징역을 했어야 된다.,1
user-cw8ru2jl7g,가해자편인 대한변호사협회를 없애야 미국처럼 강력범죄자를 120년 징역형을 감빵에 쳐 넣을 수 있습니다.,3
user-zn4bo9ug1x,술 마셔서 기억이? 그냥 저놈 사형이 답이다!!! 12년 판결낸 검사 판사야! 꼭 니들이 겪어봐라!!! 그리고 저놈 출소하면 너희이웃이 되거라!!!!,15
user-lh3wp5bw4j,사람 죽여 팰만하네 12년살고 판결 진짜 어이가없네,20
faraday88,교도소가 편해서 그래 ㅉㅉ 외국처럼 하루하루 목숨 걸고 사는 교도소면 무서워서 못하지 쟤 분명히 징역 다살고 나오면 사고 또 친다,72
user-je7ei4xf5l,사람을 죽여도 10년이하가 많은데 영상이 얼마나 끔찍했으면 12년 했을까? 우리나라는 판사가 범인들한테 관대해 그러니 항소하면 줄여주지,13
BDGT-fx8ic,너무가볍게 받았군... 징역 12년 쯥 검찰구형 얼마나 때려길래 12년인가? 점점 흉악해져가는 이 사회가 무섭기만하군요..,8
sungaeleeify,우리나라 2차 3차 범죄는 판사들이 만들어낸다 저 놈의 공범은 판사이다 12년 후 피해자의 명복을 빈다 (무서운 표현이지만 예견 할 수 있는 일 끔찍하고 열받는다),17
sky-jl3xf,판사들이 문제다. 요즘들어 판사들이 범인을 감싸주어 범죄가 늘어나는 것 같아 ...화가 난다.,0
ohyeah12345,판사도 참ㅋㅋㅋ에효 대단하다 가족이 저렇게 당해도 똑같이 12년 주려나?? 아 진짜 대한민국 ㅋㅋ법 답이없다,6
user-rm9kz2xe6v,cctv에 저렇게 명확한 증거가 있는데 단지 가해자가 반성문을 제출했다는 이유로 8년이나 감형을 해줘요? 제출된 반성문도 죄다 본인의 범죄를 변호하기 위함이잖아요? 이러니 이 나라의 형법이 쓰레기라는 거에요.,1
user-cr2cf7zf4o,무기징역도 안하고 이게 법이냐??,18
rainanew3920,왜 반성문을 판사한테 써? 피해자한테 써야하는거 아님? 진짜..120년도 모자란다.,2
joyhit4992,12년 때려도 다 안살고 나올수있지 어렸을때부터 범죄 저지르던놈이 깜방갔다왔을때 피해자를 가만 놔둘까? 견찰이나 판사색이나 진짜 답안나오는건 여전하다 살기좋은 대한민국같은 소리는 개나줘야지,4
escape9875,판사들은 다 없애고 AI로 다 바꿔야한다. 판사라는 직업자체가 모순덩어리다.,11
user-wp5ge6dv1w,술을 마셔서 기억이 없다? 그럼 언제든 또 저런 범죄를 저지를 가능성이 농후하다는 건데. 징역이 아니라 영원히 사회에서 격리해야죠.,91
user-gk6or3wy1g,범인 대가리 계속 12년동안 매일 쳐맞는다 하면 12년 징역 인정하겠음,56
joosoo1156,판사도 정말 똑같이 당해봐야 됨!,8
user-hm3cm1rb2l,판사가 어떤인간인지 사리분별을 못하는것 같네 판사도 성적으로 임용할게 아니라 인성으로 뽑아야...공부 잘한다고 재판 잘하는거 아니다아이가 저런 사건은 법에 문외한인 나도 최하 징역20년 감이다,0
user-of9ku8br2n,세상에 나오기싫어서 범죄를 저지르는것같은데 제발 무기징역 때려라,1
jencello72,피해자는 용서못하는데 판사가용서하는 대한민국법은 이해불가~~,0
jmp2561,제발 사형좀 내려라..그리고 우리나라는 현명한 판사가 단 한명도 없는거냐..저런넘들은 제발좀 사형 시키자.,2
user-vb6xj3cj3f,출소하면 또 사람패거나 죽이고 다닐텐데 저런새끼는 무기징역줘서 사회로부터 영원히 격리시켜야하는거 아닌가요 갱생의 여지가 없는데 왜자꾸 기회를 주고 피해자를 계속해서 만드는건지 이정도면 판사도 가해공범 취급해야할듯해요,0
user-ld1wo3bs7e,범인도범인이지만 형량을 줄여준 판사새끼도 똑같다 아진짜 피해자분만 불쌍 ㅠㅠ,22
dodohwang3668,판사야 너도 니가족이 저런일을당해 지옥의 고통을 꼭 맛보길바란다 그리고 내가족에게 저런일이 생긴다면 저런 개판에게 판결을 맡기기보다는 내가 심판한다 묵직한 쇠망치로 똑같은방법으로 되갚아주고싶다,1
aa3881aa,피해자가 판사의 가족이나 지인이였어도 형이 12년만 나왔을까? 저런건사람도아니다 언론으로 계속배우고 범죄인은 늘어나는데 사형제도 부활하고 제발 세금조지지말고 바로죽여라,11
user-my5jl5pv4p,12년후에 판사가족이 꼭당하기를 간절히 바란다.,0
kyungsukyoo1376,판사들도 소시오패스가 많을 거다. 저놈 감형해준 판사가 과연 양심에 가책을 가지고 인생 살아갈까?,2
at1457at7..,우리나라 판사들 뇌피셜 손을 봐야 합니다 반성문에 의미도 모르는 그저 반성문 만 수차례 내는 것만으로 반성했네 로 판단하는 피해자 두번울리는 개탄스럽습니다 저런 부류는 절대 교화안됩니다,6
wkwjk6030,왜저런자식들을 감형해주는거지 평생 트라우마로 남을텐데 이나라법은 노답,1
user-ki7tn2id3q,평생 불안해서 어떻게 살아가게는지 ㅡ.ㅡ 법이 법같고 판사가 판사같아야지 ㅡ.ㅡ,0
wsseo7610,나는 저런 범죄자가 활개치는 이유로 첫번째가 판결을 하는 판사들에게 있다고 생각한다.,2
MC.AngUng,"개판사,개판부,개법민국,국개의원 범죄자를 살게하는 힘의 원동력 진짜 매번 나오는 얘기지만 선량한 시민은 살기 힘든 나라임!",0
user-uv2bj8rq3s,여성이라는 성별을 지닌 이유로 범죄에 당하는걸 당연시 여겨야 한다는것과 뭐가 다르냐. 판사들 지능수준 보다 국민들이 더 본래 법 취지에 가까운 올바른 판단 내리겠다.,2
shinfamily4758,무기징역이어야 하는데 겨우12년? 이봐 판사 당신네 기족이 당해도 이렇게 판결 할 건가? 저게 반성문이야 억울하다고 떼쓰는거지 저건 사람도 아니야 저렇게 사람 패고 죽여봤자 몇년 살고 나올건데 뭐 그리고 거기서 먹고 자고 우리 세금으로! 술 마셔 기억이 없다? 술 취한 사람치고 너무 똑바로 걷는거 아니냐 그리고 술 취한 놈이 그렇게 준비를 딱 하고 정확히 머리를 찼다는 게 말이 된다고 생각해?,0
sq3727,징역 12년 진짜 제정신인가 ㅋㅋㅋ 범인 출소하면 피해자는 물론이고 전 여자친구 분은 진짜 거의 표적이다.. 저런 놈이 또 나오면 얼마나 더 대범해져서 더 큰 범죄를 저지를건지는 생각을 못하나,0
XoXoWooJo,사람을 죽일뻔해놓고도 일말의 양심도 없이 항소한 미친살인미수범에 다수 전과자가 사형이 구형되고 집행되길 바랍니다 이래서 cctv가 있다고 안전한게 아니다 결국 저렇게 전과자가 마음먹고 해하려고 한다면 피해자는 다시 발생할수밖에 없고 저 다수전과범죄자는 사회로 나오게한다면 판사도 범죄를 저지르는거다 9:26 인간은 고쳐쓰는거 아니다 교도소에서 저따위 공기도아까운걸 교정을 시킨다? 웃기지도않는다 범죄자 인권따지는것도 기가 찬데 저런 다수전과범을 사회에 나오게한 판사도 처벌받아라 16:35 ???????????? 판사 누군지 진짜 ㅈㄴ 궁금하다 아 그냥 범죄 저질러놓고 지가 뭔 범죄저지른지 알고있으면 8년깍아주네? 사람죽일뻔한 전과자여도?,1
user-tn3zj7ht7h,판새 가족이 당했어도 저런판결을 내렸을까? 갱생의 가능성이 없는 악질 범죄자를 형량 줄여서 저렇게 사회에 또 풀어놓는군. 판새가 문제야,0
user-fx7gr2gz4k,저게 인간이라고ᆢ사형해야지ᆢ판사는 어떤생각으로 저런 판결을 할까요ᆢ,0
user-pp1hv4qh6n,방에만 갖힌채로 책만 달달외워서 고시에 합격하여 판사가 되었으니 인간적이고 감성적인 판단이 제대로 서겠냐...구형의 반을 선고하다니.....,2
user-um2if3hu1x,판사 니마늘 딸도 똑같이 당하면 12년 판결 나기를~,28
user-tn2gd9yt7p,판사들은 지들이 형량을 너무쎄게 줬다는 원망같은거 덜라고 또 같은 죄를 짓고도 돈많은 집 사람들은 형량 적게주는 판사들이 있으니 그에 맞춰 다 형량 줄여주나본데 피해자좀 생각하길 돈쳐 받아먹는 판사들도 문제고 아주그냥 문제다 문제,1
leaderstrongman3528,무기징역 때려라. 그리고 피해자나 여자친구에게 접근하면 바로 다시 감방가도록 만들어라.,0
user-xh3rx9us2u,판사 딸 자식도 한번 당해봐야됨..,25
hallyang0920,반성하는 게 감형 사유가 된다니... CCTV 다 찍혀서 부인은 못 하고 말만 반성문이지 거의 협박편지 같은데 저걸로도 감형이 되는 게 말이 안되지만 거기다 항소까지 했다는 게 더 말이 안되네요. 그러면 반성을 안 한다고 보는 게 맞고 감형할 사유가 없는 것도 맞지 않습니까.,0
user-kj7qv5iq1d,판사 자기 딸이 피해자라도 저딴 감형을 해줄지 궁금,1
user-fe5ly7qo9q,신기하게도 판사 주위사람들은 강력범죄가 절대 읽어나지 않는다 사람은 직접 경험하지 않고선 절대 그 고통을 모른다 직접 연계되는 가족들이 강력범죄를 당해봐야 평생 그고통을 알지 책 줄줄이 외워서 내린 판결 시발,1
