작성자,내용,추천수
user-qn9re5tp4g,판사너희딸이아들이정신차리고 드라마쓰냐? 판사대가리만돌아가지말고현실을 방망이만때리면다냐제발이글이전했으면한다,1
marsix780,일단 자본주의의 나라중에서도 한국같은 경우는 미국과 더불어서 좀 심각한 편입니다. 일단 돈이 왕이면 괜찮은데 돈이 신급으로 올라가면 문제가 발생을 합니다. 법원이던 병원이던 돈이 신급으로 취급을 받게 되는것이지요 사람들 보기전에 돈부터 보니 법원같은 경우는 일단 가해자가 변호사를 선임했는지가 가장 중요한 관건입니다. 반인륜범죄도 변호사 가치에 의해서 형량이 많이 줄어들게 됩니다 이는 너무 대놓고 돈만을 쫒는다는것을 광고하게 되는것과 마찬가지입니다. 이것이 바뀔 가능성은 없다고 봅니다. 조금이라도 이것이 바뀌려면 일단 교도소내 생활이 지금보다는 더 더욱 빡세져야 하구요 교도소에서 제소자들에게 시키는 노동시간을 지금보다 더 많이 늘려서 그들을 괴롭게 만들어야 하며 그들에게 주는 월급은 지금보다 훨씬많이 축소시켜야 합니다. 시급 시간당 300원이면 적당할듯 합니다. 그러면 소문은 금방 퍼질것이고 돈이 신급인데 시급 300원이면 아마도 미쳐버릴지도 모르죠!! 신급 자본주의의이니 예비 범죄자들은 범행을 저지르기 전에 한번쯤은 생각을 해보게 될것입니다.,0
user-eo5sp2uh3o,이게 무슨 개 같은 판결이여! 아메바 같은 판결이다.,0
user-ny2ty6mt6p,내가 판사면 똑같은 벌 줄건데,0
user-bd3yz3if2e,우리나라법줫같은게 나도부부두명한테 폭행당햇고 씨씨티비다확인햇다면서 한명만약식기소 나한텐문자하나미안하단말없는데반성한다고 약식기소? 형량줄이는 악어의눈물왜봐주냐고,0
ejensisolalw4047,아니 추정할게 아니라 정액 유전자 검사하면 되는거 아님?,0
Rinew474,12년이면 거저네 나도 해도 되지 판사야?,1
SFphotopince,이새퀴 나와서 저 여자친구한테 보복 범죄한다. 왜냐면 대한민국은 피해자를 지켜주지 않으니까. 징역12년? 웃기다.,1
user-lo4si7xw1z,판사넘 덤프트럭에 온가족이 깔려서 비명횡사하기를..골튀어나오기를..아마도 절라도 정신박야아 판사일거임,1
